https://www.allmovie.com/movie/la-la-land-v631486, La La Land, Comedy Musical, Musical Romance Romantic Comedy Romantic Drama, Dec 9 2016, 128, USA, PG13, 10,  Adult Language, Damien Chazelle, Black Label Media Gilbert Films Impostor Pictures Marc Platt Productions, Lionsgate Summit, Only Human, Life in the Arts, actress jazz musical [play] musician relationship, High Artistic Quality, Struggling actress Mia (Emma Stone) and aspiring jazz pianist Sebastian (Ryan Gosling) begin a whirlwind romance as they both pursue their dreams in Los Angeles. However their blossoming relationship is challenged when their careers pull them in different directions. Damien Chazelle (Whiplash) wrote and directed this musical love story which co-stars John Legend J.K. Simmons and Rosemarie DeWitt., Ryan Gosling | Emma Stone | John Legend | J.K. Simmons | Rosemarie DeWitt | Finn Wittrock | Callie Hernandez | Sonoya Mizuno | Jessica Rothe | Tom Everett Scott | Josh Pence | Terry Walters | Claudine Claudio | Jason Fuchs | Trevor Lissauer | Marius de Vries | Damon Gupton | Keith Harris | David Douglas | Miles Anderson | Valarie Rae Miller | Kiff VandenHeuvel | Zoe Hall | Dempsey Pappion, Guy and Madeline on a Park Bench | Chicago | Midnight in Paris | The Terminal | Whiplash | West Side Story
https://www.allmovie.com/movie/hell-or-high-water-v658871, Hell or High Water, Action Crime Drama, , Aug 12 2016, 102, USA, R, 9,  Adult Language Violence, David Mackenzie, Film 44 Sidney Kimmel Entertainment, CBS Films Lionsgate, Only Human, , bank bank-robbery desert foreclosure manhunt police poverty, High Production Values, Two desperate brothers -- one a divorced father (Chris Pine) the other a hard-living ex-con (Ben Foster) -- commit a string of bank robberies in order to raise the money needed to protect their family farm from foreclosure. Meanwhile an aging sheriff (Jeff Bridges) tracks the heists in an attempt to hunt down those responsible. This crime drama was written by Taylor Sheridan (Sicario) and directed by David Mackenzie (Starred Up)., Dale Dickey | Ben Foster | Chris Pine | William Sterchi | Buck Taylor | Jeff Bridges | Gil Birmingham | Keith Meriweather | Jackamoe Buzzell | Katy Mixon | Joe Berryman | Taylor Sheridan | Debrianna Mansini | Arielle Holmes | Marie A.K. McMaster | Melanie Papalia | Alma Sisneros | Kevin Rankin | Margaret Bowman | Ivan Brutsche | Marin Ireland, The Town | The Place Beyond the Pines | The Bank Job | Cop Car | Dog Day Afternoon | A Place in the Sun
https://www.allmovie.com/movie/hidden-figures-v643629, Hidden Figures, Drama, Inspirational Drama, Dec 25 2016, 127, USA, PG, 8,  Adult Situations Mild Language, Theodore Melfi, Chernin Entertainment Levantine Films, Fox 2000 Pictures, Pick-Me-Ups | Triumph of the Geeks | Triumph of the Spirit, Fighting the System | Questioning Gender Roles | Underdogs | Women's Friendship, Black [race] mathematics NASA racism rocket women, High Artistic Quality Sleeper, Three female African-American mathematicians (Taraji P. Henson Octavia L. Spencer and Janelle Monae) provide crucial calculations for NASA's space race against the Soviets all while dealing with the racist and sexist assumptions of their white co-workers. Kevin Costner Kirsten Dunst and Jim Parsons co-star in this adaptation of the book of the same name by Margot Lee Shetterly. Directed by Theodore Melfi., Taraji P. Henson | Octavia Spencer | Janelle Monae | Jim Parsons | Kirsten Dunst | Kevin Costner | Mahershala Ali | Kimberly Quinn | Glen Powell | Aldis Hodge | Olek Krupa | Ken Strunk | Ariana Neal | Trey Stokes | Karan Kendrick | Corey Mendell Parker | Ashton Tyler | Donna Biscoe | Jaiden Kaine | Gregory Alan Williams | Maria Howell | Arnell Powell | Ron Clinton Smith | Bob Bost | Tequilla Whitfield | Joe Knezevich | Robert G. Mckay | Dane Davenport | Travis Smith | Scott Michael Morgan | Rhoda Griffis | Frank Hoyt Taylor | John Atwood | Wilbur Fitzgerald | Michael Hartson | Gary Weeks | Afemo Omilami | Cullen Moss | Katie Kneeland | Amy Tipton | Chris Cavalier | Andre Pushkin | Randall Newsome | Kurt Krause | Howie Johnson | David Kallaway | Anthony Collins | Amanda Dunn | Kamryn Johnson | Chanel Young | Brooke D. Singleton | Kate Harper | Brandon Scott McCall, Stand and Deliver | The Right Stuff | Moneyball | Infinity | Contact | Travelling Salesman
https://www.allmovie.com/movie/manchester-by-the-sea-v648783, Manchester by the Sea, Drama, Family Drama Slice of Life, Nov 18 2016, 137, USA, R, 8,  Adult Language Sexual Situations, Kenneth Lonergan, A / Middleton Project B Story K Period Media Media Farm Pearl Street Films, Amazon Studios Roadside Attractions, Only Human | Triumph of the Spirit, Coming Home | Death of a Parent | Dysfunctional Families | Kids in Trouble | Men's Friendship | Parenthood | Reconciliation, , High Artistic Quality Sleeper, A hardened handyman named Lee (Casey Affleck) returns to his hometown in New England after the death of his brother (Kyle Chandler) to care for his 16-year-old nephew (Lucas Hedges) but his arrival also unearths his checkered past. Soon Lee comes back into contact with his estranged wife (Michelle Williams) as he deals with life in his tight-knit former community. Kenneth Lonergan directed this family drama., Casey Affleck | Michelle Williams | Kyle Chandler | Lucas Hedges | Gretchen Mol | C.J. Wilson | Kara Hayward | Matthew Broderick, The Fighter | Ordinary People | The Grapes of Wrath | Frozen River | For Ellen | The Messenger
https://www.allmovie.com/movie/jackie-v649094, Jackie, Drama Historical Film, Biopic [feature], Dec 2 2016, 100, Chile France USA, R, 9,  Profanity Violence, Pablo Larrain, Fabula LD Entertainment Protozoa Pictures, Fox Searchlight Pictures, For Love of Country | Triumph of the Spirit, Assassination Plots | Death of a Partner | Heads of State | Widows and Widowers, America assassination first-lady President widow/widower, High Artistic Quality High Production Values, In the immediate aftermath of the assassination of President John F. Kennedy his wife Jacqueline Kennedy (Natalie Portman) deals with her immense grief while making plans for his funeral procession. Confiding in her close friend and secretary Nancy Tuckerman (Greta Gerwig) as well as her brother-in-law Robert Kennedy (Peter Sarsgaard) Jackie tries to care for her young family as a bereaved nation watches on. Pablo Larrain directed this nonlinear biopic., Natalie Portman | Peter Sarsgaard | Greta Gerwig | Billy Crudup | John Hurt | Beth Grant | Richard E. Grant | John Carroll Lynch | Max Casella | Caspar Phillipson | Deborah Findlay | Corey Johnson | Aidan O'Hare | David Caves | Penny Downie | Georgie Glen | Julie Judd | Peter Hudson | Frederick R. Adler, Jackie: Behind the Myth | Lee Daniels' The Butler | Parkland | The Greek Tycoon | The Kennedys | Grey Gardens
https://www.allmovie.com/movie/lion-v632870, Lion, Drama, Adventure Drama Family Drama, Nov 25 2016, 118, Australia UK USA, PG13, 7,  Adult Situations, Garth Davis, Aquarius Films See-Saw Films Sunstar Entertainment, The Weinstein Company, Triumph of the Spirit, Adoption | Coming Home | Journey of Self-Discovery | Non-Traditional Families | Obsessive Quests, , High Artistic Quality, In this adaptation of the memoir A Long Way Home by Saroo Brierley a five-year-old Indian boy is adopted by an Australian couple after he gets lost in Calcutta. Years later he struggles with his memories of his birth family and decides to begin a search for them. Dev Patel stars as the adult Brierley in this drama directed by Garth Davis. Nicole Kidman David Wenham and Rooney Mara co-star., Dev Patel | Rooney Mara | Nicole Kidman | David Wenham | Tannishtha Chatterjee | Nawazuddin Siddiqui | Deepti Naval | Sachin Joab | Pallavi Sharda, Life of Pi | To Kill a Mockingbird | A Tree Grows in Brooklyn | The Best Years of Our Lives | Lady Bird | A Raisin in the Sun
https://www.allmovie.com/movie/captain-fantastic-v643106, Captain Fantastic, Comedy Comedy Drama, Coming-of-Age Family Drama, Jul 8 2016, 118, USA, R, 7,  Adult Language Nudity Sexual Situations Watch With Your Teen, Matt Ross, Electric City Entertainment ShivHans Pictures, Bleecker Street, Button Pushers | Only Human, Death of a Parent | Dropping Out | Eccentric Families | Fathers and Daughters | Fathers and Sons, , High Artistic Quality, Determined to shield his family from the decadence and distractions of modern life an eccentric father (Viggo Mortensen) raises his six children in a remote forest in the Pacific Northwest. But when his wife commits suicide the kids are forced to interact with the outside world for the first time as he takes them on a road trip to New Mexico for her funeral. Kathryn Hahn Steve Zahn Frank Langella and Ann Dowd co-star. Written and directed by Matt Ross (28 Hotel Rooms) Captain Fantastic made its world premiere at the 2016 Sundance Film Festival., Viggo Mortensen | Frank Langella | George MacKay | Ann Dowd | Missi Pyle | Kathryn Hahn | Steve Zahn | Samantha Isler | Annalise Basso | Nicholas Hamilton | Trin Miller | Erin Moriarty | Hannah Horton | Louis Hobson, Into the Wild | Running With Scissors | Hideous Kinky | On Golden Pond | A Tree Grows in Brooklyn | Rich in Love
https://www.allmovie.com/movie/arrival-v654945, Arrival, Drama Science Fiction Thriller, Alien Film Psychological Sci-Fi, Nov 11 2016, 116, USA, PG13, 9,  Profanity, Denis Villeneuve, 21 Laps Entertainment FilmNation Entertainment Lava Bear Films, Paramount Pictures, Fantastic Reality, Benign Aliens | Chosen One | Haunted By the Past | Heroic Mission | Miraculous Events, alien [not human] close-encounter humanity language language-barrier time translator UFO (Unidentified Flying Object), High Artistic Quality, Denis Villeneuve directed this science-fiction suspense film about Earth's response to a possible alien invasion. After extraterrestrial spacecraft plant themselves at various locations around the globe a linguist (Amy Adams) and a theoretical physicist (Jeremy Renner) must find a way to communicate with the mysterious visitors in order to learn what they want and whether they pose a threat to humanity. Forest Whitaker and Michael Stuhlbarg co-star., Amy Adams | Jeremy Renner | Forest Whitaker | Michael Stuhlbarg | Mark O'Brien | Tzi Ma | Frank Schorpion | Andrew Shaver | Pat Kiely | Sonia Vigneault | Mark Camacho | Julian Casey | Larry Day | Ruth Chiang | Russell Yuen | Sergey Marchenko | Anana Rydvald | Bineyam Girma | Abdelghafour Elaaziz | Abdul Ayoola | Albert Kwan | Joe Cobden | Lorne Brass | Brent Skagford | Dan Duran | Lori Graham | Ola Sturik | Paul-Antoine Taillefer, Gravity | Close Encounters of the Third Kind | Solaris | 2001: A Space Odyssey | Inception | Moon
https://www.allmovie.com/movie/florence-foster-jenkins-v643099, Florence Foster Jenkins, Comedy Drama, Biopic [feature] Romantic Comedy, Aug 12 2016, 110, UK, PG13, 8,  Adult Situations, Stephen Frears, BBC Films Pathé Pictures International Qwerty Films, Paramount Pictures, Just for Fun, Keeping a Secret | Wishes Come True, , High Production Values, Heiress Florence Foster Jenkins (Meryl Streep) longs to become an opera star in 1940s New York despite possessing a horrible singing voice. With the help and encouragement of her husband (Hugh Grant) and a talented musician (Simon Helberg) she finds a very strange kind of success as a performer and recording artist. Rebecca Ferguson and Nina Arianda co-star. Stephen Frears (Philomena) directed this biopic which is based on the real-life socialite and opera singer of the same name., Meryl Streep | Hugh Grant | Simon Helberg | Rebecca Ferguson | Nina Arianda | Stanley Townsend | Alan Corduner | Christian McKay | David Haig | John Sessions, Marguerite | Funny Girl | The Buddy Holly Story | The Pride of the Yankees | As Good As It Gets | Bus Stop
https://www.allmovie.com/movie/toni-erdmann-v658619, Toni Erdmann, Comedy Drama, Slice of Life, Dec 25 2016, 162, Austria Germany, R, 9,  Drug Content Nudity Profanity Strong Sexual Content, Maren Ade, Komplizen Film Missing Link Films, Sony Pictures Classics, In a Minor Key, Fathers and Daughters, connection daughter disguise father father-figure parent/child-relationship secret-identity, , A dedicated career woman living in Romania (Sandra Hüller) gets a surprise visit from her exasperating father (Peter Simonischek) a retired music teacher with an inexhaustible fondness for practical jokes. When she insists that he return home to Germany he reappears in a bad wig as his alter ego "Toni Erdmann" and insinuates himself into her professional circle. In time their mutual aggravation with each other's behavior works to heal their fractured relationship. Directed by Maren Ade (Everyone Else) this comedy-drama took so long to edit that Ade gave birth to her second child during post-production., Peter Simonischek | Michael Wittenborn | Vlad Ivanov | Trystan Wyn Pütter | Hadewych Minis | Lucy Russell | Victoria Cocias, The Descendants | Proof | Trouble With the Curve | M*A*S*H | The Graduate | Adaptation
https://www.allmovie.com/movie/nocturnal-animals-v664200, Nocturnal Animals, Drama Thriller, Crime Thriller Marriage Drama, Nov 18 2016, 116, USA, R, 7,  Nudity Profanity Violence, Tom Ford, Artina Films Fade to Black, Focus Features, Only Human | Unloveables, Betrayal | Breakups and Divorces | Death of a Child | Death of a Partner | Infidelity | Kidnapping | Out For Revenge | Thrill Crime | Treacherous Spouses, art-gallery ex-husband inspiration novel violence, High Production Values, An art-gallery owner (Amy Adams) reads a novel written by her ex-husband (Jake Gyllenhaal) and becomes greatly disturbed by the possibility that the story was inspired by their marriage and that her safety is in jeopardy. Armie Hammer Isla Fisher Aaron Taylor-Johnson Michael Shannon and Laura Linney co-star. Directed by Tom Ford who also adapted the script from the novel Tony and Susan by Austin Wright., Amy Adams | Jake Gyllenhaal | Michael Shannon | Aaron Taylor-Johnson | Isla Fisher | Karl Glusman | Armie Hammer | Laura Linney | Andrea Riseborough | Michael Sheen | Ellie Bamber | India Salvor Menuez | Franco Vega | Zawe Ashton | Beth Ditto | Graham Beckel | Neil Jackson | Jena Malone | Janet Song | Lori Jean Wilson, Allied | Addicted | Hell or High Water | Nightcrawler | Demolition | Enemy
https://www.allmovie.com/movie/fantastic-beasts-and-where-to-find-them-v587742, Fantastic Beasts and Where to Find Them, Adventure Fantasy, Adventure Drama Fantasy Adventure, Nov 18 2016, 133, UK USA, PG13, 6,  Violence, David Yates, Heyday Films, Warner Bros. Pictures, Fantastic Reality | Other Dimensions, Curses and Spells | Mythical Creatures | Priceless Artifacts and Prized Objects | Wizards and Magicians | Writer's Life, adventurer Congress creature fantasy-world magic witch wizard writer, High Budget High Production Values, This spin-off of the Harry Potter franchise jumps back in time to explore the wizarding world of 1926 New York which is being threatened by both mystical acts of destruction and a group of extremist No-Majs (the American term for Muggles i.e. those unable to use magic). Author Newt Scamander (Eddie Redmayne) arrives in the city as part of a global study of fantastic beasts but he gets caught up in this conflict when some of the magical creatures in his care are accidentally released. Katherine Waterston Alison Sudol Dan Fogler Colin Farrell Ezra Miller and Johnny Depp co-star in this fantasy adventure which was directed by David Yates (who helmed four of the Harry Potter films) and adapted for the screen by J.K. Rowling from her own book., Eddie Redmayne | Katherine Waterston | Dan Fogler | Colin Farrell | Samantha Morton | Ezra Miller | Jon Voight | Carmen Ejogo | Ron Perlman | Sam Redford | Timothy Bentinck | Tristan Tait | Jenn Murray | Lucie Pohl | Peter Breitmayer | Dan Hedaya | Guy Paul | Walles Hamonde | Dominique Tipper | Kevin Guthrie | Miles Roughley | Erick Hayden | Paul Birchard | Tom Hodgkins | Josh Cowdery | Ellie Haddington | Joseph Macnab | Todd Boyce | Gemma Chan | Richard Clothier | Akin Gazi | Miquel Brown | Wunmi Mosaku | Cristian Solimeno | Nick McGaughey | Sean Cronin | Zoë Kravitz | Arinze Kene | Jane Perry, Percy Jackson: Sea of Monsters | The Golden Compass | Harry Potter and the Goblet of Fire | Ladyhawke | Pirates of the Caribbean: The Curse of the Black Pearl | Life of Pi
https://www.allmovie.com/movie/oj-made-in-america-v658822, O.J.: Made in America, Culture & Society, Biography Law & Crime Race & Ethnicity Sports, May 20 2016, 467, USA, NR, 9, , Ezra Edelman, Laylow Films, ESPN Films, Food for Thought, Crimes of Passion | Dangerous Attraction | Domestic Abuse | Football Players | Murder Investigations, , High Artistic Quality, This seven-and-a-half-hour documentary which also aired in five installments on ESPN as part of the network's "30 for 30" series explores the rise and fall of sports icon-turned-accused murderer O.J. Simpson. The film examines Simpson's 1995 trial for the killings of his ex-wife Nicole and Ron Goldman through the lens of celebrity and the history of race relations in Los Angeles. Written and directed by Ezra Edelman., O.J. Simpson, The Thin Blue Line | O.J. Simpson: Fall From Grace | June 17th 1994 | Jim Brown: All-American | The Fog of War | Hoop Dreams
https://www.allmovie.com/movie/deepwater-horizon-v617175, Deepwater Horizon, Action Drama, Disaster Film Docudrama, Sep 30 2016, 107, USA, PG13, 8,  Profanity, Peter Berg, Closest to the Hole Productions di Bonaventura Pictures, Lionsgate Summit, Adrenaline Rush, Daring Rescues | Disasters at Sea | Forces of Nature | Race Against Time | Terror in the Water, courage disaster gulf Mexico oil-spill, High Production Values, Lone Survivor director Peter Berg helmed this docudrama about the Deepwater Horizon disaster the 2010 oil-rig explosion in the Gulf of Mexico that resulted in the largest offshore oil spill in U.S. history. The film depicts the challenges that Mike Williams (Mark Wahlberg) and the rest of the rig's crew faced as they fought for survival. Kate Hudson Kurt Russell and John Malkovich co-star., Mark Wahlberg | Kurt Russell | John Malkovich | Gina Rodriguez | Dylan O'Brien | Kate Hudson | Douglas M. Griffin | James DuMont | Joe Chrest | Brad Leland | J.D. Evermore | Ethan Suplee | Jason Kirkpatrick | Jonathan Angel | Bill McMullen | Peter Berg | Juston Street | Chris Ashworth | Mustafa Harris | Henry Frost | Terry Milam | Garrett Kruithof | Deneen Tyler | Jim Klock | Garrett Hines | Robert Steinberg | Trace Adkins | Kurt Peterson | Cedric Gervais | Saundra Santiago | Scott Campbell | Mark Schotz | Tracy Mann | Fred North, The Perfect Storm | The Day After Tomorrow | Silkwood | The Great Invisible | The Towering Inferno | Apollo 13
https://www.allmovie.com/movie/20th-century-women-v663185, 20th Century Women, Comedy Drama Drama, Coming-of-Age Slice of Life, Dec 25 2016, 118, USA, R, 9,  Adult Language Drug Content Nudity Sexual Situations, Mike Mills, Annapurna Pictures Archer Gray, A24, Memory Lane | Only Human, Eccentric Families | Mothers and Sons | Single Parents, boarding-house coming-of-age landlord punk Summer teenagers, , During the summer of 1979 at the sunset of the Carter presidency a Santa Barbara single mom and boardinghouse landlord (Annette Bening) decides that the best way she can parent her teenage son (Lucas Jade Zumann) is to enlist her young tenants -- a quirky punk photographer (Greta Gerwig) a mellow handyman (Billy Crudup) and her son's shrewd but troubled best friend (Elle Fanning) -- to serve as his role models in a rapidly changing world. Written and directed by Mike Mills (Beginners)., Annette Bening | Elle Fanning | Greta Gerwig | Lucas Jade Zumann | Billy Crudup | Alison Elliott | Thea Gill | Waleed F. Zuaiter | Alia Shawkat | Nathalie Love | Victoria Bruno | Gareth Williams | Rick Gifford | Paul Tigue | Kirk Bovill | Victoria Hoffman | Randy Ryan | Kai Lennox | Sam Gros | Christopher Carroll | Al Wexo | Matthew Cardarople | Joshua Burge | Daniel Dorr, The Virgin Suicides | Running With Scissors | Growing Up Smith | The Runaways | Life of Pi | The Last Picture Show
https://www.allmovie.com/movie/silence-v582636, Silence, Drama Thriller, Historical Epic Religious Drama, Dec 23 2016, 161, Mexico Taiwan USA, R, 9,  Violence, Martin Scorsese, Cappa Defina Productions CatchPlay SharpSword Film, Paramount Pictures, Triumph of the Spirit, Members of the Clergy, Japan Jesuit mentor oppression priest, , In this passion project from director Martin Scorsese (who spent nearly three decades trying to get it made) a 17th century Portuguese Jesuit priest (Andrew Garfield) receives word that his mentor (Liam Neeson) has renounced his faith while on a mission in Japan. Concerned he travels to the island nation with another clergyman (Adam Driver) to investigate only to find that the country's Christian population are being systematically exterminated. Witnessing the inglorious reality of torture and martyrdom committed against Japanese Christians rocks his faith to the core. Based on Shusaku Endo's acclaimed 1966 novel., Liam Neeson | Andrew Garfield | Adam Driver | Tadanobu Asano | Ciarán Hinds | Issey Ogata | Shinya Tsukamoto | Yoshi Oida | Yosuke Kubozuka | Ryo Kase | Matty Blake | Shi Liang | Hairi Katagiri | Michie | Hiroko Isayama | Yoriko Doguchi | Shun Sugata | Munetaka Aoki | Sabu | Tetsu Watanabe | Ryuki Kitaoka | Katsuo Nakamura | Asuka Kurosawa, Lost in Translation | The Mission | The Other Side of Heaven | Molokai: The Story of Father Damien | The Last Samurai | Black Robe
https://www.allmovie.com/movie/things-to-come-v656447, Things to Come, Drama, Marriage Drama, Dec 2 2016, 102, France Germany, PG13, 9,  Drug Content Profanity, Mia Hansen-Løve, Arte France Cinéma CG Cinéma Detailfilm, IFC Films, Only Human, Crumbling Marriages | Death in the Family | Existential Crisis | Infidelity | Journey of Self-Discovery, anarchy commune divorce Leftist mid-life-crisis professor, , A fiftysomething leftist philosophy professor (Isabelle Huppert) is propelled into a midlife crisis after being squeezed between caring for her deteriorating mother (Edith Scob) and learning that her husband (André Marcon) wants to end their marriage. The blow of confronting her own mortality is cushioned by her friendship with a younger former student (Roman Kolinka) whose invitation to visit his anarchist commune in the countryside allows her a chance to remember the more radical and less burdened person she once was., Isabelle Huppert | Roman Kolinka | Edith Scob | Sarah LePicard | Solal Forte | Elise Lhomeau | Lionel Dray, Gloria | An Unmarried Woman | Shirley Valentine | Learning to Drive | Home | Goodbye First Love
https://www.allmovie.com/movie/the-handmaiden-v658948, The Handmaiden, Drama Romance, , Oct 21 2016, 146, South Korea, NR, 9, , Park Chan-wook, CJ Entertainment Moho Film Yong Film, Amazon Studios Magnolia Pictures, Carnal Knowledge | Off the Beaten Path, , , High Artistic Quality High Production Values, Helmed by acclaimed director Park Chan-wook (Oldboy) this period drama set in 1930s Korea explores the relationship between a Korean handmaiden and a Japanese heiress. The handmaiden (Kim Tae-ri) is secretly a pickpocket who is working as part of a scheme to swindle the heiress (Kim Min-hee) out of her fortune but that plan takes a backseat when the two women begin to fall in love. The Handmaiden was adapted from the novel Fingersmith by Sarah Waters although the setting was changed from Victorian England to Japanese-occupied Korea., Kim Min-Hee | Ha Jung-Woo, 
https://www.allmovie.com/movie/zootopia-v586271, Zootopia, Action Comedy, Action Comedy Buddy Film, Mar 4 2016, 108, USA, PG, 8,  Adult Situations, Byron Howard / Rich Moore, Walt Disney Animation Studios, Walt Disney Pictures, Just for Fun, Heroic Mission, allegory animal animation city city-life fox police prejudice rabbit racism, , In a city inhabited by anthropomorphic animals who have abandoned traditional predator/prey roles in favor of civilized coexistence uptight rabbit police officer Judy Hopps (voiced by Ginnifer Goodwin) is forced to work with charismatic fox con artist Nick Wilde (Jason Bateman) to crack a major case involving the mysterious disappearance of some carnivorous citizens. But when a few of the missing critters reappear having reverted to pre-enlightenment savagery it exposes existing anti-carnivore prejudice among the city's herbivores that threatens to damage the fabric of their diverse metropolis. Shakira Idris Elba J.K. Simmons Nate Torrence Jenny Slate Tommy Chong Octavia L. Spencer Bonnie Hunt Alan Tudyk Don Lake and John DiMaggio also lend their voices., Ginnifer Goodwin | Jason Bateman | Idris Elba | Jenny Slate | Nate Torrence | Bonnie Hunt | Don Lake | J.K. Simmons | Octavia Spencer | Alan Tudyk | Katie Lowes | Shakira | Gita Reddy | Raymond S. Persi | Phil Johnston | Maurice LaMarche | Kristen Bell | Mark Rhino Smith | John Lavelle | John DiMaggio | Jared Bush | Jesse Corti | Joshua Dallas | Rich Moore | Kath Soucie | Byron Howard, Open Season | Sing | Anastasia | The Secret Life of Pets | Bee Movie | Animal Farm
