https://www.allmovie.com/movie/graduation-v658588, Graduation, Drama, Family Drama, Apr 7 2017, 128, Belgium France Romania, R, 8,  Profanity, Cristian Mungiu, Mobra Films Why Not Productions, Sundance Selects, Only Human, , daughter father high-school teenagers, , Desperate for his daughter to escape their small town in Transylvania and attend a British university a doctor (Adrian Titieni) resorts to corrupt means to ensure that his child gets good grades on her high-school final exams. Unfortunately his scheme has unforeseen consequences. Written and directed by Cristian Mungiu (4 Months 3 Weeks and 2 Days)., Adrian Titieni | Maria-Victoria Dragus | Vlad Ivanov | Gelu Colceag | Adrian Vancica | Liliana Mocanu | Petronela Grigorescu | Valeriu Andriuta, The Best Years of Our Lives | To Kill a Mockingbird | Five Easy Pieces | Frozen River | The Heiress | There Will Be Blood
https://www.allmovie.com/movie/its-only-the-end-of-the-world-v658671, It's Only the End of the World, Drama, , , 97, Canada France, , 5, , Xavier Dolan, MK2 Productions Sons of Manual, , Only Human, , , , A gay man who's dying of AIDS (Gaspard Ulliel) reunites with his family after a long absence to inform them of his condition but their domestic squabbles derail his visit. Vincent Cassel Marion Cotillard Léa Seydoux and Nathalie Baye co-star in this family drama which adapted from the play of the same name by Jean-Luc Lagarce. Written and directed by Xavier Dolan., Gaspard Ulliel | Vincent Cassel | Marion Cotillard | Nathalie Baye, 
https://www.allmovie.com/movie/the-heart-of-nuba-v701884, The Heart of Nuba, Culture & Society Drama, Docudrama, Apr 6 2018, 85, USA, , 7, , Kenneth A. Carlson, Carlson Films, Abramorama, Food for Thought, Crisis of Faith, doctor faith war, , The tribe living along Sudan's Nuba Mountains face constant terror and bombings from their own government. American Tom Catena the only doctor in a 200 mile radius generously devotes himself to treating the neglected Nuba people. This documentary is directed by Kenneth A. Carlson., , Erin Brockovich | Notes on Blindness | The Best Years of Our Lives | Nashville | Midnight Cowboy | Million Dollar Baby
https://www.allmovie.com/movie/jeremiah-tower-the-last-magnificent-v657220, Jeremiah Tower: The Last Magnificent, Culture & Society, , Apr 21 2017, 102, Mexico USA, R, 7,  Profanity, Lydia Tenaglia, CNN Films Zero Point Zero Productions, The Orchard, , , , , Profiling celebrity chef Jeremiah Tower whose culinary technique of using fresh local ingredients came to be known as "California cuisine" in the 1970s and '80s. Tower's career is recounted in this documentary from director Lydia Tenaglia and executive producer Anthony Bourdain., Anthony Bourdain | Martha Stewart | Mario Batali | Ruth Reichl | Wolfgang Puck, 
https://www.allmovie.com/movie/divines-v658606, Divines, Drama, Coming-of-Age Juvenile Delinquency Film Social Problem Film Teen Movie Urban Drama, Nov 18 2016, 107, France Qatar, , 7,  Drug Content, Houda Benyamina, Cofinova 11 Easy Tiger France 2 Cinema, Netflix, Angsty | Only Human, Drug Addiction | Drug Trade | Drug/Alcohol Experimentation [k] | High School Life | Kids in Trouble | Peer Pressure [k] | Teen Angst, drug-dealer French [nationality] poverty teenagers work [occupation], , Two French teenage girls (Oulaya Amamra and Déborah Lukumuena) living in an impoverished section of Paris try to escape their dead-end existence by working for a local drug dealer (Jisca Kalvanda) but they quickly get in over their heads. Directed by Houda Benyamina., Bass Dhem | Farid Larbi | Wilfried Romoli, Thirteen | Half Nelson | The Perks of Being a Wallflower | Saturday Night Fever | Rebel Without a Cause | The Young Savages
https://www.allmovie.com/movie/kingsglaive-final-fantasy-xv-v658003, Kingsglaive: Final Fantasy XV, Action, Action Thriller, Aug 19 2016, 110, Japan, PG13, 4,  Violence, Takeshi Nozue, Square Enix Company Stage 6 Films, Sony Pictures Home Entertainent, For Love of Country, Bodyguards, army attack empire forces [military] kingdom power soldier threat, , In order to protect his people from an invading army King Regis (voice of Sean Bean) summons the mighty soldiers of the Kingsglaive. The two forces then do battle for control of a powerful crystal. Takeshi Nozue directed this animated action fantasy which serves as a tie-in movie to the video game Final Fantasy XV and tells a story that runs parallel to the game's plot. Aaron Paul and Lena Headey also provide their voices., Sean Bean | Lena Headey | Aaron Paul | Adrian Bouchet | Edward Saxby | Jon Campling | Will Bowden | Kezia Burrows | Neil Newbon, The Last Samurai | Rurouni Kenshin: The Legend Ends | Swordsman | The Hurt Locker | The Sand Pebbles | The French Connection
https://www.allmovie.com/movie/audrie-daisy-v648838, Audrie & Daisy, Culture & Society, Social Issues Women's Health, Sep 23 2016, 95, USA, , 7, , Bonni Cohen / Jon Shenk, Actual Films Afterimage Public Media Impact Partners, Netflix, Food for Thought, High School Life | Protecting the Innocent | Rape & Sexual Abuse | Woman In Jeopardy, abuse epidemic rape sexual teenagers, , This documentary about the epidemic of sexual assault in America focuses on two underage girls who were assaulted and whose attempts to find justice only led to their cyberbullying when the authorities failed to take the crimes seriously. Directed by Bonni Cohen and Jon Shenk., , The Hunting Ground | India's Daughter | Precious: Based on the Novel 'Push' By Sapphire | Born Into Brothels | After Innocence | Stevie
https://www.allmovie.com/movie/youre-killing-me-susana-v655498, You're Killing Me Susana, Comedy Drama Romance, Romantic Adventure, Feb 17 2017, 100, Canada Mexico, , 5,  Adult Situations, Roberto Sneider, Cuévano Films La Banda Films, , Comedy on the Edge | In the Mood for Love, Actor's Life | Breakups and Divorces | Infidelity | Writer's Life, , , A swollen-headed Mexican-soap-opera star (Gael Garcia Bernal) gets sore when he discovers that his wife Susana (Veronica Echegui) has up and left him in order to attend a creative-writing program at an Iowa university. His attempts to venture to the snowy North to win her back only aggravate his wounded machismo forcing him to acknowledge how he could do better as a husband., Gael García Bernal | Veronica Echegui | Adam Hurtig | Björn Hlynur Haraldsson | Andrés Almeida | Tristan Carlucci | Barbara Garrick | Daniel Giménez Cacho | Gabino Rodriguez | Ilse Salas | Julian Sedgwick | Will Woytowich, Don't Tempt Me | Bad Education | American Dreamer | Funny Girl | Around the World in 80 Days | As Good As It Gets
https://www.allmovie.com/movie/risk-v661379, Risk, Culture & Society, , May 5 2017, 93, Germany USA, NR, 7, , Laura Poitras, Field of Vision First Look Media Praxis Films, Neon, , , , , WikiLeaks founder Julian Assange is profiled in this documentary which was filmed by director Laura Poitras (Citizenfour) over the course of six years. While forced to reside in Ecuador's London embassy Assange and his team continue to publish classified information online., Julian Assange | Jacob Appelbaum | Hillary Clinton | Daniel Ellsberg | Lady Gaga | Donald Trump, 
https://www.allmovie.com/movie/trespass-against-us-v647484, Trespass Against Us, Action Crime, Crime Drama Family Drama, Jan 20 2017, 100, UK, R, 5,  Adult Language Brief Nudity Profanity, Adam Smith, Film4 Potboiler Productions, A24, Tough Guys, Betrayal | Fathers and Sons | Thrill Crime, clan father heist trailer trailer-park, , An Irish Traveller man (Michael Fassbender) seeks to escape the criminal lifestyle of his father (Brendan Gleeson) and secure a formal education for his own son (Georgie Smith) away from their tribe's ramshackle trailer camp. But he ends up getting roped into one more heist with his fellow car thieves and burglars although their chosen victim may not be the wisest target., Michael Fassbender | Brendan Gleeson | Sean Harris | Rory Kinnear | Killian Scott | Gerard Kearns | Tony Way | Barry Keoghan | Anastasia Hille | Alan Williams | Peter Wight | Mark Lewis Jones | Anna Calder-Marshall | Carl Grose | Yvonne D'Alpra | Barry McCormick, Hell or High Water | The Long Good Friday | The Beat That My Heart Skipped | Lock Stock and Two Smoking Barrels | Trojan Eddie | Man About Dog
https://www.allmovie.com/movie/the-age-of-consequences-v674825, The Age of Consequences, Culture & Society History Nature, Environmental Science Weather, Jan 27 2017, 80, Germany Jordan Spain USA, , 7, , Jared P. Scott, PF Pictures, , , Forces of Nature, , , This documentary explores the impact of climate change and its role in causing widespread social unrest terrorism and refugee migrations. U.S. military veterans discuss the need to deal with climate change in order to prevent global instability. Directed by Jared P. Scott., Christian Parenti, Chasing Trane: The John Coltrane Documentary | Time to Choose | A Beautiful Planet | Climate Change: Our Planet - The Kenya Story | Climate Change: Our Planet - The Arctic Story | Chasing Ice
https://www.allmovie.com/movie/claire-in-motion-v655007, Claire in Motion, Drama Thriller, Psychological Thriller, Jan 13 2017, 83, USA, NR, 6,  Adult Situations, Annie J. Howell / Lisa Robinson, Sacha Pictures, Breaking Glass Pictures, Spellbinders, Crumbling Marriages | Missing Persons | Mysterious Strangers, graduate-student mathematics missing professor secrets spouse, , A mathematics professor named Claire (Betsy Brandt) searches for her husband who went missing while hiking in the mountains near their Ohio home. When her investigation leads her to an art project he was working on with a young grad student (Anna Margaret Hollyman) she is forced to reevaluate how well she knew her spouse., Betsy Brandt | Anna Margaret Hollyman | Chris Beetem | Sakina Jaffrey | Merri Biechler | Brian Evans | David Haugen | Steven Ross | Kim Taylor | Shelley Delaney, The Vanishing | L'Avventura | Wakefield | Under the Sand | The Sixth Sense | Abandon
https://www.allmovie.com/movie/citizen-jane-battle-for-the-city-v668485, Citizen Jane: Battle for the City, Culture & Society, Biography Social Issues, Apr 21 2017, 92, USA, NR, 7, , Matt Tyrnauer, Altimeter Films, Sundance Selects, For Love of Country | Triumph of the Geeks, Inner City Blues | Stop the Wrecking Ball | Unlikely Heroes | Writer's Life, activist architecture author city civil-engineer urban-planning, , This documentary recalls the efforts of Jane Jacobs activist and author of The Death and Life of Great American Cities to prevent urban planner Robert Moses from razing and building over historic sections of New York City in the 1950s and '60s. Directed by Matt Tyrnauer., Marisa Tomei | Paul Goldberger, Reality Bites | The Cruise | Pray the Devil Back to Hell | Tiny Furniture | Unfaithful | Manhatta
https://www.allmovie.com/movie/the-innocents-v648791, The Innocents, Drama, Period Film Religious Drama, Jul 1 2016, 115, France Poland, PG13, 8, , Anne Fontaine, Aeroplan Film Mars Films, Music Box Films, Food for Thought, Expecting a Baby | Life Under Occupation | Members of the Clergy | Rape & Sexual Abuse | Women During Wartime, , , In 1945 Warsaw a French Red Cross doctor (Lou de Laage) is called to a convent on an urgent matter. Once there she not only helps a nun give birth but discovers that several other women at the monastery are also pregnant. Soon she is tasked with keeping the secret of what happened at the convent during World War II. Directed by Anne Fontaine The Innocents made its world premiere at the 2016 Sundance Film Festival., Agata Buzek | Agata Kulesza | Vincent Macaigne | Joanna Kulig | Dorota Kuduk | Thomas Coumans, Agnes of God | Friendly Persuasion | Gone With the Wind | All Quiet on the Western Front | The Remains of the Day | Hud
https://www.allmovie.com/movie/bang%21-the-bert-berns-story-v656928, BANG! The Bert Berns Story, Music, , Apr 26 2017, 94, Ireland UK USA, , 8, , Brett Berns / Bob Sarles, HCTN, Abramorama, , , , , This documentary profiles 1960s songwriter and music producer Bert Berns who wrote such memorable hits as "Twist and Shout" and "Brown Eyed Girl" before dying suddenly of a heart attack at the age of 38. Co-directed by his son Brett Berns and Bob Sarles BANG! The Bert Berns Story made its world premiere at the 2016 South by Southwest Film Festival., Steve Van Zandt | Van Morrison | Paul McCartney | Solomon Burke | Keith Richards | Cissy Houston | Wilson Pickett | Mike Stoller | Brooks Arthur, 
https://www.allmovie.com/movie/the-duelist-v665769, The Duelist, Drama, Adventure Drama Period Film, Dec 2 2016, 109, Russia, R, 6,  Nudity Profanity Sexual Situations, Aleksey Mizgirev, Non-Stop Productions, Columbia Pictures, Adrenaline Rush, Forbidden Love | Mercenaries, duel gun nobility scheme stand-in, , A retired Army officer (Petr Fedorov) in 1860 St. Petersburg acts as a professional stand-in for pistol duels among the nobility. However he soon gets caught up in a scheme involving a count (Vladimir Mashkov) who plans to kill off those he owes money to via duels. Written and directed by Aleksey Mizgirev., Vladimir Mashkov | Martin Wuttke | Franziska Petri | Alexander Yatsenko | Yuri Kuznetsov | Sergei Garmash, The Duellists | Le Samouraï | The Heiress | American Hustle | Master and Commander: The Far Side of the World | North by Northwest
https://www.allmovie.com/movie/the-transfiguration-v658931, The Transfiguration, Drama Horror, Supernatural Drama, Apr 7 2017, 97, USA, NR, 6, , Michael O'Shea, Transfiguration Productions, Strand Releasing, Blood and Gore, Bullies | Vampires, abuse blood bully orphan school teenagers vampire, , Milo (Eric Ruffin) a 14-year-old orphan living in Queens deals with the miseries of his everyday life by acting like a vampire -- which includes hunting victims and drinking their blood. As his obsession grows he also forges a friendship with a pretty neighbor (Chloe Levine). Written and directed by Michael O'Shea., Chloe Levine | Carter Redwood | Tarikk Mudu | Lloyd Kaufman | Larry Fessenden, Let the Right One In | Twilight | Fright Night | From Dusk Till Dawn | The Twilight Saga: Breaking Dawn - Part 2 | Devil
https://www.allmovie.com/movie/folk-hero-funny-guy-v656568, Folk Hero & Funny Guy, Comedy, Romantic Comedy Showbiz Comedy, May 12 2017, 88, USA, , 6, , Jeff Grace, Chhibber Mann Productions Pull Ya Up Productions Spitfire Studios, Gravitas Ventures, In the Mood for Love | Just for Fun | Pick-Me-Ups, Big Break | Down on Their Luck | Journey of Self-Discovery | Men's Friendship | Musician's Life | Single Life, childhood-friend comedian comedy help road-trip singer/songwriter success, , An up-and-coming folk musician named Jason (Wyatt Russell) tries to help his old friend Paul (Alex Karpovsky) a struggling standup comic by inviting him to be the opening act for his tour. This comedy chronicles their adventures on the road as the duo search for love and success. Written and directed by Jeff Grace., Alex Karpovsky | Wyatt Russell | Meredith Hagner | Michael Ian Black | Heather Morris | Melanie Lynskey | David Cross | Alex McKenna | Thida Penn | Todd Berger | Blaise Miller | Kevin M. Brennan | Jeff Grace | Mike C. Manning | Atkins Estimond, Road Hard | Funny People | Bullets Over Broadway | Paris When It Sizzles | The Seven Year Itch | Birdman
https://www.allmovie.com/movie/justin-timberlake-the-tennessee-kids-v647459, Justin Timberlake + The Tennessee Kids, Music, Concerts, Oct 12 2016, , USA, , 8, , Jonathan Demme, Live Nation Productions Playtone Productions, Netflix, , Musician's Life, , , Jonathan Demme directed this documentary about the last performance of Justin Timberlake's 20/20 Experience tour in 2015 at the MGM Grand in Las Vegas. The film includes concert footage and behind-the-scenes material., Justin Timberlake, Under African Skies | Standing in the Shadows of Motown | Rock the Bells | Lightning in a Bottle | Fade to Black | LoudQUIETloud: A Film about the Pixies
https://www.allmovie.com/movie/king-cobra-v657274, King Cobra, Drama, Black Comedy Crime Drama Gay & Lesbian Films, Oct 21 2016, 91, USA, NR, 5, , Justin Kelly, Digital Ignition Entertainment RabbitBandini Productions Yale Productions, IFC Films, , Betrayal | Misfits and Outsiders | Wolf in Sheep's Clothing, , , When a rising gay porn star (Garrett Clayton) feels he's not being paid what he's worth he leaves his producer (Christian Slater) to become a free agent and soon turns to a rival filmmaker who has financial problems of his own (James Franco). Justin Kelly wrote and directed this crime drama which is based on the true story of former adult star Sean Paul Lockhart., Garrett Clayton | Christian Slater | James Franco | Keegan Allen | Alicia Silverstone | Molly Ringwald | Spencer Lofranco | Nicole Signore | Ron Simons | Keith Leonard, Boogie Nights | American Gigolo | Boy Culture | The Stunt Man | The Wolf of Wall Street | The Sound of Music
https://www.allmovie.com/movie/amanda-knox-v667838, Amanda Knox, Culture & Society, Law & Crime, Sep 30 2016, 92, Denmark USA, , 8, , Rod Blackhurst / Brian McGinn, Plus Pictures, Netflix, , Americans Abroad | Dangerous Friends | Death of a Friend | Lawyers | Murder Investigations | Righting the Wronged | Twentysomething Life, Italy media murder-trial roommate tabloid, , This documentary explores how the British tabloid industry distorted media coverage of the trial of Amanda Knox who was accused of murdering her roommate in Italy in 2007. Directed by Rod Blackhurst and Brian McGinn., , O.J.: Made in America | The Talented Mr. Ripley | Cropsey | Unraveled | Dina | M*A*S*H
https://www.allmovie.com/movie/siren-v668165, SiREN, Horror Thriller, Sadistic Horror Sci-Fi Horror Supernatural Horror, Dec 2 2016, 83, USA, NR, 5,  Not For Children Scary Moments, Gregg Bishop, Studio 71, Chiller Films, Nail-biters | Spellbinders, Nightmare Vacations | Supernatural Romance, bachelor-party club [place] groom [bridegroom] mansion monster stag-party succubus temptress, , A quartet of dudes in search of bachelor-party thrills for their groom-to-be buddy (Chase Williamson) eschew the usual strippers in favor of a mysterious club in a remote country mansion. But when one man decides to free a seductive woman (Hannah Fierman) from a locked room he quickly discovers she's a dangerous whip-tailed creature who's chosen him as her mate., Chase Williamson | Justin Welborn | Michael Aaron Milligan | Randy McDowell | Hannah Fierman | Lindsey Garrett | Stephen Caudill | Brian F. Durkin | Preston James Hillier | Blair Redford | Jude S. Walko, Species | From Dusk Till Dawn | Society | Psycho | Take Shelter | Them!
https://www.allmovie.com/movie/sky-ladder-the-art-of-cai-guo-qiang-v648803, Sky Ladder: The Art of Cai Guo-Qiang, Visual Arts, , Oct 14 2016, 76, USA, , 7, , Kevin MacDonald, Insurgent Docs Rock Paper Scissors, Netflix, , , , , Chinese artist Cai Guo-Qiang who uses fireworks gunpowder and explosives as his medium endeavors to create his most ambitious work to date: "Sky Ladder" a sculpture conceived as a way to symbolically unite Earth with the universe. Directed by Kevin Macdonald., Cai Guo-Qiang, William Eggleston in the Real World | Dirty Hands: The Art & Crimes of David Choe | Certifiably Jonathan | The Art of the Steal | Dear Mr. Watterson: An Exploration of Calvin & Hobbes | Boom for Real: The Late Teenage Years of Jean-Michel Basquiat
https://www.allmovie.com/movie/the-skyjackers-tale-v665916, The Skyjacker's Tale, History, Biography Law & Crime Politics & Government, Jun 30 2017, 76, Canada, NR, 5, , Jamie Kastner, Cave 7 Productions, Strand Releasing, Food for Thought, Hijackings | Living In Exile | Terrorism, , , Profiling Ishmael Muslim Ali who hijacked an airplane and fled to Cuba after he was convicted of participating in a 1972 mass shooting at a country club in the Virgin Islands (he claimed he was innocent of the crime). This documentary interviews Ali today as he faces the possibility of finally being extradited to the U.S. Written and directed by Jamie Kastner., Margaret Ratner Kunstler | Michael Ratner | Drew Taylor | George Parra | Edward Parks, One Day in September | The Fog of War | Casino Jack and the United States of Money | The Agronomist | The Trials of Henry Kissinger | O.J.: Made in America
https://www.allmovie.com/movie/miltons-secret-v659431, Milton's Secret, Drama, Childhood Drama Coming-of-Age, Sep 30 2016, 88, Canada, PG, 4,  Adult Situations, Barnet Bain, BUCK Productions Hulo Films Riverside Entertainment, Momentum Pictures, Only Human, Bullies | Dysfunctional Families | Generation Gap, boy bully grandfather, , A 12-year-old boy named Milton (William Ainscough) feels overwhelmed as he deals with bullies at school and his parents' bickering over money woes at home. Milton soon bonds with his eccentric grandfather (Donald Sutherland) who shares his philosophy about living in the moment and learning to handle life's disappointments. Mia Kirshner David Sutcliffe and Michelle Rodriguez co-star. Directed by Barnet Bain., Donald Sutherland | Michelle Rodriguez | Mia Kirshner | David Sutcliffe | Graham Abbey | Ella Ballentine | Jessica Greco | Stephen Huszar | Percy Hynes-White | Sheila McCarthy | Hays Wellford, Boyhood | Mud | War Horse | East of Eden | The Graduate | The Last Picture Show
https://www.allmovie.com/movie/yoga-hosers-v612781, Yoga Hosers, Comedy Horror, Adventure Comedy, Sep 2 2016, 88, USA, PG13, 2,  Adult Situations Drug Content Mild Violence, Kevin Smith, Abolitta Productions SModcast Pictures StarStream Entertainment, Invincible Pictures, Just for Fun, Heroic Mission, battle [war] chakras clerk evil paranormal quest warrior yoga, , Kevin Smith (Clerks Tusk) wrote and directed this comic-book-influenced horror comedy about 15-year-old Manitoba yoga fanatics and convenience-store clerks Colleen Collette (Lily-Rose Depp) and Colleen McKenzie (Harley Quinn Smith) who find their invitation to a high-school party in jeopardy when they are forced to do battle with a powerful force of evil that has risen from the earth. In their quest to vanquish the ancient menace in time for the big bash the two Colleens power up their chakras prepare their warrior poses and enlist the aid of famed Montreal manhunter Guy Lapointe (Johnny Depp). {Justin Long Haley Joel Osment Génesis Rodríguez Ralph Garman Harley Morenstein Tony Hale Natasha Lyonne and Adam Brody co-star., Lily-Rose Depp | Harley Quinn Smith | Johnny Depp | Haley Joel Osment | Kevin Smith | Justin Long | Adam Brody | Natasha Lyonne | Austin Butler | Génesis Rodríguez | Ralph Garman | Tony Hale | Harley Morenstein | Jason Mewes | Tyler Posey | Jennifer Schwalbach Smith | Vanessa Paradis | Stan Lee | David S. Greathouse | Robert Kurtzman, Shaun of the Dead | Scott Pilgrim vs. the World | The World's End | Attack the Block | Men in Black 3 | La La Land
https://www.allmovie.com/movie/nina-v642555, Nina, Drama, Biopic [feature] Feminist Film Musical Drama, Apr 22 2016, 90, UK, NR, 3, , Cynthia Mort, Ealing Studios Londinium Films, RLJ Entertainment, Triumph of the Spirit, Mothers and Daughters | Social Injustice | Tortured Genius | Mental Illness | Musician's Life, , , This biopic of legendary musician Nina Simone (Zoe Saldana) focuses on the singer in her sixties as she forges an unusual relationship with a younger nurse named Clifton Henderson (David Oyelowo) whom she asks to be her personal assistant and accompany her to the South of France. Henderson is soon forced to deal with Simone's erratic behavior and he ultimately tries to mount a comeback concert for her in New York City. Written and directed by Cynthia Mort., Zoe Saldana | David Oyelowo | Mike Epps | Ella Thomas | Siena Goines | Kevin Mambo | Allison Sarofim | Keith David | Ella Joyce | Anthony Molinari | Bonnie Bartlett | Ken Davitian | Camille Natta | Marianne Muellerleile | Michael Vartan | Yasmine Golchan | Mary Pat Gleason | Andrei Runtso, Lady Sings the Blues | What Happened Miss Simone? | First Kill | Greetings From Tim Buckley | The Hours | Amadeus
https://www.allmovie.com/movie/theo-who-lived-v667541, Theo Who Lived, Culture & Society, , Oct 7 2016, 86, USA, , 7, , David Schisgall, , Zeitgeist Films, , , , , American journalist Theo Padnos revisits the precise locations where he was kidnapped tortured and held as a prisoner by al-Nusra Front jihadists in Syria from 2012 to 2014 and recounts the details of his ordeal in their custody. Directed by David Schisgall., , 
https://www.allmovie.com/movie/antibirth-v646671, Antibirth, Horror, Horror Comedy Supernatural Horror, Sep 2 2016, 94, Canada, NR, 6,  Gore, Danny Perez, Hideaway Pictures Traverse Media, IFC Midnight, Blood and Gore, Demonic Possession | Evil Children | Woman In Jeopardy, bizarre evil party-girl pregnancy, , A hard-partying burnout (Natasha Lyonne) awakens after a particularly rough night with a bizarre illness. She begins to have reality-altering visions as an inexplicable pregnancy grows inside of her. Danny Perez wrote and directed this mind-bending horror thriller which co-stars Chloë Sevigny and Mark Webber., Natasha Lyonne | Meg Tilly | Mark Webber | Maxwell McCabe-Lokos | Neville Edwards | Lili Francks | Jessica Greco, Rosemary's Baby | Witching and Bitching | Bad Taste | [REC] 3: Genesis | Drag Me to Hell | Demon Hole
