https://www.allmovie.com/movie/la-la-land-v631486, La La Land, Comedy Musical, Musical Romance Romantic Comedy Romantic Drama, Dec 9 2016, 12, USA, PG13, 10,  Adult Language, Damien Chazelle, Black Label Media Gilbert Films Impostor Pictures Marc Platt Productions, Lionsgate Summit, Only Human, Life in the Arts, actress jazz musical [play] musician relationship, High Artistic Quality, Struggling actress Mia (Emma Stone) and aspiring jazz pianist Sebastian (Ryan Gosling) begin a whirlwind romance as they both pursue their dreams in Los Angeles. However their blossoming relationship is challenged when their careers pull them in different directions. Damien Chazelle (Whiplash) wrote and directed this musical love story which co-stars John Legend J.K. Simmons and Rosemarie DeWitt., , Guy and Madeline on a Park Bench | Chicago | Midnight in Paris | The Terminal | Whiplash | West Side Story
https://www.allmovie.com/movie/hell-or-high-water-v658871, Hell or High Water, Action Crime Drama, , Aug 12 2016, 10, USA, R, 9,  Adult Language Violence, David Mackenzie, Film 44 Sidney Kimmel Entertainment, CBS Films Lionsgate, Only Human, , bank bank-robbery desert foreclosure manhunt police poverty, High Production Values, Two desperate brothers -- one a divorced father (Chris Pine) the other a hard-living ex-con (Ben Foster) -- commit a string of bank robberies in order to raise the money needed to protect their family farm from foreclosure. Meanwhile an aging sheriff (Jeff Bridges) tracks the heists in an attempt to hunt down those responsible. This crime drama was written by Taylor Sheridan (Sicario) and directed by David Mackenzie (Starred Up)., , The Town | The Place Beyond the Pines | The Bank Job | Cop Car | The French Connection | Dog Day Afternoon
https://www.allmovie.com/movie/hidden-figures-v643629, Hidden Figures, Drama, Inspirational Drama, Dec 25 2016, 12, USA, PG, 8,  Adult Situations Mild Language, Theodore Melfi, Chernin Entertainment Levantine Films, Fox 2000 Pictures, Pick-Me-Ups | Triumph of the Geeks | Triumph of the Spirit, Fighting the System | Questioning Gender Roles | Underdogs | Women's Friendship, Black [race] mathematics NASA racism rocket women, High Artistic Quality Sleeper, Three female African-American mathematicians (Taraji P. Henson Octavia L. Spencer and Janelle Monae) provide crucial calculations for NASA's space race against the Soviets all while dealing with the racist and sexist assumptions of their white co-workers. Kevin Costner Kirsten Dunst and Jim Parsons co-star in this adaptation of the book of the same name by Margot Lee Shetterly. Directed by Theodore Melfi., , Stand and Deliver | The Right Stuff | Moneyball | Infinity | Contact | Travelling Salesman
https://www.allmovie.com/movie/manchester-by-the-sea-v648783, Manchester by the Sea, Drama, Family Drama Slice of Life, Nov 18 2016, 13, USA, R, 8,  Adult Language Sexual Situations, Kenneth Lonergan, A / Middleton Project B Story K Period Media Media Farm Pearl Street Films, Amazon Studios Roadside Attractions, Only Human | Triumph of the Spirit, Coming Home | Death of a Parent | Dysfunctional Families | Kids in Trouble | Men's Friendship | Parenthood | Reconciliation, , High Artistic Quality Sleeper, A hardened handyman named Lee (Casey Affleck) returns to his hometown in New England after the death of his brother (Kyle Chandler) to care for his 16-year-old nephew (Lucas Hedges) but his arrival also unearths his checkered past. Soon Lee comes back into contact with his estranged wife (Michelle Williams) as he deals with life in his tight-knit former community. Kenneth Lonergan directed this family drama., , The Fighter | Ordinary People | The Grapes of Wrath | Frozen River | For Ellen | The Messenger
https://www.allmovie.com/movie/jackie-v649094, Jackie, Drama Historical Film, Biopic [feature], Dec 2 2016, 10, Chile France USA, R, 9,  Profanity Violence, Pablo Larrain, Fabula LD Entertainment Protozoa Pictures, Fox Searchlight Pictures, For Love of Country | Triumph of the Spirit, Assassination Plots | Death of a Partner | Heads of State | Widows and Widowers, America assassination first-lady President widow/widower, High Artistic Quality High Production Values, In the immediate aftermath of the assassination of President John F. Kennedy his wife Jacqueline Kennedy (Natalie Portman) deals with her immense grief while making plans for his funeral procession. Confiding in her close friend and secretary Nancy Tuckerman (Greta Gerwig) as well as her brother-in-law Robert Kennedy (Peter Sarsgaard) Jackie tries to care for her young family as a bereaved nation watches on. Pablo Larrain directed this nonlinear biopic., , Jackie: Behind the Myth | Lee Daniels' The Butler | Parkland | The Greek Tycoon | The Kennedys | Grey Gardens
https://www.allmovie.com/movie/lion-v632870, Lion, Drama, Adventure Drama Family Drama, Nov 25 2016, 11, Australia UK USA, PG13, 7,  Adult Situations, Garth Davis, Aquarius Films See-Saw Films Sunstar Entertainment, The Weinstein Company, Triumph of the Spirit, Adoption | Coming Home | Journey of Self-Discovery | Non-Traditional Families | Obsessive Quests, , High Artistic Quality, In this adaptation of the memoir A Long Way Home by Saroo Brierley a five-year-old Indian boy is adopted by an Australian couple after he gets lost in Calcutta. Years later he struggles with his memories of his birth family and decides to begin a search for them. Dev Patel stars as the adult Brierley in this drama directed by Garth Davis. Nicole Kidman David Wenham and Rooney Mara co-star., , Life of Pi | To Kill a Mockingbird | A Tree Grows in Brooklyn | The Best Years of Our Lives | Lady Bird | A Raisin in the Sun
https://www.allmovie.com/movie/captain-fantastic-v643106, Captain Fantastic, Comedy Comedy Drama, Coming-of-Age Family Drama, Jul 8 2016, 11, USA, R, 7,  Adult Language Nudity Sexual Situations Watch With Your Teen, Matt Ross, Electric City Entertainment ShivHans Pictures, Bleecker Street, Button Pushers | Only Human, Death of a Parent | Dropping Out | Eccentric Families | Fathers and Daughters | Fathers and Sons, , High Artistic Quality, Determined to shield his family from the decadence and distractions of modern life an eccentric father (Viggo Mortensen) raises his six children in a remote forest in the Pacific Northwest. But when his wife commits suicide the kids are forced to interact with the outside world for the first time as he takes them on a road trip to New Mexico for her funeral. Kathryn Hahn Steve Zahn Frank Langella and Ann Dowd co-star. Written and directed by Matt Ross (28 Hotel Rooms) Captain Fantastic made its world premiere at the 2016 Sundance Film Festival., , Into the Wild | Running With Scissors | Hideous Kinky | On Golden Pond | A Tree Grows in Brooklyn | Rich in Love
https://www.allmovie.com/movie/arrival-v654945, Arrival, Drama Science Fiction Thriller, Alien Film Psychological Sci-Fi, Nov 11 2016, 11, USA, PG13, 9,  Profanity, Denis Villeneuve, 21 Laps Entertainment FilmNation Entertainment Lava Bear Films, Paramount Pictures, Fantastic Reality, Benign Aliens | Chosen One | Haunted By the Past | Heroic Mission | Miraculous Events, alien [not human] close-encounter humanity language language-barrier time translator UFO (Unidentified Flying Object), High Artistic Quality, Denis Villeneuve directed this science-fiction suspense film about Earth's response to a possible alien invasion. After extraterrestrial spacecraft plant themselves at various locations around the globe a linguist (Amy Adams) and a theoretical physicist (Jeremy Renner) must find a way to communicate with the mysterious visitors in order to learn what they want and whether they pose a threat to humanity. Forest Whitaker and Michael Stuhlbarg co-star., , Gravity | Close Encounters of the Third Kind | Solaris | 2001: A Space Odyssey | Inception | Moon
https://www.allmovie.com/movie/florence-foster-jenkins-v643099, Florence Foster Jenkins, Comedy Drama, Biopic [feature] Romantic Comedy, Aug 12 2016, 11, UK, PG13, 8,  Adult Situations, Stephen Frears, BBC Films Pathé Pictures International Qwerty Films, Paramount Pictures, Just for Fun, Keeping a Secret | Wishes Come True, , High Production Values, Heiress Florence Foster Jenkins (Meryl Streep) longs to become an opera star in 1940s New York despite possessing a horrible singing voice. With the help and encouragement of her husband (Hugh Grant) and a talented musician (Simon Helberg) she finds a very strange kind of success as a performer and recording artist. Rebecca Ferguson and Nina Arianda co-star. Stephen Frears (Philomena) directed this biopic which is based on the real-life socialite and opera singer of the same name., , Marguerite | Funny Girl | The Buddy Holly Story | The Pride of the Yankees | As Good As It Gets | Bus Stop
https://www.allmovie.com/movie/toni-erdmann-v658619, Toni Erdmann, Comedy Drama, Slice of Life, Dec 25 2016, 16, Austria Germany, R, 9,  Drug Content Nudity Profanity Strong Sexual Content, Maren Ade, Komplizen Film Missing Link Films, Sony Pictures Classics, In a Minor Key, Fathers and Daughters, connection daughter disguise father father-figure parent/child-relationship secret-identity, , A dedicated career woman living in Romania (Sandra Hüller) gets a surprise visit from her exasperating father (Peter Simonischek) a retired music teacher with an inexhaustible fondness for practical jokes. When she insists that he return home to Germany he reappears in a bad wig as his alter ego "Toni Erdmann" and insinuates himself into her professional circle. In time their mutual aggravation with each other's behavior works to heal their fractured relationship. Directed by Maren Ade (Everyone Else) this comedy-drama took so long to edit that Ade gave birth to her second child during post-production., , The Descendants | Proof | Trouble With the Curve | M*A*S*H | The Graduate | Adaptation
https://www.allmovie.com/movie/nocturnal-animals-v664200, Nocturnal Animals, Drama Thriller, Crime Thriller Marriage Drama, Nov 18 2016, 11, USA, R, 7,  Nudity Profanity Violence, Tom Ford, Artina Films Fade to Black, Focus Features, Only Human | Unloveables, Betrayal | Breakups and Divorces | Death of a Child | Death of a Partner | Infidelity | Kidnapping | Out For Revenge | Thrill Crime | Treacherous Spouses, art-gallery ex-husband inspiration novel violence, High Production Values, An art-gallery owner (Amy Adams) reads a novel written by her ex-husband (Jake Gyllenhaal) and becomes greatly disturbed by the possibility that the story was inspired by their marriage and that her safety is in jeopardy. Armie Hammer Isla Fisher Aaron Taylor-Johnson Michael Shannon and Laura Linney co-star. Directed by Tom Ford who also adapted the script from the novel Tony and Susan by Austin Wright., , Allied | Addicted | Hell or High Water | Nightcrawler | Demolition | Enemy
https://www.allmovie.com/movie/fantastic-beasts-and-where-to-find-them-v587742, Fantastic Beasts and Where to Find Them, Adventure Fantasy, Adventure Drama Fantasy Adventure, Nov 18 2016, 13, UK USA, PG13, 6,  Violence, David Yates, Heyday Films, Warner Bros. Pictures, Fantastic Reality | Other Dimensions, Curses and Spells | Mythical Creatures | Priceless Artifacts and Prized Objects | Wizards and Magicians | Writer's Life, adventurer Congress creature fantasy-world magic witch wizard writer, High Budget High Production Values, This spin-off of the Harry Potter franchise jumps back in time to explore the wizarding world of 1926 New York which is being threatened by both mystical acts of destruction and a group of extremist No-Majs (the American term for Muggles i.e. those unable to use magic). Author Newt Scamander (Eddie Redmayne) arrives in the city as part of a global study of fantastic beasts but he gets caught up in this conflict when some of the magical creatures in his care are accidentally released. Katherine Waterston Alison Sudol Dan Fogler Colin Farrell Ezra Miller and Johnny Depp co-star in this fantasy adventure which was directed by David Yates (who helmed four of the Harry Potter films) and adapted for the screen by J.K. Rowling from her own book., , Percy Jackson: Sea of Monsters | The Golden Compass | Harry Potter and the Goblet of Fire | Ladyhawke | Pirates of the Caribbean: The Curse of the Black Pearl | Life of Pi
https://www.allmovie.com/movie/oj-made-in-america-v658822, O.J.: Made in America, Culture & Society, Biography Law & Crime Race & Ethnicity Sports, May 20 2016, 46, USA, NR, 9, , Ezra Edelman, Laylow Films, ESPN Films, Food for Thought, Crimes of Passion | Dangerous Attraction | Domestic Abuse | Football Players | Murder Investigations, , High Artistic Quality, This seven-and-a-half-hour documentary which also aired in five installments on ESPN as part of the network's "30 for 30" series explores the rise and fall of sports icon-turned-accused murderer O.J. Simpson. The film examines Simpson's 1995 trial for the killings of his ex-wife Nicole and Ron Goldman through the lens of celebrity and the history of race relations in Los Angeles. Written and directed by Ezra Edelman., , The Thin Blue Line | O.J. Simpson: Fall From Grace | June 17th 1994 | Jim Brown: All-American | The Fog of War | Hoop Dreams
https://www.allmovie.com/movie/deepwater-horizon-v617175, Deepwater Horizon, Action Drama, Disaster Film Docudrama, Sep 30 2016, 10, USA, PG13, 8,  Profanity, Peter Berg, Closest to the Hole Productions di Bonaventura Pictures, Lionsgate Summit, Adrenaline Rush, Daring Rescues | Disasters at Sea | Forces of Nature | Race Against Time | Terror in the Water, courage disaster gulf Mexico oil-spill, High Production Values, Lone Survivor director Peter Berg helmed this docudrama about the Deepwater Horizon disaster the 2010 oil-rig explosion in the Gulf of Mexico that resulted in the largest offshore oil spill in U.S. history. The film depicts the challenges that Mike Williams (Mark Wahlberg) and the rest of the rig's crew faced as they fought for survival. Kate Hudson Kurt Russell and John Malkovich co-star., , The Perfect Storm | The Day After Tomorrow | Silkwood | The Great Invisible | The Towering Inferno | Apollo 13
https://www.allmovie.com/movie/20th-century-women-v663185, 20th Century Women, Comedy Drama Drama, Coming-of-Age Slice of Life, Dec 25 2016, 11, USA, R, 9,  Adult Language Drug Content Nudity Sexual Situations, Mike Mills, Annapurna Pictures Archer Gray, A24, Memory Lane | Only Human, Eccentric Families | Mothers and Sons | Single Parents, boarding-house coming-of-age landlord punk Summer teenagers, , During the summer of 1979 at the sunset of the Carter presidency a Santa Barbara single mom and boardinghouse landlord (Annette Bening) decides that the best way she can parent her teenage son (Lucas Jade Zumann) is to enlist her young tenants -- a quirky punk photographer (Greta Gerwig) a mellow handyman (Billy Crudup) and her son's shrewd but troubled best friend (Elle Fanning) -- to serve as his role models in a rapidly changing world. Written and directed by Mike Mills (Beginners)., , The Virgin Suicides | Running With Scissors | Growing Up Smith | The Runaways | Life of Pi | The Last Picture Show
https://www.allmovie.com/movie/silence-v582636, Silence, Drama Thriller, Historical Epic Religious Drama, Dec 23 2016, 16, Mexico Taiwan USA, R, 9,  Violence, Martin Scorsese, Cappa Defina Productions CatchPlay SharpSword Film, Paramount Pictures, Triumph of the Spirit, Members of the Clergy, Japan Jesuit mentor oppression priest, , In this passion project from director Martin Scorsese (who spent nearly three decades trying to get it made) a 17th century Portuguese Jesuit priest (Andrew Garfield) receives word that his mentor (Liam Neeson) has renounced his faith while on a mission in Japan. Concerned he travels to the island nation with another clergyman (Adam Driver) to investigate only to find that the country's Christian population are being systematically exterminated. Witnessing the inglorious reality of torture and martyrdom committed against Japanese Christians rocks his faith to the core. Based on Shusaku Endo's acclaimed 1966 novel., , Lost in Translation | The Mission | The Other Side of Heaven | Molokai: The Story of Father Damien | The Last Samurai | Black Robe
https://www.allmovie.com/movie/things-to-come-v656447, Things to Come, Drama, Marriage Drama, Dec 2 2016, 10, France Germany, PG13, 9,  Drug Content Profanity, Mia Hansen-Løve, Arte France Cinéma CG Cinéma Detailfilm, IFC Films, Only Human, Crumbling Marriages | Death in the Family | Existential Crisis | Infidelity | Journey of Self-Discovery, anarchy commune divorce Leftist mid-life-crisis professor, , A fiftysomething leftist philosophy professor (Isabelle Huppert) is propelled into a midlife crisis after being squeezed between caring for her deteriorating mother (Edith Scob) and learning that her husband (André Marcon) wants to end their marriage. The blow of confronting her own mortality is cushioned by her friendship with a younger former student (Roman Kolinka) whose invitation to visit his anarchist commune in the countryside allows her a chance to remember the more radical and less burdened person she once was., , Gloria | An Unmarried Woman | Shirley Valentine | Learning to Drive | Home | Goodbye First Love
https://www.allmovie.com/movie/the-handmaiden-v658948, The Handmaiden, Drama Romance, , Oct 21 2016, 14, South Korea, NR, 9, , Park Chan-wook, CJ Entertainment Moho Film Yong Film, Amazon Studios Magnolia Pictures, Carnal Knowledge | Off the Beaten Path, , , High Artistic Quality High Production Values, Helmed by acclaimed director Park Chan-wook (Oldboy) this period drama set in 1930s Korea explores the relationship between a Korean handmaiden and a Japanese heiress. The handmaiden (Kim Tae-ri) is secretly a pickpocket who is working as part of a scheme to swindle the heiress (Kim Min-hee) out of her fortune but that plan takes a backseat when the two women begin to fall in love. The Handmaiden was adapted from the novel Fingersmith by Sarah Waters although the setting was changed from Victorian England to Japanese-occupied Korea., , 
https://www.allmovie.com/movie/zootopia-v586271, Zootopia, Action Comedy, Action Comedy Buddy Film, Mar 4 2016, 10, USA, PG, 8,  Adult Situations, Byron Howard / Rich Moore, Walt Disney Animation Studios, Walt Disney Pictures, Just for Fun, Heroic Mission, allegory animal animation city city-life fox police prejudice rabbit racism, , In a city inhabited by anthropomorphic animals who have abandoned traditional predator/prey roles in favor of civilized coexistence uptight rabbit police officer Judy Hopps (voiced by Ginnifer Goodwin) is forced to work with charismatic fox con artist Nick Wilde (Jason Bateman) to crack a major case involving the mysterious disappearance of some carnivorous citizens. But when a few of the missing critters reappear having reverted to pre-enlightenment savagery it exposes existing anti-carnivore prejudice among the city's herbivores that threatens to damage the fabric of their diverse metropolis. Shakira Idris Elba J.K. Simmons Nate Torrence Jenny Slate Tommy Chong Octavia L. Spencer Bonnie Hunt Alan Tudyk Don Lake and John DiMaggio also lend their voices., , Open Season | Sing | Anastasia | The Secret Life of Pets | Bee Movie | Animal Farm
https://www.allmovie.com/movie/christine-v648854, Christine, Drama, Biopic [feature], Oct 14 2016, 11, USA, R, 9,  Profanity Violence, Antonio Campos, BorderLine Films Fresh Jade Great Point Media, The Orchard, Abandon All Hope | Uncomfortable Viewing, Mental Breakdown | Misfits and Outsiders | Romantic Misunderstandings | Suicide, anchorperson broadcasting mental-breakdown suicide television television-crew, , This biopic centers on troubled television journalist Christine Chubbuck (Rebecca Hall) who committed suicide live on air during a newscast in 1974. Chubbuck works for the local news in Saratosa FL where she is frustrated by her vapid assignments and her unrequited feelings for the show's anchorman (Michael C. Hall). In time her inability to get her life together causes her to completely unravel. Tracy Letts Maria Dizzia and Kim Shaw co-star. Directed by Antonio Campos., , Kate Plays Christine | Black Swan | An Angel at My Table | Broadcast News | A Woman Under the Influence | Benny's Video
https://www.allmovie.com/movie/elle-v658944, Elle, Thriller, Psychological Thriller, Nov 11 2016, 13, Belgium France Germany, R, 9,  Graphic Violence Nudity Profanity Rape & Sexual Abuse Strong Sexual Content, Paul Verhoeven, Canal+ France 2 Cinéma SBS Productions Twenty Twenty Vision Filmproduktion, Sony Pictures Classics, Button Pushers | Nail-biters, Haunted By the Past, assault crime showdown trespassing vengeance video-games violence, , In this thriller from director Paul Verhoeven the head of a successful video-game company (Isabelle Huppert) has her world turned upside down when she is sexually assaulted in her home. Instead of reporting the crime to the police however she opts to hunt down the man responsible on her own. When she finally tracks down her assailant they become locked in a dangerous game that threatens to consume them both., , The Brave One | Revenge | Kill Bill Vol. 2 | Point Blank | Rebecca | Psycho
https://www.allmovie.com/movie/hail-caesar%21-v602088, Hail Caesar!, Comedy, Showbiz Comedy, Feb 5 2016, 10, USA, PG13, 8,  Adult Situations Alcohol Consumption Smoking Suitable for Teens, Ethan Coen / Joel Coen, Mike Zoss Productions Working Title Films, Universal Pictures, Comedy on the Edge | Memory Lane, Actor's Life | Filmmaking | Kidnapping | Scandals and Cover-Ups, Communism gossip-columnist Hollywood movie-studio musical [play] water-ballet, High Production Values, Slick Hollywood fixer Eddie Mannix (Josh Brolin) is pressed into action when superstar actor Baird Whitlock (George Clooney) is kidnapped and held for ransom by a mysterious group. Mannix races to quietly collect the ransom money without gossip columnists Thessaly and Thora Thacker (Tilda Swinton in a dual role) catching wind of the scandal. Alden Ehrenreich Ralph Fiennes Scarlett Johansson Jonah Hill Frances McDormand and Channing Tatum co-star in this comedy set in Hollywood's golden age. Directed by Joel and Ethan Coen., , Rules Don't Apply | The Day of the Locust | The Hudsucker Proxy | L.A. Confidential | Trumbo | Miller's Crossing
https://www.allmovie.com/movie/the-salesman-v659369, The Salesman, Drama, Marriage Drama Melodrama Psychological Drama, Jan 27 2016, 12, France Iran, PG13, 9,  Adult Situations, Asghar Farhadi, Arte France Cinema Asghar Farhadi Production Memento Films, Amazon Studios Cohen Media, , Actor's Life | Criminal's Revenge | Mysterious Strangers | Out For Revenge, , , When a couple (Shahab Hosseini and Taraneh Alidoosti) are forced to vacate their collapsing upscale apartment building a friend offers them a new space to live but doesn't relay that it was formerly inhabited by a prostitute. While home alone at night and taking a shower the wife is attacked and has difficulty coping in the aftermath. Amidst all this tumult the couple rehearse their respective roles in a community production of Arthur Miller's Death of a Salesman., , In the Bedroom | The Past | Red Road | What Lies Beneath | The Big Knife | Greed
https://www.allmovie.com/movie/norman-the-moderate-rise-and-tragic-fall-of-a-new-york-fixer-v666928, Norman: The Moderate Rise and Tragic Fall of a New York Fixer, Drama, Political Satire, Apr 14 2017, 11, Israel USA, R, 9,  Profanity, Joseph Cedar, Blackbird Cold Iron Pictures Tadmor Entertainment, Sony Pictures Classics, , , , , Persistent wheeler-dealer Norman Oppenheimer (Richard Gere) befriends an Israeli politician (Lior Ashkenazi) during the latter's trip to New York City. When the politico is elected prime minister of his country Norman rises in esteem within the local Jewish community even though his new social connections might be a sham. Joseph Cedar wrote and directed this drama which co-stars Michael Sheen Steve Buscemi and Charlotte Gainsbourg., , All the King's Men | Apocalypse Now | The Great Dictator | Sicko | The Candidate | Thank You for Smoking
https://www.allmovie.com/movie/the-jungle-book-v591943, The Jungle Book, Action Children's/Family, Adventure Drama Animal Picture Childhood Drama Family-Oriented Adventure Jungle Film, Apr 15 2016, 10, USA, PG, 7,  Scary Moments, Jon Favreau, Fairview Entertainment Moving Picture Company, Walt Disney Pictures, Young and Old Alike, Monkeys | Survival in the Wilderness | Talking Animals, boy jungle, , In this reimagining of the classic collection of stories by Rudyard Kipling director Jon Favreau uses visually stunning CGI to create the community of animals surrounding Mowgli (Neel Sethi) a human boy adopted by a pack of wolves. The appearance of a villainous tiger named Shere Khan (voiced byIdris Elba) forces Mowgli's guardian the panther Bagheera (Ben Kingsley) to shepherd the child to safety in the "man village." Along the way the boy meets an affable lazy bear named Baloo (Bill Murray) as well as a snake with hypnotic powers (Scarlett Johansson) and an orangutan (Christopher Walken) who wants to harness the power of fire. Lupita Nyong'o Giancarlo Esposito and Garry Shandling also lend their voices to this adventure tale., , Tarzan | The Jungle Book | The Jungle Book | Rudyard Kipling's The Jungle Book | Jungle Book: Mowgli's Story | Up
