https://www.allmovie.com/movie/avengers-infinity-war-v619012, Avengers: Infinity War, Action Adventure Fantasy, Fantasy Adventure Superhero Film, Apr 27 2018, 14, USA, PG13, 5,  Profanity Sci-Fi Violence, Anthony Russo / Joe Russo, , Marvel Studios Walt Disney Studios, Adrenaline Rush, Heroic Mission | Mutants, adventure battle [war] comic-strip fantasy space Superhero villain, High Budget, Iron Man (Robert Downey Jr.) Spider Man (Tom Holland) Thor (Chris Hemsworth) and all the other Avengers unite to assemble their power in order to fight the necessary battle against their biggest collective enemy Thanos (Josh Brolin) before he can wreak his havoc across the entire world. Scarlett Johansson Benedict Cumberbatch Vin Diesel Chris Evans Karen Gillan Zoe Saldana and Dave Bautista also star. Directed by Anthony Russo and Joe Russo., , Iron Man | Justice League | Avengers: Age of Ultron | Marvel's The Avengers | Ant-Man and the Wasp | X-Men: Days of Future Past
https://www.allmovie.com/movie/tully-v660105, Tully, Comedy Comedy Drama, Domestic Comedy, May 4 2018, 9, USA, R, 8,  Nudity Profanity Sexual Situations, Jason Reitman, Bron Studios Right Way Productions, Focus Features, Estrogen Shot, Nannies and Caregivers | Parenthood | Single Parents, babysitter nanny parenthood single-parent, , At the encouragement of her brother (Mark Duplass) Marlo an overwhelmed mother of three (Charlize Theron) and her husband Drew (Ron Livingston) hire a young night nurse named Tully (Mackenzie Davis) to care for their newborn. Tully becomes a confidant for Marlo who when given room to breath grapples with her identity as a wife and mother. Directed by Jason Reitman. Written by Diablo Cody., , Don't Worry He Won't Get Far on Foot | Up in the Air | The Wizard of Oz | It's a Wonderful Life | Life With Father | The Courtship of Eddie's Father
https://www.allmovie.com/movie/nossa-chape-v702930, Nossa Chape, Culture & Society Sports & Recreation, Social Issues Sports Tragedies & Catastrophes, Jun 1 2018, 10, Brazil Colombia Spain, , 8, , Jeff Zimbalist / Michael Zimbalist, All Rise Films, , Food for Thought, Air Disasters | Dying Young | Soccer Players | Starting Over, plane-crash rebuilding soccer stadium survivalist tragedy, , Co-directors and co-writers Jeff and Michael Zimbalist explore the aftermath of the 2016 Chapecoense tragedy. After a plane crash (LaMia Flight 2933) kills all but three Chapecoense football club players their hometown of Chapeco rallies around efforts to revive the organization and reclaim the athletic glory they were poised to attain., , We Are Marshall | Kicking It | Through the Fire: Sebastian Telfair's Defining Year | Brotherhood: Life in the FDNY | After the Cup: Sons of Sakhnin United | Emmanuel's Gift
https://www.allmovie.com/movie/the-night-eats-the-world-v701368, The Night Eats the World, Horror, Sci-Fi Horror Supernatural Horror, Jul 13 2018, 9, France, , 5, , Dominique Rocher, Canal +, Blue Fox Entertainment, Abandon All Hope | Eyepoppers, End of the World | Facing Death | Post-Apocalypse | Zombies, man party end-of-the-world fear home-alone last-man zombie, , Adapted from the novel La Nuit a dévoré le Monde by French writer Pit Agarmen this film debut from director Dominique Rocher follows the plight of Sam (Anders Danielsen Lie) as he awakes in an apartment building in Paris only to wake to find zombies crawling the streets outside. Blockading himself inside his only entertainment comes in the form of a nearby trapped zombie (Denis Lavant) and various inane activities he tries to pass the time. The question is is Sam the only survivor?, , How the West Was Won | The Poseidon Adventure | Blade Runner | On the Waterfront | Days of Heaven | Aliens
https://www.allmovie.com/movie/they-remain-v688344, They Remain, Drama Thriller, Supernatural Thriller Whodunit, Mar 2 2018, 10, USA, , 5, , Philip Gelatt, Family Ranch Reno Productions, Paladin, Spellbinders, Cults | Heroic Mission | When Animals Attack, couple cult forensic-science investigation massacre, Low Budget, Biologists Keith (William Jackson Harper) and Jessica (Rebecca Henderson) are hired by a faceless corporation to research wildlife on land that once belonged to a murderous cult. Isolated in a state-of-the-art facility in the middle of the wilderness paranoia and distrust set in as the pair uncover unsettling animal behavior mysterious artifacts and horrors that seem to stem from the tainted land itself. Based on the short story "--30--" by Laird Barron. Directed by Philip Gelatt., , The Sixth Sense | The Prestige | Laura | The Girl on the Train | Sound of My Voice | The Conversation
https://www.allmovie.com/movie/upgrade-v699248, Upgrade, Action Science Fiction Thriller, Crime Thriller Fantasy Adventure Sci-Fi Action, Jun 1 2018, 10, Australia, R, 7, , Leigh Whannell, Blumhouse Productions Goalpost Pictures, OTL Releasing, Fantastic Reality, Death of a Partner | Future Dystopias | Out For Revenge | Robots and Androids, computer-chip death-in-family future paralysis revenge wife, , Director/writer Leigh Whannell presents a vision of a utopian future where technology is supremely ubiquitous. In that future technophobe Grey Trace (Logan Marshall-Green) embraces an experimental computer chip implant named STEM after a mugging incident leaves him paralyzed and his wife dead. STEM proves to possess its own agency making for an unpredictable ally in Trace’s vendetta., , Judge Dredd | Demolition Man | Blade Runner | Terminator Salvation | Planet of the Apes | 6 Ways to Die
https://www.allmovie.com/movie/mamma-mia%21-here-we-go-again-v693797, Mamma Mia! Here We Go Again, Comedy Musical, Musical Comedy Romantic Comedy, Jul 20 2018, 11, USA, PG13, 4, , Ol Parker, Legendary Pictures Playtone, Universal Pictures, Pick-Me-Ups, Eccentric Families | Expecting a Baby | Family Gatherings | Mothers and Daughters, friendship hotel mother musical [play] past pregnancy romance singing, , In this musical romantic comedy a woman grapples with running her mother's villa while also expecting her first child and worries that she won't be able to handle everything on her own so she enlists two of her mother's friends for assurance help and guidance. Along the way she learns more about her mother's past and how faces a surprise visit from someone she's never met: her own grandmother. Starring Amanda Seyfried Meryl Streep Pierce Brosnan Colin Firth Stellan Skarsgärd and Christine Baranski. Directed by Ol Parker., , Mamma Mia! | Reprise | The Pajama Game | Funny Girl | Humor Me | Camp
https://www.allmovie.com/movie/whitney-v674071, Whitney, Culture & Society Drama Music, Inspirational Drama, Jul 6 2018, 12, USA, , 5, , Kevin MacDonald, Altitude Film Entertainment Happy Street Entertainment Lightbox, Roadside Attractions, Only Human, Drug Addiction | Life in the Arts | Musician's Life, famous-cases legend [famous person] singer/songwriter death diva inspiration pop-music, , This documentary chronicles the tragic career of iconic singer Whitney Houston who achieved pop superstardom before her death in 2012 at age 48. Archive footage is intercut with interviews with Houston’s family and friends including producer Clive Davis ex-husband Bobby Brown and her mother Cissy Houston. Those closest to her discuss her drug abuse marriage and sexuality as well as new allegations that Houston was sexually abused as a child. Directed by Kevin Macdonald., , Whitney | Bound for Glory | Filmworker | Strange Powers: Stephin Merritt and The Magnetic Fields | Paul Williams Still Alive | Searching for the Wrong-Eyed Jesus
https://www.allmovie.com/movie/the-test-the-art-of-thinking-v702411, The Test & The Art of Thinking, Culture & Society Education, Children's Educational Politics & Government Teaching, Apr 27 2018, 8, USA, , 7, , Michael Arlen Davis, Canobie Films, Abramorama, Young and Old Alike, College Life | High School Life | Mind Games | Teachers and Students, college college-admissions mind-expansion practice [preparation] test-preparation, , This documentary explores the purpose and evolution of the SAT/ACT tests which have become the gatekeepers to higher education in America. Educators admissions professionals parents test writers and high school students debate the test’s efficacy and discuss how it has molded how kids are taught and how they learn in the U.S. school system. Directed by Michael Arlen Davis., , The Fog of War | The DUFF | An American in Paris | Adaptation | Breaking Away | Killer Bees
https://www.allmovie.com/movie/uncle-drew-v693170, Uncle Drew, Comedy Comedy Drama, Ensemble Film Reunion Films Sports Comedy, Jun 29 2018, 10, USA, PG13, 6,  Adult Situations Brief Nudity Profanity, Charles Stone III, Creators League Studio Temple Hill Entertainment, Lionsgate, Just for Fun, Basketball Players | Contests Pageants and Competitions | Men's Friendship, basketball-team gathering NBA (National Basketball Association) sports-star street-ball tournament, , Director Charles Stone III’s anti-ageist basketball comedy revolves around a young black man (Lil Rel Howery) and his dream of winning the Rucker Classic street ball tournament in Harlem. After losing his team to his arch-rival he turns to a crew of septuagenarians (played by real-life basketball greats $Kyrie Irving} Shaquille O’Neal Chris Webber Reggie Miller Nate Robinson and Lisa Leslie) in his last bid for victory., , White Men Can't Jump | Eddie | Running Cool | Super Dark Times | Short Cuts | Breaking Away
https://www.allmovie.com/movie/kickboxer-retaliation-v690809, Kickboxer: Retaliation, Action Adventure, Action Thriller Adventure Drama Martial Arts, Jan 26 2018, 11, USA, R, 5,  Violence, Dimitri Logothetis, , Well Go USA Entertainment, Tough Guys, Escape From Prison | In Training | Out For Revenge | Protecting the Innocent, crime-lord fight kickboxer mentor prison wife, , A kickboxing champion (Alain Moussi) is abducted by a ruthless gangster (Christopher Lambert) and winds up in prison where he is forced to battle a brutal muscle-bound thug (Hafþór Júlíus Björnsson). He soon prepares for the bout with the help of his mentor (Jean-Claude Van Damme). Dimitri Logothetis wrote and directed this martial-arts film which serves as a sequel to Kickboxer: Vengeance and is the seventh film in the Kickboxer series. Mike Tyson co-stars., , Kickboxer | Blind Fury | Sergeant York | The Gauntlet | The Towering Inferno | Speed
https://www.allmovie.com/movie/half-the-picture-v697505, Half the Picture, Culture & Society, Gender Issues Social Issues, Jun 22 2018, 9, USA, NR, 8, , Amy Adrion, Leocadia Films, Gravitas Ventures, Estrogen Shot, Battle of the Sexes | Gender-Bending | Questioning Gender Roles | Social Injustice, femininity feminism gender-roles production [showbiz] sexism women, , This documentary from Amy Adrion explores the gender bias sexism and glass ceiling in Hollywood and how the male-dominated industry has perpetuated an unequal playing field for female directors. It features interviews with numerous notable female directors\ to illuminate their personal and professional struggles., , Las Madres: The Mothers of Plaza de Mayo | Rancher Farmer Fisherman | Killer Bees | Harlan County USA | Town Bloody Hall
https://www.allmovie.com/movie/mile-22-v643974, Mile 22, Action, Action Thriller, Aug 17 2018, 9, USA, , 6,  Profanity Violence, Peter Berg, Closest to the Hole Productions Film 44 Hideaway Entertainment Huayi Brothers Leverage Entertainment, STX Entertainment, Adrenaline Rush, Fighting the System | Heroic Mission | Hotshots, CIA (Central-Intelligence-Agency) operation patriotism police-officer top-secret, , An elite paramilitary team called Overwatch is tasked with transporting a police officer (Iko Uwais) with vital information about a potential terrorist attack 22 miles across Southeast Asia from the American embassy to an airfield. With the help of high-tech communications expert Bishop (John Malkovich) and second-in-command Alice (Lauren Cohan) leader Jimmy Silva (Mark Wahlberg) and his team must outrun local military police and gang leaders to complete their mission. Directed by Peter Berg. Ronda Rousey Sam Medina and Carlo Alban co-star., , Jason Bourne | The French Connection | The Hurt Locker | Blind Fury | Crimson Tide | The Man From U.N.C.L.E.
https://www.allmovie.com/movie/dark-money-v697557, Dark Money, Culture & Society, Docudrama, Jul 13 2018, 9, USA, , 7, , Kimberly Reed, Big Sky Film Productions Big Mouth Productions, PBS, Only Human, Police Corruption, America corruption politics, , Director/co-producer Kimberly Reed’s timely documentary scrutinizes the notoriously opaque world of political campaign financing. With Montana as a case study and investigative journalist John Adams as a primary protagonist it pulls back the curtain on the “dark money network” which allows for widespread propaganda and misinformation to be funded anonymously., , Get Me Roger Stone | JFK | Wuthering Heights | Spotlight | Erin Brockovich | Sicko
https://www.allmovie.com/movie/sicario-day-of-the-soldado-v661582, Sicario: Day of the Soldado, Action Crime Drama, Crime Drama, Jun 29 2018, 12, USA, R, 7,  Profanity Violence, Stefano Sollima, Black Label Media Thunder Road Pictures, Columbia Pictures, Slow Burn, Battling Illness | Drug Trade | Kidnapping, bombing cartel smuggling drug-wars federal-agent Mexico terrorist, , In this adventure/drama FBI agent Matt Graver (Josh Brolin) enlists a mysterious operative to help investigate a Mexican drug cartel that has been smuggling terrorists into the U.S. Things escalate when the daughter of a top kingpin is abducted forcing Graver and his partner to re-evaluate their mission. Also starring Benicio Del Toro Matthew Modine Isabela Moner and Jeffrey Donovan. Directed by Stefano Sollima., , The French Connection | American Gangster | Collateral | All the King's Men | Superfly | Do the Right Thing
https://www.allmovie.com/movie/path-of-blood-v702984, Path of Blood, Culture & Society History, Military & War Tragedies & Catastrophes World History, Jul 13 2018, 9, Saudi Arabia UK, , 6, , Jonathan Hacker, Page 1, Paladin, Food for Thought, Crimes of Passion | Suicide | Terrorism, al-Qaeda idealism suicide-bombing terrorism terrorist terrorist-attack, , Award winning director/producer Jonathan Hacker’s gritty documentary chronicles the rise of Islamic terrorism through the use of footage shot by Al Qaeda’s own soldiers. It provides an unprecedented perspective on the bloody campaign that Osama bin Laden initiated against the House of Saud the impressionable youths captivated by the jihadi cause and the Saudi government’s efforts to undermine their plans., , Where in the World Is Osama bin Laden? | No End in Sight | Waltz With Bashir | The First Purge | A Film Unfinished | The Road
https://www.allmovie.com/movie/first-match-v701881, First Match, Drama, Family Drama Sports Drama, Mar 30 2018, 10, USA, , 7, , Olivia Newman, CreativeBionics, Netflix, Off the Beaten Path, Fathers and Daughters | In Training | Non-Traditional Families | Wrestling, father-figure foster-care girl streetfighting team-sports wrestling-Greco-Roman, , Having spent her entire life bouncing to and from foster homes in Brooklyn teenager Monique (Elvire Emanuelle) is determined to join an all-boys wrestling team in the hopes of establishing a relationship with her ex convict father Darrel (Yahya Abdul-Mateen II). Colman Domingo Jharrel Jerome and Jared Kemp also star. Written and directed by Olivia Newman., , Million Dollar Baby | Girlfight | Interiors | The Heiress | The Fighter | North Dallas Forty
https://www.allmovie.com/movie/boundaries-v702373, Boundaries, Comedy Drama, Adventure Comedy Crime Comedy, Jun 22 2018, 10, USA, R, 5,  Drug Content Nudity Profanity Sexual Situations, Shana Feste, Automatik Entertainment Oddfellows Entertainment Quiet Girls, Sony Pictures Classics, Just for Fun, Family Gatherings | Mothers and Daughters | Non-Traditional Families | Unlikely Criminals, criminal family-member family-reunion grandfather grandson road-trip, , "When scheming Jack (Christopher Plummer) is thrown out of his retirement home his animal do-gooder daughter Laura (Vera Farmiga) mom to teen son Henry (Lewis MacDougall) agrees to drive her him alongside her son from Seattle to L.A so that he may stay with her sister JoJo (Kristen Schaal). Unbeknownst to Laura Jack enlists Henry to help to sell his secret stash of marijuana along the way in this family comedy written and directed by Shana Feste.", , Getting Grace | Life of the Party | Bus Stop | The First Auto | The Full Monty | Supercon
https://www.allmovie.com/movie/crazy-rich-asians-v677274, Crazy Rich Asians, Comedy Drama, Domestic Comedy Romantic Comedy, Aug 15 2018, 12, USA, PG13, 7,  Profanity, Jon M. Chu, Color Force Electric Somewhere SK Global Starlight Culture, Warner Bros. Pictures, Comedy on the Edge, Foibles of Marriage | Mothers and Sons | Star-Crossed Lovers | Wedding Bells, class [social] groom [bridegroom] bride China competition wedding, , Chinese-American New Yorker Rachel Chu (Constance Wu) travels to Singapore with her boyfriend Nick Young (Henry Golding) to attend his best friend's wedding only to discover he comes from one of Asia's most wealthy prominent families. A commoner among the social elite Rachel becomes a target for single women vying for Nick's attention as well as for his judgemental mother Eleanor (Michelle Yeoh) who wants nothing more than to break them up. Directed by Jon M. Chu. Based on the novel of the same name by Kevin Kwan. Awkwafina Ken Jeong Chris Pang and Harry Shum Jr. co-star., , She's Having a Baby | Measure of a Man | Humor Me | Bed and Board | Life of the Party | Supercon
https://www.allmovie.com/movie/mercury-13-v702807, Mercury 13, Culture & Society Science & Technology, Docudrama, Apr 20 2018, 7, USA, , 8, , David Sington / Heather Walsh, , Netlfix, Food for Thought, Gender-Bending, space women, , In the 1960s space race a select group of women underwent rigid training to prepare for potential space flight only to be denied by NASA. The 13 women who fought for gender equality in aeronautics finally share their side of the story. This documentary was directed by David Sington and Heather Walsh., , Ordinary People | Titanic | The Pride of the Yankees | The Way We Were | Erin Brockovich | Bobby
https://www.allmovie.com/movie/the-commuter-v642529, The Commuter, Action Thriller, Action Thriller Detective Film, Jan 12 2018, 10, UK USA, PG13, 4,  Profanity Violence, Jaume Collet-Serra, StudioCanal, Lionsgate Films, Adrenaline Rush, Bodyguards | Heroic Mission | Hostage Situations | Terrorism, commuter hero hostage-crisis terrorist-attack, High Budget, During his daily commute from Manhattan to Upstate New York a cop-turned-insurance salesman (Liam Neeson) is approached by a mysterious woman (Vera Farmiga) who tells him that he must locate a passenger who's carrying something dangerous. If he fails everyone aboard the train as well as his family at home will be killed. Patrick Wilson Elizabeth McGovern Sam Neill and Jonathan Banks co-star. Directed by Jaume Collet-Serra., , The Taking of Pelham 1 2 3 | Olympus Has Fallen | Inside Man | Beirut | The Rock | Rebels on Pointe
https://www.allmovie.com/movie/white-boy-rick-v680109, White Boy Rick, Crime Drama, Crime Drama, Sep 14 2018, 11, , R, 6,  Brief Nudity Drug Content Profanity Violence, Yann Demange, LBI Entertainment Protozoa Pictures Studio 8, Columbia Pictures Corporation, In a Minor Key, Double Life | Drug Trade | Traitorous Spies/Double Agents, drug-dealer FBI (Federal Bureau of Investigation) imprisonment informer, , In 1980s Detroit white teenager Rick Wershe Jr. (Richie Merritt) sees an opportunity to get his family out of poverty by joining up in the cocaine operation taking place in his predominantly African-American neighborhood. He then becomes the youngest FBI informant in history when he's recruited by government officials to take down the drug ring from the inside. Directed by Yann Demange. Based on a true story. Matthew McConaughey Jennifer Jason Leigh Brian Tyree Henry and RJ Cyler co-star., , 
https://www.allmovie.com/movie/hotel-artemis-v702726, Hotel Artemis, Action Crime Science Fiction Thriller, Action Thriller Sci-Fi Action, Jun 8 2018, 9, UK USA, R, 4,  Drug Content Profanity Sexual Situations Violence, Drew Pearce, Marc Platt Productions The Ink Factory, Global Road Entertainment, Eyepoppers, Future Dystopias | Secret Organizations, riot [uprising] secret-organization criminal emergency-room future hospital nurse, , A woman known as The Nurse (Jodie Foster) runs a high-security members-only hospital for high-rolling criminals in Los Angeles. When a bank robber (Sterling K. Brown) brings his injured teammates along with $18 million in jewels there both mob boss Wolf King (Jeff Goldblum) and the police follow. With the hospital under siege The Nurse her orderly (Dave Bautista) and her other criminal patients have to defend themselves. Charlie Day Sofia Boutella Jenny Slate and Zachary Quinto co-star. Written and directed by Drew Pearce., , Children of Men | I Am Number Four | The Satan Bug | Superfly | The French Connection | Blade Runner
https://www.allmovie.com/movie/hover-v702949, Hover, Mystery Science Fiction, Sci-Fi Adventure, Jun 29 2018, 8, USA, , 4, , Matt Osterman, , SYFY Films, Fantastic Reality, Fantasy Life | Future Dystopias | Protecting the Innocent | Technology Run Amok, future help provider technology, , In the dystopian future a deadly drought and the resulting food shortages have led to the use of agricultural drones to help cultivate the remaining farm land. After her mentor John (Craig "muMs" Grant) is mysteriously murdered rural care worker Claudia (Cleopatra Coleman) begins speaking to farmers working with the drones and uncovers a tech company conspiracy. She learns the robots are capable of deadly force to police and subjugate humans. Directed by Matt Osterman with a script by Coleman who stars alongside Shane Coffey Fabianne Therese and Beth Grant., , Gattaca | A.I.: Artificial Intelligence | The Martian | Jurassic Park | Jupiter Ascending | Planet of the Apes
https://www.allmovie.com/movie/measure-of-a-man-v701736, Measure of a Man, Comedy Drama Drama, Domestic Comedy Inspirational Drama, May 11 2018, 10, USA, PG13, 5,  Adult Situations Profanity Substance Abuse, Jim Loach, Taylor Lane Productions, Great Point Media, Just for Fun, Body Image and Self-Esteem | Journey of Self-Discovery | Teen Angst, self-confidence self-defense self-protection teenagers, , Teen Bobby (Blake Cooper) spends his summer vacation working as a groundskeeper for the very wealthy yet obscure Dr. Kahn (Donald Sutherland). After he's repeatedly bullied by other boys vacationing at the lake he turns to his mysterious employer for guidance on navigating life's low points. Judy Greer Luke Wilson and Liana Liberato also star. Based on the novel One Fat Summer by Robert Lipsyte this film adaptation was directed by Jim Loach., , Stand by Me | Life of the Party | Crazy Rich Asians | Austin Found | Don't Worry He Won't Get Far on Foot | Getting Grace
https://www.allmovie.com/movie/social-animals-v702369, Social Animals, Culture & Society, Social Issues, , 8, USA, R, 4,  Drug Content Profanity Strong Sexual Content, Jonathan Ignatius Green, Conscious Minds Productions, , A World of Its Own, Social Climbing, photographer socialite teenagers, , "Introducing the online and offline lives of three aspiring social media influencers this American documentary directed by Jonathan Ignatius Green gives a gentle insight into the world of social media popular figuresstar brands. From homely Midwest teen Emma Crocket wannabe swimsuit model Kaylyn Slevin to the more sport and art affiliated thrill seeker photographer Humza Deas all are bound by the need for likes followers and comments as they crave popularity and fame at nearly any cost. ", , Under African Skies | An Inconvenient Truth | Darfur Now | Living in Emergency: Stories of Doctors Without Borders | Detropia | American Promise
https://www.allmovie.com/movie/unbroken-path-to-redemption-v701792, Unbroken: Path to Redemption, Drama, Inspirational Drama, Sep 14 2018, 9, USA, PG13, 4,  Adult Situations, Harold Cronk, Universal 1440 Entertainment, Pure Flix, Triumph of the Spirit, Home From the War | Reluctant Hero | Starting Over, love Olympic-sports post-war world-war, , The story of Olympian and WWII hero Louis Zamperini (Samuel Hunt) continues in this drama from director Harold Cronk. Zamperini meets and marries the love of his life while struggling with his post-war angst until a chance meeting with Billy Graham (Will Graham) in 1949 changes both of their lives forever. Also starring Merritt Patterson Bobby Campo Vanessa Bell and David Sakurai., , 
https://www.allmovie.com/movie/adrift-v699242, Adrift, Action Adventure Drama Romance, Adventure Drama, Jun 1 2018, 10, USA, PG13, 9,  Brief Nudity Drug Content Profanity, Baltasar Kormákur, Lakeshore Entertainment RVK Studios, STXfilms, Only Human, Down on Their Luck | Facing Death | Forces of Nature | Supernatural Romance, attraction disaster hurricane survival water, , Tami (Shailene Woodley) and Richard (Sam Claflin) are a young couple who’s sailing 4000 miles across the Pacific Ocean who suddenly find themselves approaching a Category 5 storm with no hope of diverting. Tami awakes afterward stranded on their wrecked boat but has a determined will to survive. Based on a true story. Directed by Baltasar Kormákur., , We Are Marshall | First Kill | Life of Pi | Marty | As Good As It Gets | Master and Commander: The Far Side of the World
