https://www.allmovie.com/movie/tag-v581033, Tag, Comedy, Adventure Comedy, Jun 15 2018, 10, USA, R, 9,  Brief Nudity Drug Content Profanity Sexual Situations, Jeff Tomsic, Broken Road Productions, New Line Cinema, Just for Fun, Faltering Friendships | Playing the Field | Unlikely Friendships, class-reunion friendship fun traveling classmate game, , Childhood friends Jerry (Jeremy Renner) Callahan (Jon Hamm) Randy (Jake Johnson) Sable (Hannibal Buress) and Hoagie (Ed Helms) have been competing in the same game of tag for 30 years. When Jerry gets married he attempts to retire from the intense annual game without ever being "it" causing the other four to band together and go to extreme lengths to finally tag him. Directed by Jeff Tomsic. Inspired by the Wall Street Journal article “It Takes Planning Caution to Avoid Being It.” Isla Fisher Annabelle Wallis Rashida Jones Leslie Bibb and Nora Dunn co-star., , Why Worry? | The DUFF | Houseboat | Humor Me | Crocodile Dundee | Sleeping With Other People
https://www.allmovie.com/movie/the-incredibles-2-v596222, The Incredibles 2, Action Adventure, Family-Oriented Adventure Sci-Fi Adventure Superhero Film, Jun 15 2018, 11, USA, PG, 10, , Brad Bird, Pixar, Walt Disney Pictures, Young and Old Alike, Heroic Mission | Unlikely Heroes, family father hero mask [disguise] retirement Superhero super-power villain, , Mr. Incredible (Craig T. Nelson) is left home with Violet (Sarah Vowell) Dash (Huck Milner) and Jack-Jack when Elastigirl (Holly Hunter) becomes the new face of superheros in a rebranding attempt. As he juggles endless household chores she gets to work to save everyone from a new villain. Bob Odenkirk Samuel L. Jackson and Catherine Keener also star. This animated sequel is written and directed by Brad Bird., , Iron Man | Wonder Woman | Fantastic Four | The Incredibles | Rise of the Guardians | Rango
https://www.allmovie.com/movie/wont-you-be-my-neighbor-v697667, Won't You Be My Neighbor?, Film TV & Radio, Biography, Jun 8 2018, 9, USA, PG13, 9,  Profanity, Morgan Neville, Tremolo Productions, Focus Features, Young and Old Alike, Actor's Life | Life in the Arts, imagination legacy sweater children entertainer fun learning-skills, , "This documentary paints a portrait of the philosophy and work of cardigan-wearing children’s entertainer Fred Rogers star of the popular show “Mister Rogers’ Neighborhood.” A former minister Mister Rogers creatively communicated themes of empathy and acceptance using a colorful cast of puppets and friends for more than 30 years. Along with archival footage Rogers’ contemporaries and castmates reflect on his legacy. Directed by Morgan Neville. ", , Wait for Your Laugh | Along for the Ride | Saving Brinton | Rita | The Robin Harris Story: We Don't Die We Multiply | Fellini: I'm a Born Liar
https://www.allmovie.com/movie/solo-a-star-wars-story-v638696, Solo: A Star Wars Story, Action Science Fiction, Sci-Fi Action Sci-Fi Adventure, May 25 2018, 13, USA, PG13, 8,  Sci-Fi Violence, Ron Howard, Lucasfilm, Walt Disney Pictures, Just for Fun, High School Life | Keeping a Secret | Robots and Androids | Space Travel | Space Wars, android creature galaxy robot smuggling space space-race, , Flight school flunkie and petty criminal Han Solo (Alden Ehrenreich) gets recruited by Tobias Beckett (Woody Harrelson) for an intergalactic mission backed by gangster Dryden Vos (Paul Bettany). He teams up with his future Wookiee co-pilot Chewbacca (Joonas Suotamo) his childhood friend Qi’Ra (Emilia Clarke) and suave smuggler Lando Calrissian (Donald Glover) owner of the Millenium Falcon. Thandie Newton Jon Favreau Warwick Davis and Phoebe Waller-Bridge co-star. Directed by Ron Howard. Written by Jonathan and Lawrence Kasdan., , Rogue One: A Star Wars Story | Guardians of the Galaxy | Aliens | Star Trek Into Darkness | Guardians of the Galaxy Vol. 2 | The Martian
https://www.allmovie.com/movie/mission-impossible-fallout-v647034, Mission: Impossible - Fallout, , Action Thriller, Jul 27 2018, 14, USA, , 8, , Christopher McQuarrie, Bad Robot Productions Skydance Productions, Paramount Pictures, Adrenaline Rush, Assassination Plots | Conspiracies | Escape From Prison | Traitorous Spies/Double Agents, CIA (Central-Intelligence-Agency) hitman prison-escape secret-agent secret-mission, , After a mission goes wrong and anarchist Solomon Lane (Sean Harris) escapes custody Ethan Hunt (Tom Cruise) and his IMF team are blamed and their loyalty is questioned. They attempt to fulfill their initial mission and recapture Lane while also trying to outrun a ruthless CIA agent (Henry Cavill) tasked with taking them out. As Hunt fends off these old and new threats he also realizes allies within IMF might have other motives. Produced written and directed by Christopher McQuarrie. Alec Baldwin Angela Bassett Rebecca Ferguson Simon Pegg Ving Rhames and Michelle Monaghan co-star., , 
https://www.allmovie.com/movie/leave-no-trace-v697451, Leave No Trace, Drama, Family Drama Psychological Drama, Jun 29 2018, 10, USA, PG, 9,  Adult Situations, Debra Granik, Bron Studios, Bleecker Street, Angsty, Bohemian Life | Eccentric Families | Fathers and Daughters | Finding a Way Back Home, camping daughter father forest isolation off-road park Social-Services, , After living off the grid in Oregon for years traumatized military veteran Will (Ben Foster) and his teenage daughter Tom (Thomasin Harcourt McKenzie) are picked up by social services and forced to integrate back into society. While Tom begins to connect with others and thrive Will struggles and attempts to avoid his demons by escaping back into the wild. Directed by Debra Granik. Based on the novel "My Abandonment" by Peter Rock., , Winter's Bone | Captain Fantastic | Into the Wild | The Visitor | The Best Years of Our Lives | Death of a Salesman
https://www.allmovie.com/movie/mcqueen-v701927, McQueen, Culture & Society Visual Arts, Beauty & Fashion Biography Performance Art Psychological Drama, Jul 20 2018, 11, UK, R, 8,  Nudity Profanity, Ian Bonhôte / Peter Ettedgui, Misfits Entertainment Salon Pictures, Bleecker Street, Only Human, Fashion World | Single Life, British fashion-designer interview life-story suicide, , Alexander McQueen award-winning fashion designer and couturier burst on tothe fashion scene in the 90s after learning his trade first at Saville Row then Givenchy finally forming his own eponymous label. Told via the accounts of those who knew him best this documentary directed by Ian Bonhôte and Peter Ettedgui both celebrates and commiserates the genius that drove McQueen to his much-celebrated success and the demons that plagued him. Alexander McQueen, , Fashion Victim: The Killing of Gianni Versace | The Gospel According to André | Westwood: Punk Icon Activist | Ultrasuede: In Search of Halston | Diana Vreeland: The Eye Has to Travel | Dressed
https://www.allmovie.com/movie/blockers-v676279, Blockers, Comedy, Sex Comedy, Apr 6 2018, 10, USA, R, 8,  Drug Content Nudity Profanity Sexual Situations Youth Substance Use, Kay Cannon, Good Universe Point Grey, Universal Pictures, Angsty, High School Life | Parenthood | Sexual Awakening | Teen Angst, parent prom sex teenagers virgin, , In Pitch Perfect screenwriter Kay Cannon's directorial debut Leslie Mann John Cena and Ike Barinholtz play meddling parents who discover that their teenage daughters (Kathryn Newton Gideon Adlon and Geraldine Viswanathan) have made a pact to lose their virginities on prom night. They decide to intervene and stop them by following them during the night's various wild festivities. Gary Cole June Diane Raphael Hannibal Buress and Colton Dunn co-star., , American Pie | The Graduate | Some Like It Hot | The Man Who Loved Women | Shampoo | My Chauffeur
https://www.allmovie.com/movie/red-sparrow-v663219, Red Sparrow, Spy Film Thriller, Erotic Thriller Paranoid Thriller Unglamorized Spy Film, Mar 2 2018, 14, USA, R, 7,  Graphic Violence Nudity Profanity Sexual Situations Torture, Francis Lawrence, Chernin Entertainment, 20th Century Fox, Button Pushers, Femmes Fatales | Switching Sides | Traitorous Spies/Double Agents | Woman In Jeopardy, ballerina CIA (Central-Intelligence-Agency) intelligence [gov't] Russia spy training-program, High Production Values, A Russian ballerina (Jennifer Lawrence) is recruited for a brutal training regime for "Sparrows" highly trained spies who use their sexuality to manipulate their targets. She is assigned to seduce a CIA officer (Joel Edgerton) as part of a mission to uncover a mole within the Russian government but she is soon tempted to turn double agent and strike back against her cruel handlers. Matthias Schoenaerts Jeremy Irons Mary-Louise Parker Charlotte Rampling and Joely Richardson co-star. Directed by Francis Lawrence (The Hunger Games: Catching Fire) Red Sparrow is based on the novel of the same name by Jason Matthews., , Atomic Blonde | Salt | Mata Hari | The Bourne Legacy | Marathon Man | Jason Bourne
https://www.allmovie.com/movie/the-gospel-according-to-andr%C3%A9-v691868, The Gospel According to André, Culture & Society Visual Arts, Beauty & Fashion Biography, May 25 2018, 9, , PG13, 7,  Adult Situations, Kate Novack, , Magnolia Pictures, Only Human, Fashion World, African-American editor fashion, , Esteemed African-American fashion editor André Leon Talley’s life and ascent in the fashion world is chronicled through interviews archival footage and home videos. This documentary traces his career from his youth in the segregated South to his work at publications such as W and Vogue to his enduring influence today. Featuring interviews with fashion icons such as Anna Wintour Tom Ford Marc Jacobs and Diane von Furstenberg as well as celebrities such as Whoopi Goldberg Tamron Hall and Will.i.am. Directed by Kate Novack., , In Vogue: The Editor's Eye | Westwood: Punk Icon Activist | Dressed | Manolo: The Boy Who Made Shoes for Lizards | Vidal Sassoon: The Movie | Art Bastard
https://www.allmovie.com/movie/superfly-v698962, Superfly, Action Crime Thriller, Action Thriller Blaxploitation Crime Thriller, Jun 13 2018, 11, USA, R, 7,  Drug Content Nudity Profanity Sexual Situations Violence, Director X., Silver Pictures, Columbia Pictures, Adrenaline Rush, Crime Gone Awry | Drug Trade | One Last Heist | Street Gangs, Black [race] respect wealth drug-dealer drug-trade drug-wars, , In this remake of the 1972 blaxploitation film Super Fly Trevor Jackson plays Youngblood Priest an Atlanta drug kingpin whose throne is threatened by a ruthless new crew with Mexican cartel connections. To protect his mentor (Michael Kenneth Williams) his best friend (Jason Mitchell) and his girlfriend (Lex Scott Davis) Priest decides to get out of the game but only after going to Mexico to make one last big deal. Directed by Director X. Jennifer Morrison and Omar Chaparro co-star with cameos by Big Boi Lecrae and Rick Ross., , Superfly | Shaft | Collateral | Payback | Contraband | The French Connection
https://www.allmovie.com/movie/nostalgia-v697639, Nostalgia, Drama, Ensemble Film Family Drama Slice of Life, Feb 16 2018, 11, USA, R, 5, , Mark Pellington, , Bleeker Street, Only Human, Fish Out of Water | Intersecting Lives | Starting Over, love memorabilia memories solace, High Artistic Quality High Production Values, A widow (Ellen Burstyn) copes with the loss of most of her possessions in a fire in this ensemble drama about the way we remember the past through physical objects. Elsewhere a memorabilia dealer (Jon Hamm) prepares to sell off the contents of his parents' old house and an elderly man (Bruce Dern) has his estate appraised by an insurance assessor (John Ortiz). Catherine Keener James LeGros Amber Tamblyn and Nick Offerman co-star. Directed by Mark Pellington., , Syriana | Argo | Bridge of Spies | Fair Game | Don't Worry He Won't Get Far on Foot | To Kill a Mockingbird
https://www.allmovie.com/movie/who-we-are-now-v702826, Who We Are Now, Drama, Courtroom Drama Family Drama Melodrama Psychological Drama, May 25 2018, 9, USA, , 8, , Matthew Newton, No Place Like Films, FilmRise, A Good Cry, Brief Encounters | Coming Home | Custody Battles | Mothers and Sons | Redemption | Starting Over, custody-battle ex-convict mother prison public-defender romance soldier son, , Writer/director Matthew Newton’s indie drama revolves around Beth (Julianne Nicholson) a single mother who struggles to regain legal custody of her son after being released from prison. With the professional help of a young and idealistic public defence attorney (Emma Roberts) and emotional support from an ex-Marine lover coping with PTSD (Zachary Quinto) she strives to overcome her personal demons and get her life back on track., , Kramer vs. Kramer | American Heart | What Maisie Knew | Ordinary People | Breaking the Waves | Coming Home
https://www.allmovie.com/movie/far-from-the-tree-v694474, Far From the Tree, Culture & Society Education, Social Issues Special Education, Jul 20 2018, 9, USA, , 7, , Rachel Dretzin, Ark Media, Sundance Selects, Only Human, Eccentric Families | Living With Disability, family parent tree, , Emmy-winning filmmaker Rachel Dretzin's documentary aims to capture the “shimmering humanity” encapsulated by Andrew Solomon’s critically-acclaimed 2012 nonfiction book Far From the Tree: Parents Children and the Search for Identity. It chronicles the challenges – and rewards – that American families face when raising children who face different challenges from their parents. Families impacted by Down syndrome dwarfism autism and prison sentences are spotlighted., , An American in Paris | Citizen Kane | A Streetcar Named Desire | To Kill a Mockingbird | Marty | Lost in Translation
https://www.allmovie.com/movie/ryuichi-sakamoto-coda-v701797, Ryuichi Sakamoto: Coda, Culture & Society Music, Instrumental Music Music History, Jul 27 2018, 10, Japan USA, , 8, , Stephen Nomura Schible, Cineric Creative, MUBI, Food for Thought, Battling Illness | Musician's Life, cancer Japan Japanese [nationality] musician nuclear nuclear-protest, , Following the life and work of Oscar-winning composer Ryuichi Sakamoto this in-depth documentary explores the personal professional and historical influences that inspired his music. Spanning five-years this portrait of a musical genius culminates in what he believes to be his final album. Directed by Stephen Nomura Schible and featuring testimonials from musical greats such as David Bowie and Yukihiro Takahashi., , Boom for Real: The Late Teenage Years of Jean-Michel Basquiat | Nico 1988 | Tupac: Resurrection | Under African Skies | Chris Brown: Welcome to My Life | It Might Get Loud
https://www.allmovie.com/movie/blackkklansman-v694434, BlacKkKlansman, Comedy Crime, Biopic [feature] Crime Comedy, Aug 10 2018, 13, USA, R, 8,  Graphic Violence Profanity Sexual Situations, Spike Lee, 40 Acres & A Mule Filmworks Blumhouse Productions Monkeypaw Productions QC Entertainment, Focus Features, Pick-Me-Ups, Going Undercover | Rookie Cops | Social Injustice, African-American infiltration KKK (Ku Klux Klan) police-officer surrogate undercover White (Caucasian), , Director Spike Lee’s dramedy was produced by the team behind Get Out and offers another provocative exploration of American race relations. In the midst of the 1970s civil rights movement Ron Stallworth (John David Washington) becomes the first black detective on the Colorado Springs Police Department. He sets out to prove his worth by infiltrating the local chapter of the Ku Klux Klan and convinces his Jewish colleague (Adam Driver) to go undercover as a white supremacist., , 
https://www.allmovie.com/movie/black-panther-v619010, Black Panther, Action Science Fiction, Sci-Fi Action Sci-Fi Adventure Superhero Film, Feb 16 2018, 13, USA, PG13, 9,  Violence, Ryan Coogler, Marvel Studios, Walt Disney Pictures, Other Dimensions, Chosen One | Fantasy Lands | Heroic Mission | Reluctant Hero, African death-in-family enemy king kingdom panther Superhero, High Budget, Following the death of his father T'Challa (Chadwick Boseman) is crowned the king of Wakanda a technologically advanced country in Africa that has hidden itself away from the rest of the world. T'Challa is charged with defending the nation in his guise as the costumed superhero known as Black Panther but his reign is challenged by a Wakanda dissident named Erik Killmonger (Michael B. Jordan) who wants to sell the country's natural resources to fund an uprising. Lupita Nyong'o Danai Gurira Martin Freeman Daniel Kaluuya Letitia Wright Winston Duke Angela Bassett Forest Whitaker and Andy Serkis co-star. Directed by Ryan Coogler., , Iron Man | Thor | Hulk | Avengers: Age of Ultron | Ant-Man | Avengers: Infinity War
https://www.allmovie.com/movie/93queen-v708186, 93Queen, Culture & Society, Careers Gender Issues Social Issues, Jul 27 2018, 9, USA, , 7, , Paula Eiselt, Malka Films, , Triumph of the Spirit, Obsessive Quests | Social Injustice, ambulance feminism Jewish volunteer women women's-issues, , Director Paula Eiselt’s documentary spotlights Rachel "Ruchie" Freier and her pioneering feminist activism. As the creator of the Ezras Nashim (Women for Women) an all-female Hasidic EMT corps that services Borough Park Brooklyn (home to America’s largest ultraorthodox Jewish community) Freier brazenly defies her community’s gender norms. She braves further opposition in her quest to become the first Hasidic woman to hold public office in the United States., , Queen Mimi | She's Beautiful When She's Angry | Step | Harlan County USA | Citizen Clark... A Life of Principle | Westwood: Punk Icon Activist
https://www.allmovie.com/movie/pass-over-v697448, Pass Over, Drama, Fantasy Drama, , 7, USA, , 7, , Spike Lee, 40 Acres & A Mule Filmworks, Amazon, A World of Its Own, Fantasy Life, fantasy daydream, , Moses (Jon Michael Hill) and Kitch (Julian Parker) two young African-American men spend their time on a street corner musing on their future success. Throughout the day they face with white cops gunshots and other factors that make their dreams of “passing over” the hood more difficult. Ryan Hallahan and Blake Long also star. Written by Antoinette Nwandu this was directed for the stage by Danya Taymor. Directed for film by Spike Lee and Danya Taymor., , Citizen Kane | Million Dollar Baby | Ordinary People | Blade Runner | Drugstore Cowboy | The Hours
https://www.allmovie.com/movie/puzzle-v697511, Puzzle, Drama, Marriage Drama Psychological Drama, Jul 27 2018, 10, USA, R, 7,  Profanity, Marc Turtletaub, Olive Productions, Sony Pictures Classics, Triumph of the Spirit, Contests Pageants and Competitions | Estrangement | Journey of Self-Discovery, competition head-of-household puzzle self-awareness self-discovery wife, , Listless meek Catholic housewife Agnes (Kelly Macdonald) discovers a passion for jigsaw puzzles. When visiting her local puzzle shop she sees an ad from a puzzle champion named Robert (Irrfan Khan) who is seeking a partner to compete with. Despite their differences Agnes connects with Robert over their hobby which unlocks her ambition and helps her better understand her faith and relationships. Directed by Marc Turtletaub. David Denman co-stars., , Erin Brockovich | Puzzle | Ray | Good Will Hunting | The Visitor | Don't Worry He Won't Get Far on Foot
https://www.allmovie.com/movie/isle-of-dogs-v667229, Isle of Dogs, Drama Fantasy, Animal Picture Children's Fantasy Fantasy Comedy Fantasy Drama, Mar 23 2018, 10, Germany USA, PG13, 6, , Wes Anderson, American Empirical Pictures Indian Paintbrush Scott Rudin Productions, Fox Searchlight Pictures, Young and Old Alike, Conspiracies | Daring Rescues | Future Dystopias | Talking Animals, boy conspiracy dog garbage island lost, , In this stop-motion-animated film from writer/director Wes Anderson an outbreak of canine flu in Japan leads all dogs to be quarantined on an island. A boy (voice of Koyu Rankin) journeys there to rescue his dog Spots (Liev Schreiber) and gets help from a pack of misfit canines who have also been exiled. His quest inspires a group of dog lovers to expose a government conspiracy. The voice cast also includes Bryan Cranston Edward Norton Bill Murray Scarlett Johansson Tilda Swinton Bob Balaban Greta Gerwig and Yoko Ono., , Pleasantville | Namiya | An American in Paris | Bedtime Stories | Humor Me | The Illusionist
https://www.allmovie.com/movie/the-spy-who-dumped-me-v685339, The Spy Who Dumped Me, Action Comedy, Action Comedy, Aug 3 2018, 11, USA, R, 6,  Nudity Profanity Sexual Situations Violence, , Imagine Entertainment, Lionsgate, Just for Fun, Conspiracies | On the Run | Traitorous Spies/Double Agents | Women's Friendship, conspiracy ex-boyfriend friend mission [quest] rescue spy spy-films traveling, , Audrey (Mila Kunis) discovers her awful ex Drew (Justin Theroux) is secretly a spy when he shows up at her door with deadly assassins on his tail. Now a target as well she and her fearless best friend Morgan (Kate McKinnon) must go on the run across Europe. The hapless untrained pals team up with a British agent (Sam Heughan) who helps them navigate the world of international espionage. Directed and co-written by Susanna Fogel. Gillian Anderson and Hasan Minhaj co-star., , 22 Jump Street | Hot Pursuit | Get Smart | Bulletproof | Mr. Right | Thelma & Louise
https://www.allmovie.com/movie/super-troopers-2-v686524, Super Troopers 2, Comedy Crime, Comedy of Errors Police Comedy, Apr 20 2018, 9, USA, R, 6,  Drug Content Nudity Profanity Sexual Situations, Jay Chandrasekhar, Broken Lizard, Fox Searchlight, Gutbusters, Bumbling Cops, Canada comedy comedy-troupe sheriff, , In this sequel to the 2001 cult comedy Super Troopers dismissed Vermont Highway Patrol officers Thorny (Jay Chandrasekhar) Mac (Steve Lemme) Foster (Paul Soter) Rabbit (Erik Stolhanske) and Farva (Kevin Heffernan) get a chance to redeem themselves. The wacky crew is sent to a Canadian town that has been reclaimed by the United States after a recently discovered border error where they must win over the less-than-thrilled locals. Lynda Carter Brian Cox Rob Lowe and Will Sasso co-star. Directed by Jay Chandrasekhar. Written by the Broken Lizard comedy group., , Police Academy | The Naked Gun 33 1/3: The Final Insult | A Shot in the Dark | Police Academy 6: City Under Siege | Paul Blart: Mall Cop 2 | Hot Tub Time Machine 2
https://www.allmovie.com/movie/a-kid-like-jake-v686762, A Kid Like Jake, Drama, Fantasy Drama Message Movie Social Problem Film, Jun 1 2018, 9, USA, R, 6,  Profanity, Silas Howard, Bankside Films Burn Later Productions That's Wonderful Productions, IFC FIlms, Only Human, Fathers and Sons | Gender-Bending | Mothers and Sons | Parenthood, parent boy diversity transgendered upbringing, , Married couple Alex (Claire Danes) and Greg (Jim Parsons) are desperate to get their four-year-old son Jake into an extremely selective private kindergarten in New York and they are tempted to use his interest in traditionally feminine activities to pitch him as a transgender student. However this forces the pair to reflect on their own assumptions on gender and whether they should be defining their child's identity at so young an age. Octavia Spencer Ann Dowd Priyanka Chopra and Amy Landecker co-star. Directed by Silas Howard A Kid Like Jake was adapted from an off-Broadway play., , Lone Star | Ben-Hur | The Messenger | I Never Sang for My Father | The Southerner | The Best Years of Our Lives
https://www.allmovie.com/movie/a-futile-and-stupid-gesture-v657343, A Futile and Stupid Gesture, Comedy Drama Drama, Ensemble Film, , , USA, , 6, , David Wain, Abominable Pictures Principato-Young Entertainment, Netflix, Comedy on the Edge, Ladder to the Top, comedy humor jokes magazine satire subversive wit, , This biopic of American comedian Doug Kenney (Will Forte) depicts how he changed the landscape of comedy while battling his own personal demons. Kenney co-founded the iconic humor magazine National Lampoon in 1970 which eventually spawned a media empire that led to such films as Animal House and Caddyshack. Domhnall Gleeson Emmy Rossum Matt Walsh Natasha Lyonne Thomas Lennon Martin Mull Joel McHale and Seth Green co-star. Directed by David Wain (Wet Hot American Summer) A Futile and Stupid Gesture is based on the non-fiction book of the same name by Josh Karp., , The Blues Brothers | Wet Hot American Summer | Nashville | Boogie Nights | Short Cuts | American Graffiti
https://www.allmovie.com/movie/wildling-v701377, Wildling, Drama Horror Thriller, Creature Film Family Drama Fantasy Drama, Apr 13 2018, 9, USA, , 6, , Fritz Böhm, Filmgate Films Maven Pictures, IFC Midnight, , Discovering One's Heritage | Fantasy Life | Fathers and Daughters | Journey of Self-Discovery, secret-identity freedom girl monster self-discovery truth, , Director and co-writer Fritz Böhm’s debut feature film is a psychological thriller that pivots into creature horror. Bel Powley plays Anna a young girl locked away in an attic by her father to protect her from "the wildlings." When he commits suicide she is taken in by a kindly town sheriff (Liv Tyler). As Anna experiences puberty and explores an unfamiliar world she begins to unravel the horrifying secrets of her unusual past. Also starring Bel Powley Brad Dourif James Le Gros and Mike Faist., , Them! | Psycho | It's Alive! | The Monster Walks | There Will Be Blood | The Fighter
