https://www.allmovie.com/movie/afterimage-v668444, Afterimage, Drama, Biopic [feature], May 19 2017, 98, Poland, , 8, , Andrzej Wajda, Akson Studio, Film Movement, Triumph of the Spirit, Fighting the System, abstract-art art artist avant-garde Communism painting Polish [nationality], , Biopic of Polish avant-garde artist Wladyslaw Strzeminski (played here by Boguslaw Linda) whose abstract style brought him into conflict with his country's Communist authorities and their narrow-minded conception of what art should aspire to be. Directed by Andrzej Wajda (Ashes and Diamonds)., Boguslaw Linda | Aleksandra Justa | Szymon Bobrowski | Mariusz Bonaszewski | Krzysztof Pieczynski, Big Eyes | Mr. Turner | Lust for Life | Girl With a Pearl Earring | Goya's Ghosts | Sergeant York
https://www.allmovie.com/movie/glassland-v622873, Glassland, Drama, Family Drama, Feb 12 2016, 93, Ireland, NR, 7,  Adult Situations Alcohol Consumption Not For Children, Gerard Barrett / Gerard Barrett, Element Pictures, Film Movement, A Good Cry | Only Human, Alcoholism | All Washed Up | Dysfunctional Families | Mothers and Sons | Prostitutes | Redemption, alcoholic crime criminal rehabilitation [detox] taxi, , Troubled young taxi driver John (Jack Reynor) attempts to reunite his fractured family by forcing his mother (Toni Collette) to confront her debilitating alcohol addiction. John and his best friend (Will Poulter) soon delve deeper into the criminal underworld in order to pay for his mom's rehab in this family drama written and directed by Gerard Barrett., Jack Reynor | Will Poulter | Toni Collette | Michael Smiley, Crazy Heart | Half Nelson | Angela's Ashes | Barfly | 28 Days | When a Man Loves a Woman
https://www.allmovie.com/movie/under-the-gun-v648770, Under the Gun, Culture & Society, Law & Crime Tragedies & Catastrophes, May 13 2016, 110, USA, R, 7,  Adult Language, Stephanie Soechtig, Atlas Films, EPIX Lionsgate, Food for Thought, School Violence [k], ban debate gun-control law-enforcement legal-system legislation regulations weapons, , Stephanie Soechtig directed this look at America's reluctance to pass gun-control legislation despite the fact that mass shootings occur in the country on a near-daily basis. Katie Couric narrates the documentary which features interviews with families of the victims of recent shootings as well as NRA members and politicians involved in the debate., Katie Couric, Bowling For Columbine | Newtown | Gun Fight | Casino Jack and the United States of Money | O.J.: Made in America | Unprecedented: The 2000 Presidential Election
https://www.allmovie.com/movie/teenage-mutant-ninja-turtles-out-of-the-shadows-v621790, Teenage Mutant Ninja Turtles: Out of the Shadows, Action Adventure, Action Comedy Superhero Film, Jun 3 2016, 112, USA, PG13, 4,  Violence, Dave Green, Nickelodeon Movies Platinum Dunes, Paramount Pictures, Adrenaline Rush, Heroic Mission | Mutants | Protecting the Innocent | Vigilantes, big-city city crime crimefighter mutant Superhero turtle, , When the evil Shredder (Brian Tee) creates his own mutants Bebop and Rocksteady the Turtles must team up with April O'Neil (Megan Fox) news reporter Vern Fenwick (Will Arnett) and vigilante Casey Jones (Stephen Amell) to defend New York City from destruction. Leonardo Raphael Michelangelo and Donatello also face an impending invasion from the deranged extraterrestrial Krang in this sequel to 2014's Teenage Mutant Ninja Turtles. Dave Green directed this action comedy with Michael Bay serving as a producer., Megan Fox | Will Arnett | Stephen Amell | Laura Linney | Alan Ritchson | Noel Fisher | Pete Ploszek | Jeremy Howard | Tyler Perry | Tony Shalhoub | Brian Tee | Gary Anthony Williams | Peter D. Badalamenti | Brad Garrett | Opal Alladin | Brittany Ishibashi | Connor Fox | Alessandra Ambrosio | Greg Hildreth | Dean Winters | Antoinette Kalaj | Alice Callahan | Steve Lacy | Carmelo Anthony | Matt Barnes | Robert Clohessy | Alexis Suarez | Kevin Eastman, Hellboy II: The Golden Army | Who Framed Roger Rabbit | Pixels | Super | Teenage Mutant Ninja Turtles | Now Hiring
https://www.allmovie.com/movie/the-neon-demon-v629281, The Neon Demon, Horror Thriller, Crime Drama, Jun 24 2016, 117, Denmark France USA, R, 4,  Graphic Violence Nudity Profanity Strong Sexual Content, Nicolas Winding Refn, Gaumont Space Rocket Nation Wild Bunch, Amazon Studios Broad Green Pictures, Nail-biters, Betrayal | Fashion World | Wolf in Sheep's Clothing | Woman In Jeopardy, beauty [physical] coming-of-age greed loss-of-innocence model [fashion] moving production [showbiz], , An aspiring 16-year-old model (Elle Fanning) moves to Los Angeles where she quickly finds success after she is discovered by a makeup artist (Jena Malone) and signed by an agent (Christina Hendricks). However her beauty also draws the attention of lecherous men and provokes the jealousy of other women in showbiz. Bella Heathcote Abbey Lee and Keanu Reeves co-star. Directed by Nicolas Winding Refn The Neon Demon made its world premiere at the 2016 Cannes Film Festival., Elle Fanning | Jena Malone | Keanu Reeves | Christina Hendricks | Abbey Lee | Bella Heathcote | Desmond Harrington | Karl Glusman | Charles Baker | Chris Muto | Alessandro Nivola, Hollywoodland | Somewhere | The Black Dahlia | Psycho | Collateral | Panic Room
https://www.allmovie.com/movie/when-the-bough-breaks-v630059, When the Bough Breaks, Drama Horror Mystery, Marriage Drama, Sep 9 2016, 107, USA, PG13, 4,  Adult Situations Brief Nudity Profanity Sexual Situations Violence, Jon Cassar, Screen Gems Unique Features, Sony Pictures, Trashy, Split Personalities, attraction couple danger husband infatuation obsession surrogate, , A young woman agrees to be the surrogate for a married couple but she soon becomes infatuated with the household's father-to-be in this blend of horror and erotic drama. Although she initially seems stable and normal during an introduction with would-be parents John (Morris Chestnut) and Laura (Regina Hall) Anna (Jaz Sinclair) grows fixated on John and is willing to do whatever it takes to seduce him. Directed by Jon Cassar., Morris Chestnut | Regina Hall | Romany Malco | Glenn Morshower | Theo Rossi | Jaz Sinclair | GiGi Erneta | Tom Nowicki | Denise Gossett | Janee Michelle | Carrie Lazar | Matt Mitchell | Maurice Johnson | Ted Ferguson | Steve Terada | Brett Baker | Greg Rementer, Obsessed | Fear | North by Northwest | Psycho | Chinatown | Take Shelter
https://www.allmovie.com/movie/mothers-day-v639839, Mother's Day, Comedy Drama, Ensemble Film Family Drama, Apr 29 2016, 118, USA, PG13, 4,  Adult Situations Profanity, Garry Marshall, Capacity Pictures Gulfstream Pictures, Open Road Films, Only Human, Family Gatherings | Intersecting Lives | Mothers and Daughters | Mothers and Sons | Parenthood, , , This star-studded ensemble comedy tells a series of interlocking stories about motherhood. A divorced mother of two (Jennifer Aniston) falls for a guy with two kids of his own (Jason Sudeikis) a young woman (Britt Robertson) tries to find her biological mom (Julia Roberts) and an overstressed mother (Kate Hudson) is visited by her bickering parents. Mother's Day is the latest holiday-centric movie directed by Garry Marshall who previously helmed Valentine's Day and New Year's Eve., Jennifer Aniston | Kate Hudson | Julia Roberts | Jason Sudeikis | Timothy Olyphant | Hector Elizondo | Jack Whitehall | Shay Mitchell | Brandon Spink | Christine Lakin | Sarah Chalke | Ella Anderson | Margo Martindale | Jon Lovitz | Robert Pine | Aasif Mandvi | Cameron Esposito | Grayson Russell | Sandra Taylor | Gianna Simone | Loni Love | Sean O'Bryan | Ariana Neal | Kate Linder | Wedil David | Paul Vogt | Anoush Nevart | Drew Matthews | Matthew Walker | Donielle Artese, Terms of Endearment | Valentine's Day | I Remember Mama | Fiddler on the Roof | The Best Years of Our Lives | Life With Father
https://www.allmovie.com/movie/money-monster-v640350, Money Monster, Drama Thriller, Crime Thriller Media Satire, May 13 2016, 99, USA, R, 4,  Profanity Sexual Situations Violence, Jodie Foster, LStar Capital Smokehouse Pictures Village Roadshow Pictures, TriStar Pictures, Button Pushers, Class Differences | Hostage Situations | Out For Revenge | Race Against Time, , High Production Values, TV stock-market guru Lee Gates (George Clooney) and his producer Patty (Julia Roberts) are held hostage during a live broadcast by a man (Jack O'Connell) who lost his life's savings due to Gates' financial advice. The captor soon forces the pair to probe a conspiracy involving the global economy. Jodie Foster directed this thriller., George Clooney | Julia Roberts | Jack O'Connell | Dominic West | Caitriona Balfe | Giancarlo Esposito | Christopher Denham | Lenny Venito | Christopher Bauer | Dennis Boutsikaris | Emily Meade | Condola Rashad | Greta Lee | Aaron Yoo | Joseph D. Reitman | Olivia Luccardi | Robert C. Kirk | Genevieve Adams | Daoud Heidami | Anthony de Sando | Ivan Martin | John Ventimiglia | Dominic Colón | Cliff Moylan | Patricia Dunnock | Sahr Ngaujah | Makhaola Ndebele | Matt Walton | Katie McGee | Pun Bandhu | Nick Boraine | Jeff Witzke | Frank Pando | Katy Grenfell | Grant Rosenmeyer, Wall Street: Money Never Sleeps | Dog Day Afternoon | Inside Man | Collateral | North by Northwest | Gravity
https://www.allmovie.com/movie/incarnate-v640463, Incarnate, Horror Thriller, Supernatural Horror Supernatural Thriller, Dec 2 2016, 91, USA, PG13, 4,  Adult Situations Profanity Substance Abuse Violence, Brad Peyton, Blumhouse Deep Underground Films WWE Studios, BH Tilt High Top Releasing, Nail-biters, Demonic Possession | Psychic Abilities, boy demon demonic-possession evil exorcist murder psychic, , An unconventional exorcist (Aaron Eckhart) must use his psychic abilities to do battle with a malevolent demon that has taken over an innocent 11-year-old boy (David Mazouz). But he discovers he's up against a more formidable foe than he anticipated when it's revealed that the same malicious entity previously murdered his wife and child. Now he's in a race against time to defeat his worst enemy before it unleashes its wrath upon the entire world. Carice van Houten co-stars., Aaron Eckhart | Carice van Houten | David Mazouz | Keir O'Donnell | Emjay Anthony | Breanne Hill | Karolina Wydra | Mark Steger | Tomas Arana | Catalina Sandino Moreno | Matt Nable | Ashley Green Elizabeth | Petra Sprecher | John Pirruccello | Vera Miao | Josue Aguirre | M.D. Walton, Omen | Take Shelter | The Sixth Sense | Unfriended | Devil | Psycho
https://www.allmovie.com/movie/dirty-grandpa-v642994, Dirty Grandpa, Comedy, Odd Couple Film Road Movie, Jan 22 2016, 102, USA, R, 4,  Adult Humor Adult Language Adult Situations Alcohol Consumption Drug Content Not For Children Nudity Profanity Sexual Situations Smoking Substance Abuse Youth Substance Use, Dan Mazer, , Lionsgate, Comedy on the Edge, Eccentric Families | Generation Gap | Opposites Attract | Party Film, beach grandparent grandson lawyer perversion road-trip, , Straight-laced lawyer Jason (Zac Efron) goes on a road trip to Daytona Beach with his horndog grandfather Dick (Robert De Niro) who was recently widowed and is eager to party hard on spring break now that he's a single man. Along the way Dick prods Jason to let loose and have fun and tries to convince him that he shouldn't get married to his controlling fiancée (Julianne Hough). Aubrey Plaza Dermot Mulroney Zoey Deutch Jason Mantzoukas and Adam Pally co-star. Directed by Dan Mazer., Robert De Niro | Zac Efron | Julianne Hough | Aubrey Plaza | Dermot Mulroney | Adam Pally | Zoey Deutch | Jason Mantzoukas | Jeffrey Bowyer-Chapman | Brandon Mychal Smith | Michael Hudson | Mo Collins | Henry Zebrowski | Danny Glover | Catherine Dyer | Deena Dill | Michael H. Cole | Salley Hooks | Amy Parrish | Eugenia Kuzmina | Joshua Mikel | Stephanie Astalos-Jones | Chandler Darby | Shawn Shepard | Blaque Fowler | Nelson Bonilla, The Hangover | Bad Teacher | Bad Santa | Superbad | Grandma | Wedding Crashers
https://www.allmovie.com/movie/collide-v600263, Collide, Action Thriller, Action Thriller Chase Movie, Feb 24 2017, 99, Germany UK, PG13, 4,  Drug Content Profanity Sexual Situations Violence, Eran Creevy, Automatik Entertainment DMG Entertainment Silver Pictures Sycamore Pictures, Open Road Films, Adrenaline Rush, Americans Abroad | Daring Rescues | Lovers on the Lam | On the Run | Race Against Time, chase couple criminal Germany trip, , After a robbery goes awry a young man (Nicholas Hoult) must call on his drug-smuggling former boss (Ben Kingsley) to protect his girlfriend (Felicity Jones) from mobsters who want to kill both of them and retrieve their cargo. Anthony Hopkins co-stars. Directed by Eran Creevy., Nicholas Hoult | Ben Kingsley | Anthony Hopkins | Felicity Jones | Marwan Kenzari | Nadia Hilker | Clemens Schick | Christian Rubeck | Aleksandar Jovanovic | Johnny Palmiero | Erdal Yildiz | Joachim Krol | Christina Hecke, Torque | Breakdown | Gone In 60 Seconds | Bullitt | The Satan Bug | Jason Bourne
https://www.allmovie.com/movie/a-hologram-for-the-king-v583506, A Hologram for the King, Drama, Psychological Drama, Apr 22 2016, 98, USA, R, 4,  Drug Content Nudity Profanity Sexual Situations, Tom Tykwer, Playtone, Lionsgate Roadside Attractions Saban Films, In a Minor Key, Existential Crisis | Families in Crisis, bankruptcy businessperson foreclosure recession Saudi-Arabia tuition, , Director Tom Tykwer adapts Dave Eggers' best-selling novel in which an American businessman (Tom Hanks) travels to Saudi Arabia in an attempt to sell a holographic telecommunications system to the country's king. Desperate to make the deal in order to stay afloat in a failing economy he learns to navigate this unfamiliar culture with the help of a taxi driver (Alexander Black) and a local doctor (Sarita Choudhury). Ben Whishaw co-stars., Tom Hanks | Sarita Choudhury | David Menkin | Tom Skerritt | Tracey Fairaway | Ben Whishaw | Sidse Babett Knudsen | Dhaffer L'Abidine | Rolf Saxon | Janis Ahern | Jane Perry | Khalid Laith | Megan Maczko | Eric Meyers | Jon Donahue | Jeff Burrell | Michael Baral | Tamer Doghem, Anomalisa | Glengarry Glen Ross | Local Hero | Ordinary People | Lost in Translation | Ballast
https://www.allmovie.com/movie/independence-day-resurgence-v583977, Independence Day: Resurgence, Action Science Fiction, Alien Film Disaster Film Sci-Fi Action Space Adventure, Jun 24 2016, 120, USA, PG13, 4,  Profanity Sci-Fi Violence, Roland Emmerich, , 20th Century Fox, Adrenaline Rush, End of the World | Evil Aliens | Heroic Mission | Space Wars, alien [not human] assault attack defense [military] destruction humanity invasion technology, High Budget, Roland Emmerich returns to the helm for this long-awaited sequel to the 1996 blockbuster Independence Day. Fearful of another attack the nations of Earth have teamed up against their common enemy -- the extraterrestrials who brought humanity to the brink of extinction. Using recovered alien technology to bolster their defenses the alliance braces itself for another invasion. Jeff Goldblum and Bill Pullman reprise their roles from the original film while Liam Hemsworth Jessie Usher and Maika Monroe are among the new additions to the cast., Liam Hemsworth | Jeff Goldblum | Bill Pullman | Maika Monroe | Travis Tope | William Fichtner | Charlotte Gainsbourg | Judd Hirsch | Jessie Usher | Brent Spiner | Vivica A. Fox | Sela Ward | Grace Huang | Joey King | Ryan Cartwright | McKenna Grace | Alice Rietveld | Gbenga Akinnagbe | Joshua Mikel | Garrett Wareing | Monique Candelaria | James A. Woods | Morse Bicknell | Nicolas Wright | Alma Sisneros | Deobia Oparei | John Storey | Ron Yuan | Robert Neary | Hays Wellford | Travis Hammer | Stephen Oyoung | Beth Bailey | Brandon Hampton | Stafford Douglas | Sam Quinn | Jacob Browne | David Stanford | Mark S. Allen | David Grant Wright | Faber Dewar | Johnny Otto | Edward Duran, Battle: Los Angeles | Pacific Rim | Armageddon | 2012 | Cowboys & Aliens | Independence Day
https://www.allmovie.com/movie/the-5th-wave-v587281, The 5th Wave, Science Fiction, Sci-Fi Disaster Film Teen Movie, Jan 22 2016, 112, USA, PG13, 4,  Adult Situations Profanity Violence, J Blakeson, Columbia Pictures GK Films Material Pictures, Sony Pictures, Fantastic Reality, End of the World | Evil Aliens | Obsessive Quests | Post-Apocalypse | Sibling Relationships, alien [not human] Apocalypse brother crush girl invasion search zombie, , Based on the acclaimed 2013 young-adult sci-fi novel by Rick Yancey The 5th Wave follows a 16-year-old survivor of a catastrophic alien invasion. Cassie (Chloë Grace Moretz) is a high-school student leading a normal life including a crush on a football star (Nick Robinson) when extraterrestrials invade Earth and kill millions of humans. Now she must rescue her kidnapped brother (Zackary Arthur) while figuring out whom she can trust. Ron Livingston and Maggie Siff co-star as Cassie's parents. Directed by J Blakeson., Chloë Grace Moretz | Tony Revolori | Nick Robinson | Alex Roe | Liev Schreiber | Bailey Anne Borders | Ron Livingston | Maggie Siff | E. Roger Mitchell | Charmin Lee | Terry Serpico | Derek Roberts | Justin Smith | Maria Bello | Adora Dei | Alex Macnicoll | Nadji Jeter | Maika Monroe | Kendrick Cross | Chelsea Hayes | Michael Beasley, Maze Runner: The Scorch Trials | The Divergent Series: Insurgent | Divergent | Super 8 | 2012 | Cloverfield
https://www.allmovie.com/movie/london-has-fallen-v590860, London Has Fallen, Action Drama, Action Thriller, Mar 4 2016, 99, USA, R, 4,  Profanity Violence, Babak Najafi, Nu Image, Focus Features Gramercy Pictures, Adrenaline Rush, Heads of State | Hostage Situations | Terrorism, assassination politician President Secret-Service, Low Artistic Quality, In this sequel to the 2013 action thriller Olympus Has Fallen a terrorist plot unfolds in London as a number of politicians gather for the funeral of the British prime minister. A Secret Service agent (Gerald Butler) the U.S. president (Aaron Eckhardt) and an MI-6 operative (Charlotte Riley) must work together to stop the terrorists from assassinating the world's leaders and destroying the city's landmarks. Morgan Freeman Angela Bassett Melissa Leo Robert Forster and Sean O'Bryan co-star. Directed by Babak Najafi., Gerard Butler | Aaron Eckhart | Morgan Freeman | Melissa Leo | Angela Bassett | Charlotte Riley | Robert Forster | Jackie Earle Haley | Radha Mitchell | Sean O'Bryan | Waleed F. Zuaiter | Adel Bencherif | Mehdi Dehbi | Michael Wildman | Stacy Shane | Penny Downie | Patrick Kennedy | Colin Salmon | Deborah Grant | Andrew Pleavin | Nancy Baldwin | Nigel Whitmey | Sadao Ueda | Alex Giannini | Elsa Mollien | Jean Baptiste Fillon | Simon Connolly | Scott Sparrow | Ginny Holder | Terence Beesley | Bryan Larkin | Joe Fidler | Nikesh Patel | Lucy Newman Williams, White House Down | Air Force One | Murder at 1600 | Olympus Has Fallen | Speed | Live Free or Die Hard
https://www.allmovie.com/movie/american-pastoral-v603706, American Pastoral, Drama, Family Drama Period Film Political Drama, Oct 21 2016, 108, USA, R, 4,  Profanity Strong Sexual Content Violence, Ewan McGregor, Lakeshore Entertainment, Lionsgate, Food for Thought | Unloveables, Families in Crisis | Fathers and Daughters | Terrorism, bombing daughter father idyllic life man perfection responsibility terrorist Vietnam, , Ewan McGregor makes his directorial debut with this adaptation of Philip Roth's Pulitzer Prize-winning novel of the same name. McGregor plays Seymour "Swede" Levov a former high-school star athlete who seems destined for a charmed life after he inherits his father's business and weds an ex-beauty queen. Years later with the Vietnam War raging Levov's perfect world begins to fall apart when his activist daughter commits a heinous act of political terrorism. Dakota Fanning Jennifer Connelly Molly Parker Uzo Aduba Rupert Evans and David Strathairn co-star., Ewan McGregor | Jennifer Connelly | Dakota Fanning | Peter Riegert | Rupert Evans | David Strathairn | Molly Parker | Uzo Aduba | Valorie Curry | Mark Hildreth | Samantha Mathis | David Whalen | Tommy LaFitte | Peter Gannon | Emily Peachey | Jennifer Vos | Ron Emanuel, Reservation Road | Revolutionary Road | The Human Stain | The Fighter | Beirut | There Will Be Blood
https://www.allmovie.com/movie/barbershop-the-next-cut-v632612, Barbershop: The Next Cut, Comedy, , Apr 15 2016, 112, USA, PG13, 4,  Profanity Sexual Situations, Malcolm D. Lee, Cube Vision State Street Pictures, MGM New Line Cinema Warner Brothers, Gutbusters | Just for Fun, , , , In the latest installment of the hit comedy series Calvin (Ice Cube) Rashad (Common) Eddie (Cedric the Entertainer) and the rest of the crew at the barbershop are now working alongside a number of female hairdressers. Soon they are all forced to band together to stop the violence in their Chicago neighborhood and their plan includes brokering a truce among rival gangs and giving away free haircuts to promote their message of peace. Regina Hall Anthony Anderson Nicki Minaj Sean Patrick Thomas Eve Jazsmin Lewis J.B. Smoove Lamorne Morris Utkarsh Ambudkar Margot Bingham and Deon Cole co-star. Directed by Malcolm D. Lee., Ice Cube | Cedric the Entertainer | Regina Hall | Sean Patrick Thomas | Anthony Anderson | J.B. Smoove | Common | Nicki Minaj | Lamorne Morris | Eve | Utkarsh Ambudkar | Margot Bingham | Deon Cole | Troy Garity | Michael Rainey Jr. | Tyga | Jamal Woolard | Renell Gibbs | Charles Black | Jwaundace Candece | Rayan Lawrence | Brad Sanders | Anthony Dalton | Marcia Wright | Robert Crayton, 
https://www.allmovie.com/movie/the-wild-life-v645839, The Wild Life, Adventure, Adventure Comedy, , 91, Belgium France, PG, 4, , Vincent Kesteloot / Ben Stassen, StudioCanal, Summit Entertainment, Just for Fun, Talking Animals | Unlikely Friendships, animal cat cooperation human island sailor storm, , Daniel Defoe's classic tale of survival gets a twist in this family-friendly animated adventure. Restless parrot Mak and his animal pals are shocked when a ragged human known as Robinson Crusoe washes ashore on their tropical island. Although they are initially apprehensive of this strange new arrival they decide to team up with Crusoe to save their home from a pair of conniving cats. Directed by Vincent Kesteloot and Ben Stassen., Kirk Thornton | Michael Sorich | Yuri Lowenthal | Jeff Doucette | Joe Ochman | Lex Lang | Joey Camen | George Babbit | Kyle Hebert, Around the World in 80 Days | Pirates of the Caribbean: The Curse of the Black Pearl | Apollo 13 | Tag | King Kong | Pirates of the Caribbean: At World's End
https://www.allmovie.com/movie/outlaws-and-angels-v646673, Outlaws and Angels, Western, Outlaw (Gunfighter) Film Traditional Western, Jul 15 2016, 119, USA, R, 4,  Adult Language Graphic Violence Strong Sexual Content, JT Mollner, Burnt Pictures No Remake Pictures, Momentum Pictures, Nail-biters, Sheriffs and Outlaws, bounty family hunter marshal posse robbery romance stand-off, , Three outlaws go on the run after a bank robbery ends in bloodshed and the murder of a U.S. Marshal and eventually hide out at the home of a devoutly religious family. But as a determined bounty hunter (Luke Wilson) closes in on them a blossoming romance between the posse's leader (Chad Michael Murray) and the family's younger daughter (Francesca Eastwood) threatens to expose some depraved secrets. Teri Polo Frances Fisher Ben Browder Madisen Beaty Steven Michael Quezada and Keith Loneker co-star. This gritty Western written and directed by JT Mollner made its world premiere at the 2016 Sundance Film Festival., Chad Michael Murray | Francesca Eastwood | Luke Wilson | Teri Polo | Madisen Beaty | Ben Browder | Frances Fisher | Keith Loneker | Chris Ivan Cevic | Marty Lindsey | Steven Michael Quezada | Christopher Ranney | John Lombardo | Lela Rose Allen, Unforgiven | Slow West | The Duel | The Homesman | The Wild Bunch | True Grit
https://www.allmovie.com/movie/boo%21-a-madea-halloween-v650219, Boo! A Madea Halloween, Comedy, Holiday Film Screwball Comedy Slapstick, Oct 21 2016, 103, USA, PG13, 4,  Adult Situations Drug Content Profanity, Tyler Perry, Tyler Perry Studios, Lionsgate, Comedy on the Edge | Just for Fun, Dysfunctional Families | Nothing Goes Right, , , Take-no-prisoners matriarch Madea (Tyler Perry) battles ghouls and ghosts on Halloween night all while making sure a teenage relative doesn't sneak off to a frat party she's forbidden to attend. Perry also wrote directed and produced. Cassi Davis Patrice Lovely and Yousef Erakat co-star., Tyler Perry | Cassi Davis | Patrice Lovely | Bella Thorne | Kian Lawley | Jimmy Tatro | Joey Nappo | Angela Ray | Christine Horn | Jason Vail | Lavell Crawford | Corey Holcomb | Adele Givens | Coletrane Williams | Michael Hampton, Meet the Blacks | Tyler Perry's Diary of a Mad Black Woman | Madea's Big Happy Family | Armed and Dangerous | The Navigator | Man's Favorite Sport?
