https://www.allmovie.com/movie/ideal-home-v701540, Ideal Home, Comedy Drama, Family Drama, Jun 29 2018, 9, USA, NR, 6, , Andrew Fleming, Remstar Studios Baby Cow Films, Brainstorm Media, Just for Fun, Eccentric Families, family-dynamics gay/lesbian-rights homosexual life-changes challenge child couple, , Eccentric combative gay couple Paul (Paul Rudd) and Erasmus (Steve Coogan) balk when a boy named Bill arrives at their home claiming to be Erasmus's grandson. With his father (Jake McDorman) in jail responsibility for Bill falls on the two men who have no interest in changing their booze-soaked bohemian lifestyle -- until they begin to grow protective of their young ward and warm to the idea of forming a nontraditional family. Written and directed by Andrew Fleming. Kate Walsh and Alison Pill co-star., , Patrik 15 | Breakfast With Scot | The Savages | On Golden Pond | Captain Fantastic | To Kill a Mockingbird
https://www.allmovie.com/movie/believer-v703132, Believer, Action Adventure Crime, Crime Thriller, Jun 8 2018, 12, South Korea, , 6, , Lee Hae-young, Yong Film, Well Go USA, Button Pushers, Deal With the Devil | Drug Trade, cartel drug-dealer investigator police, , In this Korean remake of the 2012 Chinese film Drug War a relentless cop named Won-ho (Cho Jin-woong) makes a deal with a vengeful drug dealer named Rak (Ryu Jun-yeol) to infiltrate the operations of an enigmatic Korean cartel leader called Mr. Lee (Kim Joo-hyuk) who controls the Asian drug market. The further in Won-ho gets the less he knows who to trust in the vicious game he finds himself in. Directed by Lee Hae-Yeong. Kim Sung-ryung and Park Hae-jun co-star. The movie was Kim Joo-hyuk's final role before his 2017 death in a car accident., , Bloody Tie | A Dirty Carnival | The French Connection | Collateral | Filmworker | Superfly
https://www.allmovie.com/movie/death-of-a-nation-v708577, Death of a Nation, Culture & Society History, Politics & Government, Aug 3 2018, , USA, PG13, 6,  Drug Content Profanity Violence, Dinesh D'Souza, , Quality Flix, Food for Thought, Heads of State | Race Relations | Social Injustice, history political-parties politician politics presidency President US-Presidents, , Writer-director and conservative political commentator Dinesh D'Souza’s documentary draws a parallel between the controversial Trump presidency and the antagonism that President Abraham Lincoln faced from Democrats in 1860. Via historical recreations of pivotal moments in American history it challenges the widespread association of the American right (and Trump’s supporters) with racism white supremacy and fascism., , Hillary's America: The Secret History of the Democratic Party | Jimmy Carter Man From Plains | 11/8/16 | Gerrymandering | The Hunting of the President | Unprecedented: The 2000 Presidential Election
https://www.allmovie.com/movie/the-first-purge-v702979, The First Purge, Action Horror Science Fiction, Costume Horror Sci-Fi Action Sci-Fi Horror, Jul 4 2018, 9, USA, R, 6,  Drug Content Profanity Sexual Situations Violence, Gerard McMurray, Blumhouse Productions Perfect World Pictures, Universal Pictures, Adrenaline Rush, Crime Sprees | Crimes of Passion | Future Dystopias | Political Unrest, chaos crime-spree evil hideout killing murder purge victim, , This horror/action-adventure film from director Gerard McMurray serves as a prequel that recounts events that led up to the first Purge event. To push the crime rate below one percent for the rest of the year the New Founding Fathers of America (NFFA) test a sociological theory that vents aggression for one night in one isolated community. Starring Y'lan Noel Lex Scott Davis Steve Harris and Joivan Wade., , This Is Where I Leave You | The Purge: Anarchy | The Thing | Predator | Aliens | Alien: Covenant
https://www.allmovie.com/movie/westwood-punk-icon-activist-v693616, Westwood: Punk Icon Activist, Culture & Society Visual Arts, Beauty & Fashion Biography Social Issues, Jun 8 2018, 8, UK, NR, 6, , Lorna Tucker, Finished Films Roxanna Films, Greenwich Entertainment, Triumph of the Spirit, Fashion World | Fighting the System, fashion-industry business-life fashion-designer impressario New-Wave punk, , This documentary chronicles the life work and cultural impact of British punk fashion designer Dame Vivienne Westwood while also portraying the septuagenarian's efforts to incorporate environmental practices into her eponymous fashion label. Archival photographs and footage are interwoven with behind-the-scenes access and interviews with her industry contemporaries including supermodels Kate Moss and Naomi Campbell and former Vogue editor André Leon Talley. Directed by Lorna Tucker., , Valentino: The Last Emperor | Dior and I | Citizen Clark... A Life of Principle | The Gospel According to André | Born on the Fourth of July | Living in Emergency: Stories of Doctors Without Borders
https://www.allmovie.com/movie/deadpool-2-v654248, Deadpool 2, Action, Action Comedy, May 18 2018, 11, USA, R, 8,  Profanity Sexual Situations Violence, David Leitch, Donners' Company Kinberg Genre Marvel Entertainment, 20th Century Fox, Comedy on the Edge, Hotshots | Righting the Wronged, crime crime-prevention film jokes police vigilante wisecracker, , In this sequel irreverent warrior Deadpool (Ryan Reynolds) recruits mutant fighters Domino (Zazie Beetz) Bedlam (Terry Crews) and Shatterstar (Lewis Tan) to form an alliance he names the X-Force. Their mission is to protect a teenage boy from the wrath of the forceful Cable (Josh Brolin). Morena Baccarin Brianna Hildebrand and Bill Skarsgård also star. Directed by David Leitch., , The Green Hornet | Hancock | Green Lantern | They Call Me Jeeg | October Baby | Max 2: White House Hero
https://www.allmovie.com/movie/robin-williams-come-inside-my-mind-v697500, Robin Williams: Come Inside My Mind, Film TV & Radio, Biography, Jul 13 2018, 11, USA, , 7, , Marina Zenovich, Jigsaw Productions, , Comedy on the Edge, Actor's Life | Big Break | Creative Block | Work Ethics, acting actor comedian humor movie-star stand-up-comedy, , Emmy-winning director Marina Zenovich’s documentary aims to unpack the mystery of the late Robin Williams’ comedic genius. By drawing from interviews with Williams himself contemporaries such as Billy Crystal Whoopi Goldberg David Letterman and Steve Martin and his son Zak Williams it provides insight into his creative process his battle with drug use and alcoholism and his remarkably successful career as an entertainer., , Jackie Chan: My Stunts | Spellbound | Funny Girl | Stratton | Getting Grace | The Buddy Holly Story
https://www.allmovie.com/movie/the-rachel-divide-v702836, The Rachel Divide, Culture & Society, Race & Ethnicity, Apr 27 2018, 10, USA, , 7, , Laura Brownson, , Netflix, Button Pushers, Assumed Identities | Betrayal | Conspiracies | Keeping a Secret, activist African-American Civil-Rights controversy scandal, , This documentary spotlights Rachel Dolezal a white woman who was famously found to be lying about being African-American and a victim of hate crimes while serving as an Africana studies professor and NAACP branch president in Spokane Washington. Filmmaker Laura Brownson followed Dolezal and her sons for two years to explore her choice to continue to identify as a “transracial” African-American and how that’s affected her family., , The Agronomist | The Best Years of Our Lives | Beyond the Gates of Splendor | Buck | Erin Brockovich | Dances With Wolves
https://www.allmovie.com/movie/a-quiet-place-v683268, A Quiet Place, Horror, Sci-Fi Horror, Apr 6 2018, 9, USA, PG13, 8, , John Krasinski, Platinum Dunes Sunday Night, Paramount Pictures, Blood and Gore, Family Gatherings, horror-films mysterious-creatures creature family hunting killer residence silence sounds, , In this tense thriller set in the not-so-distant future a family must live in complete silence to avoid creatures that hunt through sound. The parents played by (John Krasinski and Emily Blunt) must come up with ingenious ways to protect their children and outsmart the terrifying monsters as they attempt to go about their daily lives. Directed by John Krasinski., , Hunter Prey | Aliens | The Poseidon Adventure | Gravity | Frankenstein | The Lost Weekend
https://www.allmovie.com/movie/ready-player-one-v628720, Ready Player One, Adventure Science Fiction, Family-Oriented Adventure Fantasy Adventure Sci-Fi Action Tech Noir, Mar 29 2018, 14, USA, PG13, 7,  Nudity Profanity Sci-Fi Violence, Steven Spielberg, Amblin Partners De Line Pictures Dune Entertainment Village Roadshow, Warner Bros. Pictures, Fantastic Reality | Other Dimensions, Bounty Hunters | Computer Paranoia | Future Dystopias | Priceless Artifacts and Prized Objects | Treasure Hunts | Virtual Reality, bounty-hunter challenge competition fortune [wealth] race [competition] virtual-reality, High Artistic Quality High Production Values, In a dystopian future people spend most of their time in a virtual-reality world called the OASIS. After its creator (Mark Rylance) dies he reveals he will leave his fortune to whomever can find a hidden Easter egg. Poor teen Wade Watts (Tye Sheridan) unlocks the first key to its location making him a target for an evil corporation also seeking the prize. Olivia Cooke Ben Mendelsohn Letitia Wright T.J. Miller Simon Pegg and Lena Waithe co-star. Directed by Steven Spielberg. Based on Ernest Cline's novel., , Logan's Run | Tron: Legacy | The Matrix | The Matrix Reloaded | Minority Report | Blade Runner
https://www.allmovie.com/movie/the-seagull-v658560, The Seagull, Drama, Melodrama Period Film, May 11 2018, 9, USA, PG13, 6,  Adult Situations Drug Content Nudity Violence, Michael Mayer, Mar-Key Pictures, Sony Pictures Classics, Estrogen Shot, Age Disparity Romance | Family Gatherings | Family Vacations | Non-Traditional Families, actress brother countryside neighbor play [drama] sister, , Aging actress Irina (Annette Benning) visits her family’s summer home with her son Konstantin (Billy Howle) who pines for the neighborhood girl Nina (Saoirse Ronan). When famous writer Boris Trigorin (Corey Stoll) drops by Nina finds herself enamored with him and ignoring Konstantin. Soon a love triangle unfolds amid family drama. Elisabeth Moss and Brian Dennehy also star. Based on Anton Chekhov’s play of the same name this film version was directed by Michael Mayer., , Amadeus | Gone With the Wind | Summer of '42 | The Little Foxes | The Magnificent Ambersons | A Month by the Lake
https://www.allmovie.com/movie/fahrenheit-11-9-v709676, Fahrenheit 11/9, Culture & Society, , Sep 21 2018, 12, USA, R, 6,  Profanity, Michael Moore, Midwestern Films Dog Eat Dog Films State Run Films, Briarcliff Entertainment, , , , , Writer-director Michael Moore’s documentary presents a provocative analysis of Trump’s America. It examines the socio-political factors that led to Donald Trump’s victory at the 2016 presidential election and explores possible exit points from a violent and politically divisive present. It features interviews with gun control advocate David Hogg and New York politician Alexandria Ocasio-Cortez., , 
https://www.allmovie.com/movie/operation-finale-v695119, Operation Finale, Drama Historical Film Thriller, Crime Drama, Aug 29 2018, 12, USA, , 6,  Adult Situations Profanity Violence, Chris Weitz, Automatik Entertainment, MGM, For Love of Country, On the Run, Holocaust Israel Nazi-hunter pursuit, , Director Chris Weitz’s historical thriller is based on the true story of how a group of Israeli secret agents arrested notorious SS officer Adolf Eichmann – the man who masterminded the “Final Solution” – in Argentina. Oscar Isaac plays the legendary Mossad agent Peter Malkin while Ben Kingsley plays his emotionally manipulative arch-nemesis. After tracking Eichmann down to Buenos Aires Malkin and his men captured him and brought him to Israel for a historic 8-month trial., , 
https://www.allmovie.com/movie/axl-v702885, A.X.L., Adventure Children's/Family Science Fiction, Family-Oriented Adventure Sci-Fi Adventure, Aug 24 2018, 10, USA, PG, 6,  Adult Situations Mild Language, Oliver Daly, Lakeshore Entertainment, Global Road Entertainment, Fantastic Reality, Robots and Androids, dog friendship robot, , In this action/adventure from director Oliver Daly a teenage boy stumbles upon a high-tech robotic dog named A.X.L. which turns out to be a lost military weapons project. After accidentally pairing with the device he realizes the dog is capable of emotions. He goes on the run to protect his new friend\ from the ruthless inventor who will stop at nothing to get his creation back. Starring Alex Neustaedter Becky G. Alex MacNicoll Dorian Kingi and Dominic Rains., , The Empire Strikes Back | Back to the Future | E.T. The Extra-Terrestrial | Alice in Wonderland | Return of the Jedi | Charlie and the Chocolate Factory
https://www.allmovie.com/movie/eighth-grade-v697266, Eighth Grade, Comedy Drama, Coming-of-Age Slice of Life, Jul 13 2018, 9, USA, R, 8,  Profanity Sexual Situations, Bo Burnham, , A24, Only Human, Body Image and Self-Esteem | Double Life | High School Life | Teen Angst, adolescent angst high-school Internet middle-school popularity suburbs teenagers, , In his feature film directorial debut comedian Bo Burnham deftly encapsulates the awkwardness angst self-loathing and reinvention that a teenage girl goes through on the cusp of high school. Given that the 27-year-old stand-up comic achieved fame as a teenager himself through YouTube by riffing on his insecurities he is uniquely capable as the film's writer and director to tell the story of Kayla an anxious girl navigating the final days of her eighth grade year despite creating a protagonist w female instead of male. Like Burnham did more than a decade ago 13-year-old Kayla turns to YouTube to express herself where she makes advice vlogs in which she pretends to have it all together. In reality Kayla is sullen and silent around her single father and her peers at school carrying out most of her interactions with her classmates on Instagram and Twitter. Her YouTube videos are a clever narrative tool that provide insight into her inner hopes and dreams much like an aspirational online diary. One of Eighth Grade's biggest triumphs is in its realism. Played with charm and delightful nuance by Elsie Fisher Kayla doesn't speak a single line that isn't peppered with "umm" "like" or "whatever." Her posture and gestures communicate how uncomfortable she is in her own skin. She has acne that she hides under makeup and Snapchat filters. Her attempts at depth in her videos are adorably off the mark such as her advice that "The hard part of being yourself is that it's not easy." Burnham's attention to detail helps weave a 2018-specific yet universally relatable image of teendom. Kayla stays up late scrolling through Buzzfeed quizzes and slime videos has a Hamilton calendar and Justin Bieber poster on her wall and signs off her videos with the slang term "gucci." Her middle school sex ed video includes an actress saying learning about puberty is "gonna be lit." The reference might be of the now but the feeling it conveys of adults awkwardly appropriating slang for their own agenda resonates no matter what era in which you came of age. Eighth Grade's unique skillfulness in communicating Kayla's inner life is often thanks to the film's sound and music teams. The three beeps of a Mac laptop's Photobooth application precede each of Kayla's vlog monologues. Enya's "Sail Away" provides a poignant soundtrack to Kayla escaping into the online world on her phone late at night. The score swelling to dramatic highs then abruptly stopping creates many of the film's laugh-out-loud moments and mirrors the emotional rollercoaster that is puberty. When Kayla attends a pool party she pauses just inside a sliding glass door nervously watching the scene outside while a Jaws-like theme plays. She finally reaches for the handle and the music cuts out right as the door sticks ruining her cinematic act of bravery. At one point Kayla gets the chance to hang out with some high school kids at the mall and one of them comments that kids Kayla's age are "wired differently" because they began interacting with social media at such a young age. However while Kayla does spend a majority of the film in the glow of her iPhone screen Eighth Grade illustrates that as much as things are different for the current tech-emersed generation of children their emotional evolution remains the same. Kayla must still navigate judgemental queen bees predatory popular boys clueless teachers and overprotective parents on her way to coming into her own. For anyone who's ever been an eighth grader Kayla's quiet journey of self-discovery and self-acceptance is encouraging and edifying., , The Perks of Being a Wallflower | The Breakfast Club | The Last Picture Show | Dude | Tiny Furniture | Good Will Hunting
https://www.allmovie.com/movie/skyscraper-v682344, Skyscraper, Action, Action Thriller, Jul 13 2018, 10, USA, PG13, 7,  Profanity Violence, Rawson Marshall Thurber, Flynn Picture Company Legendary Entertainment Seven Bucks Productions, Universal Pictures, In a Minor Key, Families in Crisis | Heroic Mission | Traitorous Spies/Double Agents, abduction attack building destruction family-in-danger federal-agent heist hero hostage inferno mayhem rescue security security-system trapped treachery, , Building security expert Will Sawyer (Dwayne Johnson) is blamed when the tallest most advanced building in the world located in Hong Kong bursts into flames. On the run from the police the former FBI agent and amputee must infiltrate the inferno to rescue his wife (Neve Campbell) and children trapped inside clear his name and find out the truth behind the attack on the skyscraper. Pablo Schreiber Noah Taylor Kevin Rankin Chin Han and Byron Mann co-star. Written and directed by Rawson Marshall Thurber., , Homefront | Live Free or Die Hard | A Good Day to Die Hard | Tears of the Sun | Stratton | Crimson Tide
https://www.allmovie.com/movie/duck-butter-v702088, Duck Butter, Comedy Drama Romance, Gay & Lesbian Films Romantic Comedy Romantic Drama, Apr 27 2018, 9, USA, , 6, , Miguel Arteta, Duplass Brothers Productions, The Orchard, In the Mood for Love, Forbidden Love | Questioning Sexuality | Women's Friendship, dating girlfriend intimacy lesbianism relationship, , Two young women Naima (Alia Shawkat) and Sergio (Laia Costa) who hit it off after meeting at a club concoct an experiment to foster genuine intimacy. The pair plan to spend 24 straight hours together and pledge 100 percent honesty though this arrangement proves more difficult than they expect to execute. Mae Whitman Hong Chau Kumail Nanjiani and Mark and Jay Duplass co-star. Directed by Miguel Arteta who co-wrote the screenplay with Shawkat., , Saving Face | Life Partners | The Workers Cup | As Good As It Gets | Mission Pays Basque | Citizen Jane: Battle for the City
https://www.allmovie.com/movie/the-predator-v603872, The Predator, Action Adventure Science Fiction, Action Thriller Sci-Fi Horror, Sep 14 2018, 10, Canada USA, R, 5,  Graphic Violence Profanity Violence, Shane Black, Davis Entertainment, 20th Century Fox, Adrenaline Rush, Evil Aliens, alien [not human] killing predators, , In this action/adventure a young boy accidentally triggers the return of Predators to Earth only now they are even stronger and more lethal after genetically upgrading themselves with DNA from other species in the universe. It's up to a ragtag group of ex-soldiers to stop them along with unexpected help from a disgruntled science teacher. Starring Boyd Holbrook Trevante Rhodes Jacob Tremblay and Keegan-Michael Key. Directed by Shane Black., , Aliens | Gravity | Starship Troopers 2: Hero of the Federation | The Bride of Frankenstein | I Am Number Four | Leviathan
https://www.allmovie.com/movie/extinction-v679731, Extinction, Action Fantasy Science Fiction Thriller, Sci-Fi Action, Jul 27 2018, 9, USA, , 4, , Ben Young, Mandeville Films Universal Pictures, Netflix, Fantastic Reality, Evil Aliens | Families in Crisis | Future Dystopias | Post-Apocalypse, abduction Apocalypse death-threat family-in-danger man-vs-aliens, , Director Ben Young’s sci-fi thriller features Michael Peña as a devoted husband and father who is plagued by recurring nightmares of apocalyptic proportions. When a hostile and violent alien invasion occurs he realizes that his dreams were premonitions that can help him save his wife (Lizzy Caplan) and his two young daughters., , Oblivion | 10 Cloverfield Lane | Children of Men | The Thing | The Terminator | Blade Runner
https://www.allmovie.com/movie/12-strong-v681695, 12 Strong, Drama War, Buddy Film War Adventure War Drama, Jan 19 2018, 13, USA, R, 5, , Nicolai Fuglsig, Alcon Entertainment Black Label Media Jerry Bruckheimer Films, Warner Bros. Pictures, For Love of Country, Behind Enemy Lines | Bodyguards | Military Life, Afghanistan behind-enemy-lines danger Special-Forces suicide-mission Taliban, High Budget, In the immediate aftermath of 9/11 a U.S. Special Forces unit undertake a dangerous mission in Afghanistan to strike back against the Taliban. There they find common allies among the Afghani people and must adapt to their new terrain by learning to fight on horseback. 12 Strong was directed by Nicolai Fuglsig and is based on the non-fiction book Horse Soldiers by Douglas Stanton. Chris Hemsworth Michael Shannon Michael Peña Trevante Rhodes Navid Negahban Elsa Pataky William Fichtner and Rob Riggle star., , The Hurt Locker | Jarhead | Green Zone | Sergeant York | All Quiet on the Western Front | Apocalypse Now
https://www.allmovie.com/movie/the-devils-doorway-v707029, The Devil's Doorway, Horror, Supernatural Horror, Jul 13 2018, 7, USA, , 5, , Aislinn Clarke, 23ten, IFC MIdinght, Eyepoppers, Demonic Possession, investigation miracle Vatican, , Director Aislinn Clarke’s debut feature film was inspired by the Magdalene Laundries in Ireland where “fallen women” were confined and exploited for their labor under directives from the Catholic Church between the 18th and 20th centuries. Set in 1960 in Northern Ireland this horror film follows Father Thomas Riley (Lalor Roddy) and Father John Thornto (Ciaran Flynn) as they investigate a reported miracle at a remote asylum. But instead of coming across a work of God they find evidence of abusive nuns and demonic forces running amok., , The Exorcist III | The Rite | Exorcist II: The Heretic | The Demon Within | Pet Sematary | Wes Craven's New Nightmare
https://www.allmovie.com/movie/hotel-transylvania-3-summer-vacation-v646151, Hotel Transylvania 3: Summer Vacation, Comedy, Family-Oriented Comedy, Jul 13 2018, 9, USA, PG, 5, , Genndy Tartakovsky, Sony Pictures Animation, Columbia Pictures Sony Pictures, Just for Fun, Family Vacations, animation cruise Dracula family hotel vacation voyage, , In the third installment of the Hotel Transylvania franchise the monster family embark on a vacation on a luxury monster cruise ship so Drac can take a summer vacation from providing everyone else's vacation at the hotel and they indulge in all of the shipboard fun the cruise has to offer from monster volleyball to exotic excursions as well as catching up on their moon tans. Directed by Genndy Tartakovsky. Starring the voices of Adam Sandler Andy Samberg Selena Gomez Kevin James David Spade Steve Buscemi Keegan-Michael Key Molly Shannon Fran Drescher and Mel Brooks., , Hotel Transylvania | Hotel Transylvania 2 | Spider-Man 2 | The LEGO Movie | The Princess Bride | Wallace & Gromit: The Curse of the Were-Rabbit
https://www.allmovie.com/movie/christopher-robin-v698460, Christopher Robin, Adventure Fantasy, Adventure Comedy Family-Oriented Adventure, Aug 3 2018, 12, USA, PG, 5, , Marc Forster, , Walt Disney Studios, Young and Old Alike, Starting Over | Toys Come to Life | Unlikely Friendships, facts-of-life friendship grown-ups imaginary-friend life-choices reunion teddy-bear, , Director Marc Forster helmed this live action movie that features English author A. A. Milne’s best loved characters as walking and talking stuffed animals. Ewan McGregor stars as a middle-aged Christopher Robin now burdened by an stultifying white collar job that prevents him from spending quality time with his family. Winne the Pooh Piglet Eeyore and Tigger venture from Hundred Acre Wood into London to turn his life around., , The Day After Tomorrow | Four Weddings and a Funeral | National Lampoon's Animal House | Hot Tub Time Machine 2 | Scary Movie 4 | Blade Runner
https://www.allmovie.com/movie/oceans-8-v645459, Ocean's 8, Action Comedy Thriller, Action Comedy Crime Comedy, Jun 8 2018, 11, USA, PG13, 5,  Drug Content Profanity, Gary Ross, Village Roadshow Pictures, Warner Bros. Pictures, Just for Fun, Jewel Theft, city necklace crew heist jewel-robbery thief women, , In this genderbent take on Ocean's 11 Debbie Ocean (Sandra Bullock) brother of Danny is released from prison after five years and immediately assembles an all-female crew with her best friend Lou (Cate Blanchett) to stage their greatest heist: stealing a $150 million necklace off the neck of actress Daphne Kluger (Anne Hathaway) at the Met Gala. Ocean must corral a jeweler (Mindy Kaling) a fashion designer (Helena Bonham Carter) a con artist (Awkwafina) a fence (Sarah Paulson) and a hacker (Rihanna) to pull off the job. Directed by Gary Ross. Richard Armitage and James Corden co-star., , The Italian Job | Beverly Hills Cop | Pink Cadillac | Mad Mission 3: Our Man from Bond Street | Date Night | Catastrópico
