https://www.allmovie.com/movie/tickled-v651873, Tickled, Culture & Society, Journalism Social Issues, Jun 17 2016, 9, New Zealand, R, 6,  Profanity, David Farrier / Dylan Reeve, MPI Media Group Ticklish Tale Limited, HBO Documentary Films Magnolia Pictures, Food for Thought, Blackmail | Bullies | Secret Organizations | Whistleblowers, , , Reporter-turned-documentarian David Farrier stumbles upon a bizarre secret society engaged in the production of "competitive endurance tickling" videos. When he reaches out for more information the organization responds with threats and harassment which prompts him and his filmmaking partner Dylan Reeve to investigate the truth behind this subculture., , Catfish | The Imposter | The Internet's Own Boy: The Story of Aaron Swartz | The Most Dangerous Man in America | The Insider | Brother's Keeper
https://www.allmovie.com/movie/dreamland-v656573, Dreamland, Drama, Coming-of-Age Romantic Drama, Nov 11 2016, 8, USA, , 6, , Robert Schwartzman, Beachwood Park Films Tilt/Shift Films, FilmBuff Orion Pictures, In a Minor Key, Age Disparity Romance, attraction brother courtship gig hotel musician piano romance, , A young pianist (Johnny Simmons) dreams of opening his own piano bar in Los Angeles but he's stymied by a lack of capital and his cluelessness about his future. A prime gig playing at a swanky hotel leads him to a generous cougar benefactor (Amy Landecker) who's happy to trade certain services for seed money. However his realization that she's married leads to a crisis of conscience. Dreamland marks the directorial debut of Robert Schwartzman the latest member of the Coppola dynasty to enter showbiz., , The Graduate | Rushmore | The Door in the Floor | In the Bedroom | Impromptu | A Tiger's Tale
https://www.allmovie.com/movie/born-in-china-v658068, Born in China, Nature, , Apr 21 2017, 7, China USA, G, 6, , Chuan Lu, Chuan Films, Disneynature Walt Disney Studios, , , , , This documentary from Disneynature follows three animal species in the wilds of China: A snow leopard tries to protect her two cubs from predators a golden snub-nosed monkey squabbles with his family and a panda mother cares for her child. Directed by Chuan Lu Born in China is narrated by John Krasinski., , Badlands | Bears | Ghost Bird | Born to Be Wild | Queen of the Sun | The Last Lions
https://www.allmovie.com/movie/almost-christmas-v632036, Almost Christmas, Comedy Drama, Ensemble Film Family-Oriented Comedy Holiday Film, Oct 4 2013, 11, USA, PG13, 6,  Adult Situations Drug Content Profanity, David E. Talbert, Will Packer Productions, Universal Pictures, Only Human, Dysfunctional Families | Family Gatherings, , , An African-American widower (Danny Glover) asks his family -- which includes his sassy sister-in-law (Mo'Nique) and four adult children (Kimberly Elise Romany Malco Gabrielle Union and Jessie Usher) as well as the latter's spouses and kids -- to join him for their first Christmas since his wife passed away. However having all of them under one roof leads to a number of personal confrontations as secrets are revealed and marriages are tested. Omar Epps J.B. Smoove Nicole Ari Parker John Michael Higgins Keri Hilson and DC Young Fly co-star. Written and directed by David E. Talbert (Baggage Claim)., , The Best Years of Our Lives | On Golden Pond | The Holly and the Ivy | Forrest Gump | The 12 Days of Christmas Eve | Yankee Doodle Dandy
https://www.allmovie.com/movie/trolls-v571273, Trolls, Children's/Family, Adventure Comedy Children's Fantasy Fantasy Comedy, Nov 4 2016, 9, USA, PG, 6,  Suitable for Children, Mike Mitchell, DreamWorks Animation, 20th Century Fox, Just for Fun, Journey of Self-Discovery | Mythical Creatures, adventure hair kingdom princess troll, , After a forest tribe of cotton-candy-colored shock-headed trolls discover that they're the new favorite gourmet treat for King Gristle (Christopher Mintz-Plasse) the unlikely duo of bubbly Poppy (Anna Kendrick) and worrywart Branch (Justin Timberlake) must rescue their friends from the royals' chef (Christine Baranski). Zooey Deschanel John Cleese and Jeffrey Tambor also lend their voices to this animated fantasy inspired by Danish woodcutter Thomas Dam's collectible dolls., , The Boxtrolls | Gnomeo & Juliet | The Smurfs 2 | Gnomes and Trolls | A Troll in Central Park | Gnomes
https://www.allmovie.com/movie/heal-the-living-v666228, Heal the Living, Drama, Family Drama Medical Drama, Apr 14 2017, 10, Belgium France, NR, 8,  Not For Children, Katell Quillevere, Ezekiel Film Production Frakas Prods Mars Films, Cohen Media Group, A Good Cry, Death of a Child, car-crash doctor/nurse heart-transplant hospital middle-age, , This ensemble drama weaves together the stories of a teen who gets into a serious car accident the teen's family and girlfriend the staff at a hospital and a middle-aged woman who needs a heart transplant. Tahar Rahim Emmanuelle Seigner Anne Dorval and Bouli Lanners star. Directed by Katell Quillévéré Heal the Living was adapted from a novel by Maylis De Kerangal., , Ordinary People | 21 Grams | The Sweet Hereafter | Return to Me | Welcome to the Rileys | Babel
https://www.allmovie.com/movie/burden-v656585, Burden, Culture & Society Visual Arts, Art History Performance Art, May 5 2017, 9, Belgium Sweden UK USA, , 7, , Richard Dewey / Timothy Marrinan, Submarine Entertainment, Magnolia Pictures, Food for Thought, , , , Profiling sculptor and modern artist Chris Burden perhaps best known for a series of dangerous performance-art pieces in the 1970s (including one in which he had a friend shoot him in the arm with a rifle). His later works also include a model city called "Metropolis II" and a series of restored street lamps called "Urban Light." Directed by Timothy Marrinan and Richard Dewey Burden made its world premiere at the 2016 Tribeca Film Festival., , The Art of the Steal | Marina Abramovic: The Artist Is Present | Tim's Vermeer | Basquiat | Frida | Mapplethorpe: Look at the Pictures
https://www.allmovie.com/movie/sultan-v640115, Sultan, Drama, Sports Drama, Jul 7 2016, 14, India, , 7, , Ali Abbas Zafar, , Yash Raj Films, Triumph of the Spirit, Underdogs, comeback dreams folklore hero journey Olympic-Games underdog wrestler, , This Bollywood drama follows the story of Sultan Ali Khan (Salman Khan) a wrestler who has earned a legendary reputation in his small hometown but who dreams of making it big by representing India at the Olympics. In order to achieve his goal Sultan must overcome numerous obstacles in his personal and professional lives. Directed by Ali Abbas Zafar Sultan co-stars Anushka Sharma as a female wrestler with a soft spot for the local hero., , Cinderella Man | Without Limits | Prefontaine | Downhill Racer | Chariots of Fire | Rocky
https://www.allmovie.com/movie/morris-from-america-v648846, Morris From America, Comedy Drama, Coming-of-Age Teen Movie, Aug 19 2016, 9, USA, R, 8,  Brief Nudity Profanity Sexual Situations Youth Substance Use, Chad Hartigan, Beachside Films Lichtblick Media, A24 DirecTV, Only Human | Pick-Me-Ups, Americans Abroad | Culture Clash | Fathers and Sons | First Love | Fish Out of Water | High School Life | Interracial/Cross-Cultural Romance | Musician's Life | Opposites Attract, African-American boy coming-of-age culture-shock father Germany rap-music, , In this coming-of-age comedy-drama a 13-year-old African-American boy named Morris (Markees Christmas) moves to Heidelberg Germany with his widower father (Craig Robinson). There he flirts with a classmate (Lina Keller) and deals with culture shock by immersing himself in hip-hop music. Written and directed by Chad Hartigan (This Is Martin Bonner)., , Dope | Love Beats Rhymes | The Perks of Being a Wallflower | Breaking Away | Pretty in Pink | Valley Girl
https://www.allmovie.com/movie/creepy-v660255, Creepy, Horror Thriller, Slasher Film, Oct 21 2016, 13, Japan, NR, 8,  Graphic Violence, Kiyoshi Kurosawa, Asmik Ace Kinoshita Group Shochiku Co, Kimstim Films, Blood and Gore | Nail-biters, Dangerous Friends | Missing Persons | Murder Investigations | Mysterious Strangers | Woman In Jeopardy, disappearance family family-secrets investigation neighbor police-detective, , Former police detective Koichi Takakura (Hidetoshi Nishijima) is asked to help with a cold case involving a family's disappearance. Meanwhile Takakura's wife (Yuko Takeuchi) befriends a neighbor (Teruyuki Kagawa) unaware that he and his family are not what they appear to be. Directed by Kiyoshi Kurosawa (Tokyo Sonata Pulse) this horror thriller is based on a novel by Yutaka Maekawa., , Disturbia | Paranormal Activity 4 | What Lies Beneath | Lakeview Terrace | Fright Night | The Stepford Wives
https://www.allmovie.com/movie/nuts%21-v648828, Nuts!, Culture & Society, Biography, Jul 8 2016, 7, USA, , 8, , Penny Lane, Cartuna Gland Power Films, Amazon Studios mTuckman Media, Button Pushers | Food for Thought, Fighting the System | Inventors | Rags To Riches | Success is the Best Revenge | Underdogs, , , This animated documentary tells the story of John Romulus Brinkley a Depression-era doctor who claimed he had found a cure for male impotence involving goat testicles. Brinkley soon built a radio station in order to hawk his unusual remedy leading the American Medical Association and the federal government to attempt to shut him down. Directed by Penny Lane., , Vernon Florida | This Ain't No Mouse Music! | Tabloid | Bonnie and Clyde | A League of Ordinary Gentlemen | American Movie
https://www.allmovie.com/movie/the-happiest-day-in-the-life-of-olli-m%C3%A4ki-v658933, The Happiest Day in the Life of Olli Mäki, Drama, , Apr 21 2017, 9, Finland, , 8, , Juho Kuosmanen, Aamu Film Company Film Väst One Two Films, MUBI, , , , , This sports biopic follows Finnish boxer Olli Mäki (Jarkko Lahti) as he prepares for a world title bout against American featherweight champ Davey Moore in 1962. While Mäki is excited for this shot at fame and glory he worries that his training and the media attention are getting in the way of his blossoming romance with a woman named Raija (Oona Airola). Directed by Juho Kuosmanen., , 
https://www.allmovie.com/movie/lights-out-v645093, Lights Out, Horror, Supernatural Horror, Jul 22 2016, 8, USA, PG13, 6,  Adult Situations Drug Content Violence, David F. Sandberg, Atomic Monster Productions Grey Matter Productions RatPac-Dune Entertainment, New Line Warner Bros., Nail-biters, Ghosts | Protecting the Innocent | Woman In Jeopardy, boy death evil-spirit father fear haunted sister supernatural woman, , A young woman (Teresa Palmer) must protect her brother (Gabriel Bateman) from a terrifying apparition that only manifests in total darkness. Later she realizes that this fearsome entity is connected to her mentally ill mother (Maria Bello) who has started hallucinating conversations with a mysterious figure named Diana. Billy Burke and Alexander DiPersia co-star. Produced by James Wan (The Conjuring) Lights Out is a feature-length expansion of director David F. Sandberg's short film of the same name which became a viral sensation online., , The Conjuring | Mama | The Babadook | The Conjuring 2 | The Ring | Insidious
https://www.allmovie.com/movie/norman-lear-just-another-version-of-you-v648774, Norman Lear: Just Another Version of You, Culture & Society Film TV & Radio, Biography Film & Television History, Jul 8 2016, 9, USA, , 6, , Heidi Ewing / Rachel Grady, Loki Films Thirteen / WNET, Music Box Films, Memory Lane, Culture Clash | Life in the Arts | Race Relations | Writer's Life, , , This documentary profiles legendary TV mogul Norman Lear best known for creating a number of groundbreaking 1970s sitcoms (All in the Family Sanford and Son The Jeffersons One Day at a Time Maude Good Times) that plumbed the cultural changes roiling the country. The film uses the recurring motif of a theater filled with television screens as a means to explore Lear's personal life his work and his impact on American society. Directed by Heidi Ewing and Rachel Grady., , Joan Rivers: A Piece of Work | Johnny Carson: King of Late Night | Mel Brooks: Make a Noise | Detropia | The Robin Harris Story: We Don't Die We Multiply | By Sidney Lumet
https://www.allmovie.com/movie/snowden-v624370, Snowden, Drama, Biopic [feature] Political Drama, Sep 16 2016, 13, France Germany USA, R, 6,  Nudity Profanity Sexual Situations, Oliver Stone, Endgame Entertainment KrautPack Entertainment Wild Bunch, Open Road Films, Off the Beaten Path, Fighting the System | Political Corruption | Whistleblowers, betrayal controversial government informer investigation secrets spy surveillance top-secret whistleblower, High Artistic Quality, Oliver Stone directed this docudrama about whistle-blower Edward Snowden who decided to leak classified information from the NSA in order to expose a massive covert surveillance program orchestrated by the U.S. government. The film traces Snowden's career in both the NSA and CIA as he becomes disillusioned with his work and receives support from his idealistic girlfriend (Shailene Woodley). Rhys Ifans Nicolas Cage Melissa Leo Zachary Quinto and Tom Wilkinson co-star., , W. | Born on the Fourth of July | Blackhat | In the Valley of Elah | The Net | Citizenfour
https://www.allmovie.com/movie/kubo-and-the-two-strings-v622683, Kubo and the Two Strings, Fantasy, Fairy Tales & Legends Fantasy Adventure, Aug 19 2016, 10, USA, PG, 8,  Adult Situations, Travis Knight, LAIKA, Focus Features, Just for Fun | Other Dimensions, Curses and Spells | Discovering One's Heritage | Fantasy Lands | Great Battles | Heroic Mission | Journey of Self-Discovery | Mothers and Sons | Mythical Creatures | Protecting the Innocent | Unlikely Heroes | Wizards and Magicians, academy ancient boy courage evil grandfather Japan journey knight medieval story, , After accidentally summoning an ancient spirit a young Japanese boy named Kubo (voiced by Art Parkinson) is separated from his mother and embarks on a journey to discover the truth about his missing father. Along the way he befriends the kindhearted Monkey (Charlize Theron) and the clumsy Beetle (Matthew McConaughey) as he fends off the vengeful Moon King (Ralph Fiennes) and two evil twin sisters (Rooney Mara) with his shamisen a magical stringed instrument. This stop-motion-animated adventure from Laika was directed by Travis Knight., , The Little Prince | Pete's Dragon | The Boxtrolls | The Wizard of Oz | Beauty and the Beast | Where the Wild Things Are
https://www.allmovie.com/movie/white-girl-v648839, White Girl, Drama, Urban Drama, Sep 2 2016, 8, USA, , 7, , Elizabeth Wood, Bank Street Films Killer Films Supermarché Productions, FilmRise, Carnal Knowledge | In a Minor Key, Dangerous Attraction, arrest attraction cocaine college drug-dealer stash student, , Streetwise college student Leah (Morgan Saylor) becomes romantically involved with a charming drug dealer named Blue (Brian "Sene" Marc) in New York City but their fast life of luxury comes crashing down when Blue is arrested and Leah is left with his large stash of cocaine. Elizabeth Wood made her feature directorial debut with this gritty urban drama which received its world premiere at the 2016 Sundance Film Festival., , Drugstore Cowboy | High Art | Less Than Zero | The Wackness | Blow | Midnight Cowboy
https://www.allmovie.com/movie/tallulah-v648840, Tallulah, Drama, , , 11, USA, , 6, , Sian Heder, Maiden Voyage Ocean Blue Entertainment Route One Entertainment, Netflix, , , , , After her boyfriend's estranged mother (Allison Janney) refuses to help her a young homeless woman (Ellen Page) has a chance encounter with an overwhelmed new mom (Tammy Blanchard). Sensing opportunity she absconds with the unwanted toddler and returns to her boyfriend's mother with the story that the baby is her grandchild. The debut feature from writer/director Sian Heder (Orange Is the New Black) Tallulah made its world premiere at the 2016 Sundance Film Festival., , 
https://www.allmovie.com/movie/our-kind-of-traitor-v623537, Our Kind of Traitor, Thriller, Political Thriller, Jul 1 2016, 10, France UK, R, 6,  Drug Content Nudity Profanity Sexual Situations Violence, Susanna White, Film4 StudioCanal The Ink Factory, Lionsgate Roadside Attractions, Nail-biters, Conspiracies | Political Corruption, alliance couple espionage government intelligence [gov't] kingpin secret-agent, , An English couple vacationing in Morocco (Ewan McGregor and Naomie Harris) are approached by a money launderer for the Russian mob (Stellan Skarsgård) who asks for their help in defecting to British Intelligence. Damian Lewis co-stars as the MI6 agent handling their case who realizes that the mob has links to several prominent British politicians. Directed by Susanna White Our Kind of Traitor is based on the novel of the same name by legendary author John Le Carré., , Three Days of the Condor | The Ides of March | Enemy of the State | The American | The Manchurian Candidate | JFK
https://www.allmovie.com/movie/moka-v663343, Moka, Drama, , Jun 14 2017, 8, France Switzerland, , 7, , Frédéric Mermoud, Diligence Films Tabo Tabo Films, Film Movement, , , , , A grieving mother (Emmanuelle Devos) decides to investigate the hit-and-run accident that killed her son after the police are unable to find any leads. When she tracks down those responsible -- a couple (Nathalie Baye and David Clavel) living in the French spa town of Évian -- she insinuates herself into their lives as she plots her next move. Directed by Frédéric Mermoud Moka is based on a novel by Tatiana de Rosnay., , 
https://www.allmovie.com/movie/keep-quiet-v656132, Keep Quiet, Culture & Society, , Feb 10 2017, 9, Hungary UK, , 8, , Sam Blair / Joseph Martin, AJH Films KUK Films Passion Pictures, Kino Lorber, , , , , Profiling Hungarian politician Csanad Szegedi a member of the right-wing anti-Semitic party Jobbik who discovered that his family was Jewish in 2012. Szegedi was a Holocaust skeptic until this revelation which prompted him to leave Jobbik and convert to Orthodox Judaism. Directed by Joseph Martin and Sam Blair Keep Quiet premiered at the 2016 Tribeca Film Festival., , 
https://www.allmovie.com/movie/julieta-v654903, Julieta, Drama, Family Drama Melodrama, Dec 21 2016, 9, Spain, R, 7,  Nudity Sexual Situations, Pedro Almodóvar, Echolake Entertainment El Deseo FilmNation Entertainment, Sony Pictures Classics, Estrogen Shot | Only Human, Estrangement | Mothers and Daughters | Redemption, , High Artistic Quality, Middle-aged Julieta (Emma Suarez) learns via a chance meeting with an acquaintance that her long-lost daughter has resurfaced in Madrid. This revelation forces her to reflect on her checkered past as she recalls the moments of pain that defined her current life. This drama was directed by Spanish master Pedro Almodóvar and was adapted from three short stories by acclaimed author Alice Munro., , The Joy Luck Club | Terms of Endearment | Away From Her | Volver | Talk to Her | Rain Man
https://www.allmovie.com/movie/scarred-hearts-v669503, Scarred Hearts, Drama, , , 14, Germany Romania, , 7, , Radu Jude, Komplizen Film, Big World Pictures, , , , , A young Romanian man (Lucian Teodor Rus) with spinal tuberculosis is sequestered in a sanitorium and confined to his bed in 1937. While conflict builds outside of his confines inside he is able to find friendship fall in love with a fellow patient and discover the dark comedy in illness and death. Based on the autobiographical novel of the same name by Romanian writer Max Blecher. Written and directed by Radu Jude., , One Flew Over the Cuckoo's Nest | M*A*S*H | Magnificent Obsession | Sicko | The Cider House Rules | The Story of Louis Pasteur
https://www.allmovie.com/movie/staying-vertical-v658612, Staying Vertical, Comedy Drama, Slice of Life, Jan 20 2017, 9, France, NR, 7, , Alain Guiraudie, Arte France Cinéma Les Films du Worso, Strand Releasing, In a Minor Key, Fathers and Sons | Journey of Self-Discovery, attraction child father filmmaker France free-spirit shepherd wolf, , Seeking inspiration in rural southern France filmmaker Leo (Damien Bonnard) attempts to track down a wolf but instead is seduced by a free-spirited shepherdess named Marie (India Hair). Their fling produces a child but Marie lacking faith in Leo's prospects as a partner abandons both of them leaving the young artist to care for the baby by himself. Written and directed by Alain Guiraudie (Stranger by the Lake)., , Toni Erdmann | Personal Shopper | Graduation | No Rest for the Brave | The Sound of Music | My Fair Lady
https://www.allmovie.com/movie/for-the-love-of-spock-v631281, For the Love of Spock, Film TV & Radio, Biography Film & Television History, Sep 9 2016, 11, Canada USA, , 7, , Adam Nimoy, 455 Films, Gravitas Ventures, Pick-Me-Ups, Actor's Life | Life in the Arts, actor career fan [devotee] life, , A look back at the life and career of actor Leonard Nimoy who passed away in 2015 includes interviews with his friends and former co-stars. This documentary also explores Nimoy's interactions with fans who loved his portrayal of Mr. Spock in the Star Trek franchise. Directed by his son Adam Nimoy For the Love of Spock is narrated by Zachary Quinto who plays the title character in the most recent Star Trek films., , Trekkies 2 | Trekkies | Trek Nation | William Shatner's Get a Life! | The Captains | William Shatner's Star Trek Memories
https://www.allmovie.com/movie/lou-andreas-salom%C3%A9-the-audacity-to-be-free-v663385, Lou Andreas-Salomé The Audacity to be Free, Drama Romance, Biopic [feature] Inspirational Drama Romantic Drama, Apr 27 2018, 11, Austria Germany Italy Switzerland, NR, 6, , Cordula Kablitz-Post, Avanti Media Fiction Tempest Film, Cinema Libre Studio, Triumph of the Spirit, Mentors | Romantic Misunderstandings | Writer's Life, author psychiatrist psychoanalysis romance woman writer, , Female Russian-German writer Lou Andreas-Salomé (Katharina Lorenz) bucks 19th-century gender conventions in her intellectual pursuits attracting the admiration of her famed male contemporaries including Friedrich Nietzsche (Alexander Scheer) Sigmund Freud (Harald Schrott) and poet Rainer Maria Rilke (Julius Feldmeier). With Freud as her mentor she defies society’s expectations to become the world’s first female psychoanalyst. Directed by Cordula Kablitz-Post., , A Dangerous Method | Don't Worry He Won't Get Far on Foot | Mary Shelley | The Theory of Everything | Mad to Be Normal | Ray
https://www.allmovie.com/movie/i-called-him-morgan-v667211, I Called Him Morgan, Music, , Mar 31 2017, 9, Sweden USA, , 9, , Kasper Collin, Kasper Collin Produktion Passion Pictures Sphinx Productions, Submarine Deluxe, , , , , Kasper Collin directed this documentary look at the life of jazz trumpeter Lee Morgan whose prolific career was cut short when he was murdered by his common-law wife Helen in 1972. Morgan's musical accomplishments and relationship with Helen are retold through extensive archival footage., , We Are the Giant | Super Dark Times | The Final Year | No End in Sight | The Tillman Story | S21: The Khmer Rouge Killing Machine
https://www.allmovie.com/movie/the-student-v658930, The Student, Drama, Coming-of-Age, Apr 21 2017, 11, Russia, , 8, , Kirill Serebrennikov, Hype Film, Under the Milky Way, Abandon All Hope, Innocence Lost, curiosity [inquisitiveness] education high-school knowledge questioning [inquisitiveness] student teacher, , Convinced that Armageddon is near a Russian high-school student (Petr Skvortsov) clashes with authority figures aggravates classmates with his far-right views on morality and evolution and proselytizes his Christian doctrine at any cost. His crusade leads to a confrontation with his Jewish atheist science teacher (Victoria Isakova) who refuses to be bullied., , American Graffiti | Charlie Bartlett | Donnie Darko | The Tribe | Playing the Victim | Betrayal
https://www.allmovie.com/movie/a-stray-v655003, A Stray, Drama, , Oct 21 2016, 8, USA, , 8, , Musa Syeed, A Stray Production Silver Sound, IFP Screen Forward, , , , , A Somali man living in Minneapolis (Barkhad Abdirahman) is allowed to stay at a local mosque when he has nowhere else to go. But he risks losing this shelter as well when he decides to take in a stray dog which his fellow Muslims consider "impure." Written and directed by Musa Syeed A Stray made its world premiere at the 2016 South by Southwest Film Festival., , 
https://www.allmovie.com/movie/blue-jay-v665267, Blue Jay, Drama Romance, Romantic Drama, Oct 7 2016, 8, USA, NR, 7, , Alexandre Lehmann, Duplass Brothers, Netflix The Orchard, A Good Cry | Only Human, Brief Encounters | Coming Home | First Love | Haunted By the Past | Innocence Lost | Lovers Reunited | Midlife Crises, high-school hometown relationship sweetheart visit, , Two former high-school sweethearts (Mark Duplass and Sarah Paulson) reunite for the first time in 22 years when they bump into each other during a visit to their hometown. They decide to catch up and in the process they reflect on the reasons why their relationship soured. Directed by Alexandre Lehmann and written by Duplass Blue Jay made its world premiere at the 2016 Toronto International Film Festival., , Before Sunset | The Umbrellas of Cherbourg | All the Real Girls | The Big Chill | The Overnight | Good Will Hunting
